,id,title,link,published,source,summary,query,target_date,ticker,fetched_at,actual_link,full_text,summary_len,text_len,published_dt
201,4a7e0e6411a59773db6425c3a7170447ed59d04f84885e634ff802573e3e9bd4,TRUMP Token Price Tanks 5% as $24M Tokens Shifted to CEXs Ahead of Trump Dinner - Coinspeaker,https://news.google.com/rss/articles/CBMihwFBVV95cUxNNlR6dEl1Zm0ydThKRW8yVlFyamNCTVpxVjVRaV91NTZQME5SdXFoaHgwRi02aWpYSHFUcFI0SEgwOTRXTUViVmJRZFFqSXVBYkIzRXRwcHRCbTd5cmN3LTVza3lhanludkE2SXdLTS1GWDNXOXJMbGo5d0RFYTFzY0RUV3RRZXPSAYwBQVVfeXFMTzE2RTRyZ01peF8wZGdyaGxxYXJxYVhQYURsQ0c4aGFvNllHb1BJQ3JXbTU0NmdjcmZSdG5mTUZ1bXp2R25LTm9rdXhGbEYxZUpadUFnb2RkbUx1NVBRbkVVSi1MUm1PX01wZ2tvNVhRZ2hYSVozMjFNMkNaazRRSEtvM2Q3VXdMLWZTTnY?oc=5,"Tue, 29 Apr 2025 07:00:00 GMT",Coinspeaker,"The TRUMP team deposited $19.6 million worth of tokens across major centralized exchanges, including Binance, OKX, and Bybit, with a wallet linked to the $TRUMP team depositing 1,346,000 $TRUMP($19.58M) into #Binance, #OKX, or #Bybit 9 hours ago, resulting in over $24 million in token deposits, while Bollinger Bands (BB) are beginning to squeeze, indicating weakening support.","(""Bank of New York Mellon"" OR ""BNY"") -gossip -celebrity -""fantasy sports"" -""game recap""",2025-04-28,BNY,2026-01-26T17:14:58.149184-05:00,https://www.coinspeaker.com/trump-token-tanks-5-percent-24m-tokens-shifted-cexs/,"A crypto journalist with over 5 years of experience in the industry, Parth has worked with major media outlets in the crypto and finance world, gathering experience and expertise in the space after surviving bear and bull markets over the years. Parth is also an author of 4 self-published books.
Key Notes
- The TRUMP development team transferred $19.6 million worth of tokens to major exchanges.
- Market maker Cumberland DRW made a transfer of 300,000 TRUMP tokens to the OKX exchange.
- The dumping closely precedes the high-profile dinner with top TRUMP holders to be held on May 22.
US President Donald Trump‘s Official Trump TRUMP $4.79 24h volatility: 1.2% Market cap: $958.52 M Vol. 24h: $157.46 M token, which had recently skyrocketed following the hype surrounding a private dinner invitation with the POTUS, has come under severe pressure after a massive token dump by insiders.
At press time, the TRUMP token trades at a 5% loss, driven by a confluence of bearish catalysts, including over $24 million in combined token offloading by the team and market makers.
TRUMP Team and Cumberland Flood the Market
According to on-chain analytics from Lookonchain, wallets linked to the TRUMP team deposited $19.6 million worth of tokens across major centralized exchanges, including Binance, OKX, and Bybit.
A wallet linked to the $TRUMP team deposited 1,346,000 $TRUMP($19.58M) into #Binance, #OKX, and #Bybit 9 hours ago.https://t.co/Mkk5VIjIFW pic.twitter.com/G4cuIBrQVq
— Lookonchain (@lookonchain) April 29, 2025
The breakdown:
- Binance: 700,000 TRUMP tokens, worth approximately $10.21 million
- OKX: 350,000 tokens, valued at $5.1 million
- Bybit: 296,000 tokens, totaling around $4.3 million
Adding to the sell pressure, prominent market maker Cumberland DRW transferred an additional 300,000 TRUMP tokens to OKX, amounting to $4.4 million.
Combined, this represents over $24 million in token deposits, a move that has triggered panic among retail holders. The timing, just weeks ahead of the high-profile May 22 dinner, has amplified concerns that insiders may be exiting.
Notably, Democratic US Senators Adam Schiff and Elizabeth Warren have formally requested an ethics inquiry into the private dinner hosted by Trump for TRUMP token holders.
Their April 25 letter to Office of Government Ethics Director Jamieson Greer highlights that the dinner, which coincided with a sharp price rally, may have misled investors and influenced financial markets.
Technical Analysis: Signs of Exhaustion and Bearish Reversal
As of press time, TRUMP trades at $14.11, down from a recent high of $15.59. The token has breached key support at the 0.618 Fibonacci retracement level ($14.12) and is now flirting with the 0.786 level at $13.78.
If it fails to hold here, the next major downside target lies at the 1.618 Fib extension around $11.86, followed by deeper support at $9.56 and $7.26.
The Relative Strength Index (RSI) has dropped to 62.59, cooling off from its recent overbought levels above 80. This RSI divergence suggests bullish momentum is fading. A drop below 50 could confirm a stronger bearish breakdown.
Meanwhile, Bollinger Bands (BB) are beginning to squeeze, signaling declining volatility and the potential for a decisive move. Price action breaking below the mid-band (20 SMA), currently at $14.02, hints at weakening support.
A bullish scenario would require TRUMP to reclaim the upper Fib levels, particularly the $15.00–$15.59 zone. A close above this resistance could open the door to new highs.
Disclaimer: Coinspeaker is committed to providing unbiased and transparent reporting. This article aims to deliver accurate and timely information but should not be taken as financial or investment advice. Since market conditions can change rapidly, we encourage you to verify information on your own and consult with a professional before making any decisions based on this content.",378,3905,2025-04-29
136,4b2e036822bca6e3d42680a427fb88782dae1980eca140a978c1e4a06d469dd1,Top U.S. Banks Embrace Technology to Enhance Operational Efficiency in Q1 2025 - The National CIO Review,https://news.google.com/rss/articles/CBMi2gFBVV95cUxONDU5NUNyMHJuQ1k5bVpRMU5WSnZKMmtkVXc1SEJSUTFGN19TY0tHNEVOWnJvSm92VzZkN082NUtUNlB5aC1RTzVPOW5veWJwdjhqS3VKWWREMnpHdnBMMUJ1ckdUbmp5N092cV93ZkdkXzJ6VjZqN09ZaVZrR1hsYUQ1OTNVRE1mSzVpMFNtVi1mcTRwNWtvOUdJNk5Ub1REWW5xQlpXUkIxMHBrcjNobEc4VEllQ283cjVHWGpGUmJlQTNLeFZkNmt6T1RHQmpKRHBKalFhd1k3Zw?oc=5,"Fri, 18 Apr 2025 07:00:00 GMT",The National CIO Review,"JPMorgan Chase & Co. (NYSE:JPM), Wells Fargo & Company (NASDAQ:WFC), and the Bank of New York Mellon Corporation (NYSE=BK) reported strong financial results in the first quarter of 2025, delivering an earnings per share (EPS) of $4.81, beating estimates by a wide margin, and demonstrating a firm-wide commitment to embedding intelligence in core functions, with CEO Charlie Scharf demonstrating significant gains in mobile adoption, 85% for digitally active customers, and technology investments enabling faster product rollouts","(""Bank of New York Mellon"" OR ""BNY"") -gossip -celebrity -""fantasy sports"" -""game recap""",2025-04-17,BNY,2026-01-26T17:14:51.789532-05:00,https://nationalcioreview.com/articles-insights/cio-field-notes/top-u-s-banks-embrace-technology-to-enhance-operational-efficiency-in-q1-2025/,"In the first quarter of 2025, JPMorgan Chase & Co. (NYSE:JPM), Wells Fargo & Company (NYSE:WFC), and The Bank of New York Mellon Corporation (NYSE:BK) reported strong financial results that exceeded Wall Street expectations. JPMorgan led the group with an earnings per share (EPS) of $4.81, beating estimates by a wide margin. Wells Fargo delivered an EPS of $1.24, while BNY Mellon reported $1.55 per share, both topping analyst forecasts. These results reflect continued strength in core operations and cost discipline amid a mixed macroeconomic environment.
Beyond earnings, each institution highlighted transformative investments in technology as central to their long-term growth strategies.
From advanced AI capabilities at JPMorgan to Wells Fargo’s customer-centric digital upgrades and BNY Mellon’s platform modernization, technology emerged as a shared lever for efficiency, innovation, and enhanced customer service. These themes dominated the tech-focused portions of each earnings call.
Why It Matters: For CIOs, CTOs, and tech-focused business leaders, the Q1 commentary from three of the nation’s largest financial institutions underscores how integrated technology strategy is with broader business performance. Whether it’s deploying generative AI for operational streamlining or partnering with fintechs to scale innovation, these firms demonstrate what a mature digital agenda looks like at enterprise scale.
- JPMorgan Chase Scales AI Across Operations: JPMorgan Chase emphasized its enterprise-wide AI deployment, highlighting both generative and predictive AI use cases. CEO Jamie Dimon noted, “We now have over 1,000 AI use cases in production across risk, marketing, fraud, and customer service,” signaling a firm-wide commitment to embedding intelligence in core functions. Mary Erdoes added, “Our AI Center of Excellence is helping teams across the company deploy models faster and more safely.” These efforts not only improve efficiency but also give JPMorgan a scalable framework for innovation.
- Wells Fargo Upgrades Digital Interfaces for Better Customer Engagement: Wells Fargo reported progress on its modernization roadmap, particularly within consumer-facing digital experiences. CEO Charlie Scharf stated, “We’re seeing meaningful gains in mobile adoption, which is now above 85% for our digitally active customers.” He also pointed to technology investments enabling faster product rollouts, noting, “The changes we’ve made to our tech architecture let us develop and deploy much more quickly.” These enhancements are driving higher engagement while reducing friction across channels.
- BNY Mellon Modernizes Core Platforms to Improve Client Delivery: BNY Mellon is focused on re-platforming and automating key areas of its asset servicing business. CEO Robin Vince explained, “We’ve been investing heavily in platform modernization to bring real-time capabilities and a better client experience.” He also underscored the importance of automation: “We’re using machine learning to reduce manual processes, particularly in custody operations.” These upgrades support scalability and differentiate the firm’s client servicing model.
- Cybersecurity and Resilience Stay Front and Center: All three banks reiterated their focus on cybersecurity as digital complexity increases. JPMorgan’s Dimon emphasized, “We spend more than $15 billion a year on technology, and cybersecurity is a big part of that.” BNY Mellon’s Vince added, “Operational resilience remains a top priority, we’re investing to ensure our systems are both secure and scalable.” These remarks highlight how security is baked into digital transformation strategies, not bolted on after the fact.
- Fintech Collaborations Drive Innovation and Time-to-Market: Strategic partnerships emerged as a shared theme across the banks, with executives citing alliances that accelerate digital innovation. Wells Fargo’s Scharf noted, “We continue to leverage fintech partnerships to bring new solutions to market quickly, especially in payments and onboarding.” At JPMorgan, Erdoes said, “We’re blending our internal capabilities with those of external partners to push the boundaries of what’s possible in areas like blockchain and cloud.” Such collaborations are enabling faster iteration and adoption of cutting-edge solutions.
Go Deeper -> JPMorgan Chase Earnings Call Transcript – MarketBeat
Wells Fargo Earnings Call Transcript – MarketBeat
Bank of New York Mellon Earnings Call Transcript – MarketBeat",529,4494,2025-04-18
131,4bed3372d87a869eed9b6346b3256842f1eb9069c5fc0839c7b634ad99741bfd,Alter Domus adds two senior hires - Asset Servicing Times,https://news.google.com/rss/articles/CBMimAFBVV95cUxQdmp6NWpCaGtHQlhfYUliVXNHNGVQZHFhZHJEeEJXZ0I3U0VGQ0M1dElZdGZpX1lOMC1ocXFKRkQ1blZUYzVKYTllNGphOXBLZjVuQzBLemdwa1BZMWNJY3lyZGRHZ1FUNExwakJ4XzVGd202VUNkQTdDUmpONzdWNkZkRUVsLWluVlNQdmtZRzViUFRsSVlfUg?oc=5,"Thu, 17 Apr 2025 07:00:00 GMT",Asset Servicing Times,"Alter Domus head Kenny King and Jane Karczewski in two senior roles at Morgan Stanley, Deutsche Bank, Citi, and HSBC, partnering with Doug Hart, CEO of KCP for EMEA, and two senior hires 17 April 2025.","(""Bank of New York Mellon"" OR ""BNY"") -gossip -celebrity -""fantasy sports"" -""game recap""",2025-04-16,BNY,2026-01-26T17:14:51.224754-05:00,https://www.assetservicingtimes.com/assetservicesnews/peoplemovesarticle.php?article_id=16669,"Alter Domus adds two senior hires
17 April 2025 US
Image: LinkedIn
Alter Domus has added to its key client partnerships (KCP) team, appointing Kenny King and Jane Karczewski in two senior roles.
King joins as head of KCP for North America from BNY Asset Servicing, where he was global head of alternatives relationship management. Before BNY, he held leadership roles at J.P. Morgan, Merrill Lynch, and Bear Stearns.
On his appointment, King says: “The evolution of private markets requires a new approach to fund servicing — one that aligns with firms’ growth strategies and investor expectations. Alter Domus’ commitment to co-developing tailored solutions with clients sets it apart, and I look forward to contributing to that vision.”
Karczewski has been named as head of KCP for EMEA, having most recently led investors business development and ESG solutions at Societe Generale. She has over three decades of experience, including leadership roles at Morgan Stanley, Deutsche Bank, Citi, and HSBC.
She says: “Companies in the private and alternative investment space are under pressure to rethink their operating models to keep pace with investor expectations, and to focus on returns.
“Alter Domus is uniquely positioned to help clients navigate this transition. I’m excited to work alongside a team that truly understands how to tailor strategic solutions for long-term success.”
Doug Hart, CEO of Alter Domus, adds: “Clients want to focus on what they do best — raising and deploying capital, managing risk, and driving returns. By bringing Kenny and Jane onboard, we are doubling down on our commitment to helping private markets firms future-proof their operations with bespoke solutions that enhance scalability and efficiency.”
King joins as head of KCP for North America from BNY Asset Servicing, where he was global head of alternatives relationship management. Before BNY, he held leadership roles at J.P. Morgan, Merrill Lynch, and Bear Stearns.
On his appointment, King says: “The evolution of private markets requires a new approach to fund servicing — one that aligns with firms’ growth strategies and investor expectations. Alter Domus’ commitment to co-developing tailored solutions with clients sets it apart, and I look forward to contributing to that vision.”
Karczewski has been named as head of KCP for EMEA, having most recently led investors business development and ESG solutions at Societe Generale. She has over three decades of experience, including leadership roles at Morgan Stanley, Deutsche Bank, Citi, and HSBC.
She says: “Companies in the private and alternative investment space are under pressure to rethink their operating models to keep pace with investor expectations, and to focus on returns.
“Alter Domus is uniquely positioned to help clients navigate this transition. I’m excited to work alongside a team that truly understands how to tailor strategic solutions for long-term success.”
Doug Hart, CEO of Alter Domus, adds: “Clients want to focus on what they do best — raising and deploying capital, managing risk, and driving returns. By bringing Kenny and Jane onboard, we are doubling down on our commitment to helping private markets firms future-proof their operations with bespoke solutions that enhance scalability and efficiency.”
NO FEE, NO RISK
100% ON RETURNS If you invest in only one asset servicing news source this year, make sure it is your free subscription to Asset Servicing Times
100% ON RETURNS If you invest in only one asset servicing news source this year, make sure it is your free subscription to Asset Servicing Times",201,3592,2025-04-17
