,id,title,link,published,source,summary,query,target_date,ticker,fetched_at,actual_link,full_text,summary_len,text_len,published_dt
210,a584ef80baf878ef46ed884b2dec66753d14f7b02a13a55066282a0c0d3afec8,Ethereum’s $150B BlackRock Deal: A Game-Changer for Crypto - CryptoRank,https://news.google.com/rss/articles/CBMimAFBVV95cUxQTG95SGRVMGpUSDVZWkZRcGhrd3VYSHNrUXVONlFMYktVME9YNl91TjR4dWRmOGYwNjZDRmlpQjVhZkpneTdlRXlYX1gxNGlqSjNuaTgwcFdsS3B0akt0UEUtZGtpMjgyZXBYY0dUYmNrSnVwcGpxYTYzLWVXZ2YzLUw4R2ZwQ3AxZEdlVnFJWHd3NVVzWHBSMQ?oc=5,"Wed, 30 Apr 2025 07:00:00 GMT",CryptoRank,BlackRock’s $150B BlackRock deal is creating a stir right now in financial circles as the world’s largest asset manager takes a bold step into blockchain territory.,"(""Bank of New York Mellon"" OR ""BNY"") -gossip -celebrity -""fantasy sports"" -""game recap""",2025-04-29,BNY,2026-01-26T17:14:58.740409-05:00,https://cryptorank.io/news/feed/b0389-ethereums-150b-blackrock-deal-a-game-changer-for-crypto,"Ethereum’s $150B BlackRock Deal: A Game-Changer for Crypto
Share:
Ethereum’s BlackRock deal is creating quite a stir right now in financial circles as the world’s largest asset manager takes a bold step into blockchain territory. Just a few days ago, on April 28, BlackRock went ahead and filed with the SEC to tokenize its massive $150 billion Treasury Trust Fund, creating what they’re calling “DLT Shares.” This move, at the time of writing, represents the largest real-world asset flow to Ethereum yet and could change how big institutions approach cryptocurrency and blockchain technology in general.
Also Read: De-Dollarization: 5 Oil Giants Now Settling in Yuan, Not USD
How BlackRock’s Ethereum Deal Could Address Market Volatility and Regulation Challenges
BlackRock’s Treasury Trust Tokenization
The Ethereum-BlackRock deal basically involves tracking ownership of BlackRock’s Treasury Trust Fund through blockchain technology with BNY Mellon handling the records. This particular fund mainly invests in short-term US Treasury securities to provide those stable returns that investors are looking for.
Former Ethereum developer Eric Connor said:
“Ethereum just scored a monster win. It is the biggest real-world asset flow to Ethereum yet.”
Ethereum just scored a monster win.
— Eric Conner (@econoar) April 30, 2025
BlackRock filed to tokenize its $150bn Treasury Trust money-market fund with a new “DLT Shares” class.
BNY Mellon will keep a blockchain mirror of every share on-chain.
Biggest real-world asset flow to Ethereum yet.
BlackRock also previously launched their BUIDL fund on Ethereum, which right now manages around $2.34 billion in assets. This new Ethereum-BlackRock deal kind of builds on their existing experience with institutional blockchain adoption.
Ethereum’s Position as Industry Standard
Ethereum currently has a pretty strong dominance in real-world asset tokenization with about 56% market share and approximately $6.2 billion in tokenized assets. This deal really reinforces this position even further.
Onchain Foundation head of research Leon Waidmann said:
“Institutions follow deep liquidity, credible neutrality, and battle-tested security. ETH is already their settlement layer.”
The Ethereum tokenization process seems to be becoming more and more attractive to major financial institutions that are looking for better efficiency and transparency in their operations.
Also Read: Shiba Inu’s Future If Bitcoin Soars to $2.4M: SHIB Holders Won’t Believe This
BlackRock’s Vision for Blockchain Finance
BlackRock’s crypto investment strategy appears to be accelerating quite a bit lately. The firm’s leadership has made some pretty clear statements about their support for blockchain technology and its potential.
BlackRock CEO Larry Fink said:
“Tokenization will revolutionize investing. Markets wouldn’t need to close. Transactions that currently take days would clear in seconds. And billions of dollars currently immobilized by settlement delays could be reinvested immediately back into the economy, generating more growth.”
This Ethereum-BlackRock deal represents a significant step toward this vision of transformed financial markets with faster settlement times and more efficient capital use.
ETH Price Performance Despite Institutional Interest
Even with all the excitement around the Ethereum-BlackRock deal, ETH prices are still kind of subdued, hovering around $1,800 and down about 63% from those 2021 peaks we saw. The Ethereum market volatility continues to be a factor despite these positive institutional developments we’re seeing.
Interestingly enough, BlackRock’s spot ETH ETF has still accumulated approximately $162 million worth of Ether over just four trading days, which shows some institutional confidence despite the current Ethereum market volatility that we’re experiencing.
Also Read: Top 3 Cryptocurrencies That Could Hit New All-Time Highs In 2025
Impact on Cryptocurrency Ecosystem
BlackRock’s crypto investment could potentially address some key industry challenges, including those security risks through established custodians like BNY Mellon. Also, the Ethereum tokenization of major assets might help reduce market volatility by adding some institutional stability to the ecosystem.
Those cryptocurrency regulation concerns could be eased as major players like BlackRock engage properly with regulators. The Ethereum-BlackRock deal basically demonstrates how blockchain technology can be integrated within existing regulatory frameworks without causing too many problems.
BlackRock’s crypto investment represents a major vote of confidence in Ethereum’s technology and could speed up mainstream adoption of blockchain solutions in the financial world and beyond.
Ethereum’s $150B BlackRock Deal: A Game-Changer for Crypto
Share:
Ethereum’s BlackRock deal is creating quite a stir right now in financial circles as the world’s largest asset manager takes a bold step into blockchain territory. Just a few days ago, on April 28, BlackRock went ahead and filed with the SEC to tokenize its massive $150 billion Treasury Trust Fund, creating what they’re calling “DLT Shares.” This move, at the time of writing, represents the largest real-world asset flow to Ethereum yet and could change how big institutions approach cryptocurrency and blockchain technology in general.
Also Read: De-Dollarization: 5 Oil Giants Now Settling in Yuan, Not USD
How BlackRock’s Ethereum Deal Could Address Market Volatility and Regulation Challenges
BlackRock’s Treasury Trust Tokenization
The Ethereum-BlackRock deal basically involves tracking ownership of BlackRock’s Treasury Trust Fund through blockchain technology with BNY Mellon handling the records. This particular fund mainly invests in short-term US Treasury securities to provide those stable returns that investors are looking for.
Former Ethereum developer Eric Connor said:
“Ethereum just scored a monster win. It is the biggest real-world asset flow to Ethereum yet.”
Ethereum just scored a monster win.
— Eric Conner (@econoar) April 30, 2025
BlackRock filed to tokenize its $150bn Treasury Trust money-market fund with a new “DLT Shares” class.
BNY Mellon will keep a blockchain mirror of every share on-chain.
Biggest real-world asset flow to Ethereum yet.
BlackRock also previously launched their BUIDL fund on Ethereum, which right now manages around $2.34 billion in assets. This new Ethereum-BlackRock deal kind of builds on their existing experience with institutional blockchain adoption.
Ethereum’s Position as Industry Standard
Ethereum currently has a pretty strong dominance in real-world asset tokenization with about 56% market share and approximately $6.2 billion in tokenized assets. This deal really reinforces this position even further.
Onchain Foundation head of research Leon Waidmann said:
“Institutions follow deep liquidity, credible neutrality, and battle-tested security. ETH is already their settlement layer.”
The Ethereum tokenization process seems to be becoming more and more attractive to major financial institutions that are looking for better efficiency and transparency in their operations.
Also Read: Shiba Inu’s Future If Bitcoin Soars to $2.4M: SHIB Holders Won’t Believe This
BlackRock’s Vision for Blockchain Finance
BlackRock’s crypto investment strategy appears to be accelerating quite a bit lately. The firm’s leadership has made some pretty clear statements about their support for blockchain technology and its potential.
BlackRock CEO Larry Fink said:
“Tokenization will revolutionize investing. Markets wouldn’t need to close. Transactions that currently take days would clear in seconds. And billions of dollars currently immobilized by settlement delays could be reinvested immediately back into the economy, generating more growth.”
This Ethereum-BlackRock deal represents a significant step toward this vision of transformed financial markets with faster settlement times and more efficient capital use.
ETH Price Performance Despite Institutional Interest
Even with all the excitement around the Ethereum-BlackRock deal, ETH prices are still kind of subdued, hovering around $1,800 and down about 63% from those 2021 peaks we saw. The Ethereum market volatility continues to be a factor despite these positive institutional developments we’re seeing.
Interestingly enough, BlackRock’s spot ETH ETF has still accumulated approximately $162 million worth of Ether over just four trading days, which shows some institutional confidence despite the current Ethereum market volatility that we’re experiencing.
Also Read: Top 3 Cryptocurrencies That Could Hit New All-Time Highs In 2025
Impact on Cryptocurrency Ecosystem
BlackRock’s crypto investment could potentially address some key industry challenges, including those security risks through established custodians like BNY Mellon. Also, the Ethereum tokenization of major assets might help reduce market volatility by adding some institutional stability to the ecosystem.
Those cryptocurrency regulation concerns could be eased as major players like BlackRock engage properly with regulators. The Ethereum-BlackRock deal basically demonstrates how blockchain technology can be integrated within existing regulatory frameworks without causing too many problems.
BlackRock’s crypto investment represents a major vote of confidence in Ethereum’s technology and could speed up mainstream adoption of blockchain solutions in the financial world and beyond.",164,9479,2025-04-30
69,a61976f038978a6ae981c85a870f0a7d0fd25ad136db0e395e9e8e0790153d8a,BNY Is Changing The Game For Crypto Accounting - Forbes,https://news.google.com/rss/articles/CBMipAFBVV95cUxQMHoyc04weXlxTFhWZ0d4Z1NpX1dqZWpLRlItZUtIYnJweTlmS1lTRWp1WUljcno1VXZZVWI2VHdzc3Nzemo2SDJ6N0VOQk5WZkpqOFlSaExES0tjQzJvZU9NendTdy1PTDl5TjFlYjQ2allaXy1Ga0NEMlVRRldQdjN4UU4xMGVMUzYyZFZaQVNmOXdobExpbTlTbmw2UmExS25wdg?oc=5,"Fri, 11 Apr 2025 07:00:00 GMT",Forbes,"The banking giant BNY debuted a real-time reporting tool (Digital Assets Data Insights) in partnership with Blackrock, enabling net-asset-value data posting directly on blockchains without relying on third-party accounting services, leveraging on-chain money market fund, BUIDL, and Blackrock to broadcast select accounting data to the Ethereum network, augmenting tokenized funds through transparency and transparency, and integrating smart contract functionality to automate data analytics and integrate off-chain data.","(""Bank of New York Mellon"" OR ""BNY"") -gossip -celebrity -""fantasy sports"" -""game recap""",2025-04-10,BNY,2026-01-26T17:14:47.289217-05:00,https://www.forbes.com/sites/digital-assets/2025/04/11/bny-is-changing-the-game-for-crypto-accounting/,"In the latest move by TradFi institutions pivoting to embrace the blockchain and tokenized asset space, the banking giant BNY has debuted a real-time reporting tool (Digital Assets Data Insights) in partnership with Blackrock. The fact that these two financial giants are collaborating on an on-chain valuation and reporting tool is set to have substantial effects on the crypto accounting and reporting conversation moving forward. Put simply, this tool will allow the posting of net-asset-value data directly on to select blockchains without relying on third-party accounting services. The involvement of on-chain money market fund, BUIDL, managed by Blackrock in addition to being the leading partner on this initiative, also highlights the growing importance of on-chain assets.
Benefits that have been discussed connected to this include 1) the ability of BNY to post NAV figures directly on chain, 2) enhanced credibility of tokenized funds thanks to increased transparency and real-time information, and 3) the ability of other products to benefit from more comprehensive suites of tools tailor made for tokenized information. The launch of the partnership also reinforces the rise of tokenized assets and other data, outside of traditionally decentralized instruments such as bitcoin and ether. While the project itself is still in early stages the implications of this real-time reporting and disclosure capability are significant in terms of allowing further maturation of tradeable products and services.
In addition the reporting functionality of Digital Assets Data Insights will have implications for the crypto accounting world; let’s take a look at a few of them.
Connecting Off-Chain Assets To Public Ledgers
One of the key aspects of BNY’s efforts is the connection that will be established between on-chain assets and off-chain data across blockchain networks. Specifically, and leveraging the data already managed on-chain by BNY, the institution will be able to broadcast select accounting data to the Ethereum network, amplifying the ability of investors to leverage public blockchain traceability and transparency. By also integrating smart contract functionality, customers will be able to automate data analytics and better integrate off-chain data and information alongside how public blockchains are used.
In short the efforts underway at BNY have the potential to unlock better transparency, traceability, and insights for tokenized products whether or not said instruments are stored on-chain or secured via off-chain mechanisms. These values of tokenized funds being posted directly on-chain also have the potential to accelerate conversations related to accounting, reporting, and disclosures.
Enhanced Reporting
An ongoing issue in the crypto and tokenized asset sector is the lack of standardized reporting and disclosures in the marketplace. While multiple private sector options have been put forward as potential options the reality is that there are still open items when it comes to critical accounting issues. These include not are limited to how to best determine valuation and liquidity measures for certain specific cryptoassets, products, or instruments and the consistency with which these pieces of information are reported to the marketplace. Accounting professionals will need to be aware of how these non-CPA generated reporting frameworks and best practices will influence client expectations going forward.
Obtaining more accurate and real-time data linked to the valuation of crypto instruments and investing options will also enable the increased proliferation of dashboards, KPIs, credit scores, and other data that is essential for widely traded investing products and services. One additional aspect of these changes is the impact and acceleration that more real-time data will have on a particularly tricky crypto accounting area; crypto-audits.
Mandate For Crypto-Specific Audits
The singular aspect of the cryptoasset landscape that has continued to lag behind the landscape at large, even as institutional adoption continues to accelerate is the development and proliferation of standardized crypto audit practices. With the FASB and IASB only having issued limited guidance to this point, and tax agencies taking varied approaches to crypto tax issues, the onus has fallen on the private sector to develop such practices. For example, the AICPA has developed and continued to update multiple practice aids related to accounting and attestation best practices for digital assets.
In addition the Digital Chamber of Commerce has also issued multiple whitepapers on the topic of proof-of-reserves, and although that practice continues to evolve the expectation is that some iteration of this concept will play a key role going forward. The efforts by BNY to enable more real-time valuation and (by extension) reporting and disclosure will only increase the appetite and interest in these ideas.
As TradFi continues to adopt crypto, some of the largest institutions are looking to shake up the crypto accounting landscape.",521,5078,2025-04-11
108,a9052336e2c2d8f8c23956061212964150db26cd654ab02d802609bed5eb8fec,How eToro’s Stock Lending Feature Will Unlock Passive Income - FinTech Magazine,https://news.google.com/rss/articles/CBMitAFBVV95cUxPLVpDc2FwdWU3Mkcxc0RyeVIzY19MX3dueVA3bURLS2s2ZW9BQXY1eEZwY1NaYktjNlg0cHZ6TGJ5RXZmOUVWUDJJWGRyblVJblVjR21ldlRHeGFqWnllcjhYQTlLV0xqMlZ3TkVCT3BhS3FnSTFWYWsyNmVlY293b1JDNjVySnhuSGc0aUc1MVNad2hiX2Q4TGU1S2hrVks0NE9PbjgtZlBOTFB5dGE5TVhMZTU?oc=5,"Tue, 15 Apr 2025 07:00:00 GMT",FinTech Magazine,How eToro’s Stock Lending Feature Will Unlock Passive Income - FinTech Magazine,"(""Bank of New York Mellon"" OR ""BNY"") -gossip -celebrity -""fantasy sports"" -""game recap""",2025-04-14,BNY,2026-01-26T17:14:49.805073-05:00,https://fintechmagazine.com/financial-services-finserv/how-etoros-stock-lending-feature-will-unlock-passive-income,How eToro’s Stock Lending Feature Will Unlock Passive Income - FinTech Magazine,79,79,2025-04-15
99,a9424f08667a54d18883c967a81545d5deb0d7514905033fb9690b453fed52b1,Forensics at scene as police tape off Manchester office block - manchestereveningnews.co.uk,https://news.google.com/rss/articles/CBMitwFBVV95cUxNcEdpUmljNXhNS3drcWM1QzFIelMyeDN3d0NyLWlIdzNCVzNKM2VsYVhrV2dTdGx1RkdSLVRSQVNvQm9ZRkZDOWNBS1Bobl94Mk9ZYm9MdDJoWGxTMzNBdjl2OXhkSVBpVmNlQjlLd1BKTHJFbzhtOGhvOWcyOC1sVFZueDRweEx2RFpLWFNIejNWdmNJQThydi0ydDM0NU9nOWJEeXEtbGFrZTV5dWRiN3BUNUhsUUXSAbwBQVVfeXFMUHdtNS1kcFFPT2ZndWZxbjJTdjM2Vjk2ZFZiRzJhLWRxcGhVVlBUUkxFNmJRMG94aXN2M1NaTWdJWm1IZ0pzUlE3WDBrLTA5bHFQRUQxcVVwUHBFTVVlZnpQU1dtLUZKRF9TSDZmRVhyQmFzMkJTWmtJOWlteUtBSUF3TDA3aDBHWU1ORzBLMFhCRXlJRDBfMWtPQ3lpTnFHX3l5c2VST0VLT21tS1E1QVpJYXpvdEZqcDVRRzA?oc=5,"Mon, 14 Apr 2025 07:00:00 GMT",manchestereveningnews.co.uk,"A city centre office block has been smashed up and daubed in red paint, with forensics investigators gathering evidence outside the Observatory, with pro-Palestine protesters scaling the building on March 11 in Manchester, a GMP spokesperson says.","(""Bank of New York Mellon"" OR ""BNY"") -gossip -celebrity -""fantasy sports"" -""game recap""",2025-04-13,BNY,2026-01-26T17:14:49.128417-05:00,https://www.manchestereveningnews.co.uk/news/greater-manchester-news/forensics-scene-police-tape-manchester-31418742,"Forensics at scene as police tape off Manchester office block
The building has been smashed and covered with paint
A city centre office block has been taped off after being targeted by vandals overnight.
Police are outside The Observatory, on Chapel Walks, this morning (April 14) after the building was smashed up and daubed in red paint.
The office is the Manchester base for the Aviva insurance company.
No-one has claimed responsibility for the incident so far, which is being investigated by Greater Manchester Police as criminal damage.
However, it comes almost five weeks after pro-Palestine protesters scaled the building on March 11.
Images from the scene show forensics investigators gathering evidence outside the building.
Glass windows and doors have been smashed, while red paint covers a large area of the building.
The damage appears similar to previous pro-Palestine protests in Manchester used against businesses such as Barclays and BNY Mellon.
A GMP spokesperson said: ""Officers are investigating following reports of criminal damage to a premises on Chapel Walks, Manchester.
""Enquiries are currently ongoing and anyone with any information is asked to contact police.""
Aviva has condemned the incident and vowed to take legal action.
A spokesperson for the company said: ""We have had some disruption at our Manchester office this morning (Monday, April 14).
""Our first priority is to ensure the safety of our people.
""We will not tolerate any criminal behaviour towards our people or property and will take appropriate legal action.
""This has not impacted our service to customers.""",247,1604,2025-04-14
209,ad0cd6673b25543e513de21e866b074d6c14069274fa605014a43c48eea94bb3,"BlackRock, BNY Set to Offer New Blockchain-Based Share Class - ETF.com",https://news.google.com/rss/articles/CBMilAFBVV95cUxQdUdFTGZEQUpyREpIT0ttc0REUzRhbEt3eWoyMFQ5WU1vaWotd0M1aEFlTHZNRWhGUEE5ank3a2dYYUplTVNJZTJKZmx2Z0hlT2Utcjg0c2tNeUNNNUhnWFBHMWR1Ylg1QXU4NFRrdWFUTnBPakJjZ251aWM1Tml5MnB6bDZ6Q2hLeno1VlN1Tjl0SlZ6?oc=5,"Wed, 30 Apr 2025 07:00:00 GMT",ETF.com,"BlackRock, BNY Set to Offer New Blockchain-Based Share Class - ETF.com","(""Bank of New York Mellon"" OR ""BNY"") -gossip -celebrity -""fantasy sports"" -""game recap""",2025-04-29,BNY,2026-01-26T17:14:58.740409-05:00,https://www.etf.com/sections/news/blackrock-bny-set-offer-new-blockchain-based-share-class,"BlackRock, BNY Set to Offer New Blockchain-Based Share Class - ETF.com",70,70,2025-04-30
182,af4a4f6c24591920ef6f24d435ad156e88aadb4e679358d978d4994e5c9df3ac,Trump’s Attacks on the Fed and Powell Will Have Unintended Consequences - Barron's,https://news.google.com/rss/articles/CBMimwNBVV95cUxPSFJsUXZLb091Q0pXLTRhTTJYQy1JVjJHS0ozdnYxOWkwcFp4U201dE1icjRLcEhxek83QmM1QnJSVXhjVWhaejZrWG1BTDFfbWQ1T0c1c0VMR0RTaEExV0V6d1BpX1FzMy1nY3NKM2xjZk90VVdpaW5iSERfMmY0ZnVfWXRrYi1Zcm5TY0s5UWRsczRSVDNvYi1Edm92aWs3cTJ1a3l6Q2U1US1RSklncENBRU9ac2t5MHhUWFNFOTNxS1VZUExSelROQW13MzlDWFludy1UVl9jY3ZwdTJOV0NLZEFvSDFPUjVvLW9MdzRQT2s3QjU2dm9yTUZLSUtyMC1fdTVaMFdqQVduT0JuY3VjR2tRWmtEaXZ0SzI2OUwza2s1TFRuUVdONVZjcm1UY2VCZG5Gc0VLekJ3LXRGNWZOa1lBcDlpYTMxR3BpX1lIRk9zSm9kWFdYLU1lRmV0ZUJtRUNpdzdGSkRBYlIxUl93TWVVRmJmVHpFdV9QSE14TTFGTE9JZHpSVnBiYmMtT1V5em1hZHVGOXc?oc=5,"Fri, 25 Apr 2025 07:00:00 GMT",Barron's,Trump’s Attacks on the Fed and Powell Will Have Unintended Consequences - Barron's,"(""Bank of New York Mellon"" OR ""BNY"") -gossip -celebrity -""fantasy sports"" -""game recap""",2025-04-24,BNY,2026-01-26T17:14:55.827524-05:00,https://www.barrons.com/articles/trumps-public-fed-bashing-unintended-consequences-de0218eb?gaa_at=eafs&gaa_n=AWEtsqcXdL5Pp0vA7Ok6gQ1sr_tBETsiCueRQM_N6XgJHb0HwAn1IuLbOy_5&gaa_ts=6977eae4&gaa_sig=Y-ciMKFSQv6WZo4z6aCwPNjIDq8euzAIXn0qt94SzkuoaFhweqeou_dveFww6_R3OLlIK-9MBLossi25DmKFmQ%3D%3D,Trump’s Attacks on the Fed and Powell Will Have Unintended Consequences - Barron's,82,82,2025-04-25
