,id,title,link,published,source,summary,query,target_date,ticker,fetched_at,actual_link,full_text,summary_len,text_len,published_dt
214,002856d5a68f576a39f911a5f4f9116397cf2cc69574b2299fe464af837537c8,BNY gets licence for Saudi regional HQ as global banks grow presence - Reuters,https://news.google.com/rss/articles/CBMitAFBVV95cUxQTG5Oam03R29PUWNtT1U2cXRVSmxuTlMySkJzUm9WSk1uRHVIMUttOUNkV3FPenZPS1F0azZMeTBhTE85dU5wTzEyZ0VXb3lRa2lCdVNpUXR0V3ZuSmhUX0RYUzc2YnpmdUsycW9zUWxBYm9OZzlBOUh2b1BFYWdnbnVXMjgxdTRQQzJOYVRqZ3VNbnptRDgxaF9WUEtjMjU0VzNuOHFERTV5cE01ODltSmdCRW0?oc=5,"Thu, 01 May 2025 07:00:00 GMT",Reuters,BNY gets licence for Saudi regional HQ as global banks grow presence - Reuters,"(""Bank of New York Mellon"" OR ""BNY"") -gossip -celebrity -""fantasy sports"" -""game recap""",2025-04-30,BNY,2026-01-26T17:14:59.350493-05:00,https://www.reuters.com/business/finance/bny-gets-licence-saudi-regional-hq-global-banks-grow-presence-2025-05-01/,BNY gets licence for Saudi regional HQ as global banks grow presence - Reuters,78,78,2025-05-01
190,02126cff8c6c89742198efbd3710b0d066097b462cff60ba5d21b8a319c09f0f,Moody’s and MSCI Partner for Private Credit Risk Modelling Tool - planadviser,https://news.google.com/rss/articles/CBMiiwFBVV95cUxPTVU5T0ZvRy1iRi1VYzI4bk1mc21MTjVERWV6U1A1N1JFVWRNQnhudEpMWGF1SmtrOWg2Y242eUpNbjFTM0plaUNHQUJ6bU5CZHdLTl9wZloxYVJ6Q3h2WFhPcG0tMWl5YU9NM3o5aDNJSEdZNTlsQXRVZ3ZyaXphcG9QVE9nZmdYUm0w?oc=5,"Mon, 28 Apr 2025 07:00:00 GMT",planadviser,"MSCI and Moody’s Corporation launched an EDF-X credit risk modelling tool to assess private credit investments, leveraging consistent, independent probability of default (PD) scores and implied ratings for deeper risk insights across funds, sectors, and geographies, delivering credible, transparent credit risk metrics to boards, regulators, and investors, and delivering early warning signals that flag credit deterioration, macro-adjusted PDs incorporating climate/economic factors, and default loss at the facility level, demonstrating a critical role in assessing private credit investment risks.","(""Bank of New York Mellon"" OR ""BNY"") -gossip -celebrity -""fantasy sports"" -""game recap""",2025-04-27,BNY,2026-01-26T17:14:57.474186-05:00,https://www.planadviser.com/moodys-msci-partner-private-credit-risk-modelling-tool/,"MSCI and Moody’s Corporation have partnered to launch an offering that assesses risks for private credit investments.
The solution integrates MSCI private capital data with Moody’s EDF-X credit risk modelling tool.
MSCI said the new solution leverages consistent, independent probability of default (PD) scores and implied ratings for deeper risk insight across funds, sectors and geographies.
It also delivers credible, transparent credit risk metrics to boards, regulators and investors and support decision-making with insights backed by the independent methodologies, MSCI said.
The two firms said the solution “will be distinct from the services provided by Moody’s Ratings, the credit rating agency, to the issuers in the private credit market.”
MSCI is supplying data on more than 2800 private credit funds and 14,000 underlying companies.
The solution will also produce early warning signals that flag potential credit deterioration, macro-adjusted PDs incorporating both climate and economic factors, and loss given defaults at the facility level.
“As the private credit market evolves, investors are looking for trusted independent assessments to help benchmark credit risk and inform investments and monitor portfolios,” Moody’s chief executive Rob Fauber said.
“Our partnership with MSCI will play a critical role in providing these insights, helping market participants make informed decisions.”
MSCI chief executive Henry A. Fernandez said the rapid growth of private credit continues to transform the global investment landscape while highlighting the need for increased transparency, consistent standards and independent risk assessment.
This article originally appeared in our sister publication, Financial Standard.",601,1733,2025-04-28
96,03fc0d93026da945e16cf6bcdeded87e03c5bee1d043ec6f2c70c330b4641bc1,Lending Stocks For Passive Income Made Possible by New eToro and BNY Launch - The Fintech Times,https://news.google.com/rss/articles/CBMipwFBVV95cUxNUjc1bF92RWFkWjV5d0lnaFVsNW1NYy1sZVdoS1h4YUs4YWdHT1dxQVl3d3VTbzhpOEJCYUo5UzVib09LdFlnWTNQNUFBZTVaaTdrNlh6MmZKMDl6SnAwY3hCQUNBLXdOb1FoSGYzVDc3TjhBbXFrVDIwSGFXVjVoYUVMakVFOVhscGcxX21idnhiazBGQXVEQmRWa1lhaGVWc0VKekZacw?oc=5,"Mon, 14 Apr 2025 07:00:00 GMT",The Fintech Times,Lending Stocks For Passive Income Made Possible by New eToro and BNY Launch - The Fintech Times,"(""Bank of New York Mellon"" OR ""BNY"") -gossip -celebrity -""fantasy sports"" -""game recap""",2025-04-13,BNY,2026-01-26T17:14:49.128417-05:00,https://thefintechtimes.com/lending-stocks-for-passive-income-made-possible-by-new-etoro-and-bny-launch/,Lending Stocks For Passive Income Made Possible by New eToro and BNY Launch - The Fintech Times,95,95,2025-04-14
6,05fd3f60e2c90710c3ffe74d45e18fa2dc6ba41fdcf7d82f9a96a5b9c4cd2989,PIMCO opens first Korean office in Jeonju to enhance national pension management - CHOSUNBIZ - Chosunbiz,https://news.google.com/rss/articles/CBMigAFBVV95cUxOc2h5Ny1YOFJGOXluMmlxYW5VTldMaGc0aEI3RTJyOXpiZU5DRllZT3o5NWlZM1ZSTV9tOFl4a2lFUWJoTC1OMmhsVkJJVG1mTFF6RUZwS3hKVEVhLXBzQ2JRdEg3V3N6VjVUdDFDNGtqd1JBQmFpTi1ONTBYYUVrdNIBlAFBVV95cUxNUGN0NDV1ajNubHlkdXNpZUEyVUl3alZmaHNFcFVuSFZhakxGdW54SUV0S1JJcDFxSUE2eWpaUEpjeV9CVmhHVThnS0E1YUcwVjlQWFFxQnlQcmVnTEVuRHRfNndHTmpBbFpyT0p0bHBhQjJxSnp3Y0dFMU5kRU43Sm5fb01oOWZnQ0E2ZzR3R3NpeXlh?oc=5,"Wed, 02 Apr 2025 07:00:00 GMT",Chosunbiz,PIMCO opens first Korean office in Jeonju to enhance national pension management - CHOSUNBIZ - Chosunbiz,"(""Bank of New York Mellon"" OR ""BNY"") -gossip -celebrity -""fantasy sports"" -""game recap""",2025-04-01,BNY,2026-01-26T17:13:38.015243-05:00,https://biz.chosun.com/en/en-finance/2025/04/02/V7BUDLBFTJGNHAIA53NJZJCHV4/,PIMCO opens first Korean office in Jeonju to enhance national pension management - CHOSUNBIZ - Chosunbiz,104,104,2025-04-02
28,0645a699996a4e923bfdc185ea09b486b70e48cf4d52b493f08e115a2ec08255,"Iran Told Trump It Wants Peace, Won’t Back Down Against Threats - Bloomberg.com",https://news.google.com/rss/articles/CBMiswFBVV95cUxPckxRTGpIdHM3Ylc3ejBSa1dkSW1xM3czc3A4ZEVzdUdkODV0TF9WWTVhbnB3STRzZFotdThZd0l1SE1QdURWSm9TbU94NWFTT2E0aU1QYVZwc1pKZ1Z0TUVOdDRzbVM0bG9HSDEtakRfV0o3QktyQkU1Qk1vWWhFVHlWX25xRWY0RzRUSUpaUlJZWFRQV01EZThCd0JRbF93MFBYSnlxbzI2Nk83ZTZLZTB1OA?oc=5,"Sun, 06 Apr 2025 07:00:00 GMT",Bloomberg.com,"Iran Told Trump It Wants Peace, Won’t Back Down Against Threats - Bloomberg.com","(""Bank of New York Mellon"" OR ""BNY"") -gossip -celebrity -""fantasy sports"" -""game recap""",2025-04-05,BNY,2026-01-26T17:12:58.293691-05:00,https://www.bloomberg.com/news/articles/2025-04-06/iran-told-trump-it-wants-peace-won-t-back-down-against-threats,"Iran Told Trump It Wants Peace, Won’t Back Down Against Threats - Bloomberg.com",79,79,2025-04-06
107,07989d591ea3362a4454b42bf4c688e451dfc0bcdeb375387fe6ac2c82bc92d7,Major US banks dial down information sharing with OCC after email hack - Finextra Research,https://news.google.com/rss/articles/CBMiswFBVV95cUxQYjFGUXQ2eFMwWU9rZVJ5OW1id3FyXzJmZ0E3OTRzaHJpa2R5VzkwOEdIY3FCZGFCVVZqUmUzRGRTLXZkNEo0NVJSV2xkVUNuLWhzVEk3eHBhTFpJT3ExT3NCbkZJRVFKZEhueUpkMDJZbk0tTnZJTVItSjZVVzRJS21WdGZLVlNTX2h0bHRTWlF6RTljNTFyUXdIby11RU5icTNHSTZLcEVVcGViejlIQkhLUQ?oc=5,"Tue, 15 Apr 2025 07:00:00 GMT",Finextra Research,Major US banks dial down information sharing with OCC after email hack - Finextra Research,"(""Bank of New York Mellon"" OR ""BNY"") -gossip -celebrity -""fantasy sports"" -""game recap""",2025-04-14,BNY,2026-01-26T17:14:49.805073-05:00,https://www.finextra.com/newsarticle/45836/major-us-banks-dial-down-information-sharing-with-occ-after-email-hack,Major US banks dial down information sharing with OCC after email hack - Finextra Research,90,90,2025-04-15
45,1498cb698ed72d99cbcc7e600387bc2fc1e288e05b57f10084e532ded53a100c,BNY pilots first intraday triparty repo trade - Securities Finance Times,https://news.google.com/rss/articles/CBMimgFBVV95cUxNaWNVSTZhQ1JvYnZ3RVJiWHBmbFBMWjBlU09FLW5valhuNGVjUEY5UVlEblA4R3JRcUFYYjNRbzVZZ1loMXNBXzh0Z1JIQzkwZmF5cGlDYUpOV2d1Mmc3LWFuRmlkcWwzbnVjN1BVSHJqbEgzd2VOSzdGVmlGNWhMTFV5YVB2eU1xNnBlMHdvWllRMnJreTB3YVhn?oc=5,"Wed, 09 Apr 2025 07:00:00 GMT",Securities Finance Times,"BNY piloted the first intraday repo trade settled through its triparty infrastructure in February, where Swiss Re borrowed cash from Swiss Re while delivering collateral through BNY's platform, enabling market participants to instruct a same-day exchange where the allocation and return of collateral will be settled intraday against payment.","(""Bank of New York Mellon"" OR ""BNY"") -gossip -celebrity -""fantasy sports"" -""game recap""",2025-04-08,BNY,2026-01-26T17:14:46.042282-05:00,https://www.securitiesfinancetimes.com/securitieslendingnews/repoarticle.php?article_id=227807,"BNY pilots first intraday triparty repo trade
09 April 2025 US
Image: BNY
BNY has successfully piloted the first intraday repo trade settled through its triparty infrastructure.
The transaction took place between UBS and Swiss Re in February, where UBS borrowed cash from Swiss Re while delivering collateral through BNY's platform.
BNY says that the successful transaction marks the ability for market participants to instruct a same-day repo, where the allocation and return of collateral will be settled intraday against payment.
The tri-party solution also allows firms such as UBS to source liquidity at a specified time, without the need to borrow for a full 24-hour period.
Gesa Johannsen, BNY's executive platform owner, global collateral, says: ""Our intraday triparty repo solution is an important step towards providing more flexible liquidity management possibilities to our clients, enabling them to more efficiently fund their day-to-day operations.”
Jason Crosskey, head of EMEA funding and optimisation solutions at UBS, adds: “This facility enhances intraday capabilities by allowing institutions to provide or access cash at specific times to better manage liquidity.”
The transaction took place between UBS and Swiss Re in February, where UBS borrowed cash from Swiss Re while delivering collateral through BNY's platform.
BNY says that the successful transaction marks the ability for market participants to instruct a same-day repo, where the allocation and return of collateral will be settled intraday against payment.
The tri-party solution also allows firms such as UBS to source liquidity at a specified time, without the need to borrow for a full 24-hour period.
Gesa Johannsen, BNY's executive platform owner, global collateral, says: ""Our intraday triparty repo solution is an important step towards providing more flexible liquidity management possibilities to our clients, enabling them to more efficiently fund their day-to-day operations.”
Jason Crosskey, head of EMEA funding and optimisation solutions at UBS, adds: “This facility enhances intraday capabilities by allowing institutions to provide or access cash at specific times to better manage liquidity.”
NO FEE, NO RISK
100% ON RETURNS If you invest in only one securities finance news source this year, make sure it is your free subscription to Securities Finance Times
100% ON RETURNS If you invest in only one securities finance news source this year, make sure it is your free subscription to Securities Finance Times",342,2511,2025-04-09
220,14ac92cdf6f3df1756c002013d0f8a3a937262ae30ebbab36a63116f2b6d76db,BNY obtains regional headquarters licence in Saudi Arabia - Securities Finance Times,https://news.google.com/rss/articles/CBMinwFBVV95cUxOd0Z6YXNqS0xKYlJQd1Jjd3ZkbGhwdTg5NXdJd1NPN2RlMWJnS2ZBbG1uWHdEci1WbnZuOUVKRFM2cXBlWG9zYkh2Sm5YQk5Ba1ZvTV9NUWg2a3ZUYlJEYnVQWXZZS2ZBTjA5eUlSUmRpUnpKRkhHMU5mRklYbmZDTEc5UVdhc3JteUZ6QmVZOTFaejUwTnZjV0ZqTU5qVEE?oc=5,"Thu, 01 May 2025 07:00:00 GMT",Securities Finance Times,"BNY receives a regional headquarters licence from the Ministry of Investments in Saudi Arabia (MISA) in Riyadh, providing strategic, administrative, and corporate services for BNY in the Middle East, with BNY’s existing Asset Servicing solutions including global risk solutions, risk solutions and custody FX, institutional accounting under a Capital Markets Authority (CMA) licence, and clients in the United Arab Emirates, Kuwait, Qatar, Bahrain, and Oman, providing global markets, building and delivering local market infrastructure capabilities, and supporting Gulf Cooperation Council’s capital markets landscape.","(""Bank of New York Mellon"" OR ""BNY"") -gossip -celebrity -""fantasy sports"" -""game recap""",2025-04-30,BNY,2026-01-26T17:14:59.350493-05:00,https://www.securitiesfinancetimes.com/securitieslendingnews/industryarticle.php?article_id=227857,"BNY obtains regional headquarters licence in Saudi Arabia
01 May 2025 Saudi Arabia
Image: Chaudhary_Umair/stock.adobe.com
BNY has received a regional headquarters licence from the Ministry of Investments in Saudi Arabia (MISA).
The new headquarters in Riyadh will provide strategic, administrative, and corporate services for BNY in the Middle East.
BNY’s existing Asset Servicing solutions delivered for clients in the Kingdom of Saudi Arabia (KSA) include global custody services, global risk solutions, custody FX, and institutional accounting under a Capital Markets Authority (CMA) licence.
Hani Kablawi, head of international at BNY, comments: “The KSA is delivering on its Vision 2030, and we will continue to bring BNY’s expertise across the financial lifecycle to help the KSA achieve its ambitions.”
Apart from the KSA, BNY also has clients in the United Arab Emirates, Kuwait, Qatar, Bahrain, and Oman, providing access to global markets, building and delivering local market infrastructure capabilities, and supporting the development of the Gulf Cooperation Council’s capital markets landscape.
The new headquarters in Riyadh will provide strategic, administrative, and corporate services for BNY in the Middle East.
BNY’s existing Asset Servicing solutions delivered for clients in the Kingdom of Saudi Arabia (KSA) include global custody services, global risk solutions, custody FX, and institutional accounting under a Capital Markets Authority (CMA) licence.
Hani Kablawi, head of international at BNY, comments: “The KSA is delivering on its Vision 2030, and we will continue to bring BNY’s expertise across the financial lifecycle to help the KSA achieve its ambitions.”
Apart from the KSA, BNY also has clients in the United Arab Emirates, Kuwait, Qatar, Bahrain, and Oman, providing access to global markets, building and delivering local market infrastructure capabilities, and supporting the development of the Gulf Cooperation Council’s capital markets landscape.
NO FEE, NO RISK
100% ON RETURNS If you invest in only one securities finance news source this year, make sure it is your free subscription to Securities Finance Times
100% ON RETURNS If you invest in only one securities finance news source this year, make sure it is your free subscription to Securities Finance Times",619,2305,2025-05-01
0,1658850f65438ffedba657409b0e8ae9f275eeb84792cd626dd0ec05f17984b4,"Leadership in the Law: Fireside Chat with Kevin McCarthy, General Counsel of BNY - Mayer Brown",https://news.google.com/rss/articles/CBMi1AFBVV95cUxOYzdnYk14S3o3czZ6RG1HWXZCLS1XR3MwX3N5R3BHMFppYVFLcDZnQ2ZUMHJYeEZJSnNIaFZpdG1mZjYwdGRzZTBCRDZCYXlLU1RPRlJhbXM5cUYzQkVHU2NmdnU0MUoyNXljTDVrZkpoT3Y1VDhySVVqQ1VDR2M0ZjBOX0U1MnZzT1JTVWtVNFJCSDNISjFIT1JoNzNoRTF5cG1IUEJ0QlFqMlIyTThIMjVRT1QzYzE5MEYxa2wyWktzVEhBWC1ieEZ2THN5amJxYjZzcA?oc=5,"Tue, 01 Apr 2025 07:00:00 GMT",Mayer Brown,"Kevin McCarthy, General Counsel of BNY, and Matthew Ingber will host this episode of Leadership in the Law, a fireside chat with Mayer Brown partner, Kevin McCarthy's latest “Leadership in the law” discussion with BNY's General Counsel, and will be introducing Kevin McCarthy as our host for this episode.","(""Bank of New York Mellon"" OR ""BNY"") -gossip -celebrity -""fantasy sports"" -""game recap""",2025-04-01,BNY,2026-01-26T17:13:38.015243-05:00,https://www.mayerbrown.com/en/insights/publications/2025/04/leadership-in-the-law-fireside-chat-with-kevin-mccarthy-general-counsel-of-bny,"April 01, 2025
Leadership in the Law: Fireside Chat with Kevin McCarthy, General Counsel of BNY
Author:
Kevin McCarthy, General Counsel of BNY
We are delighted to share with you our latest “Leadership in the Law” discussion with Kevin McCarthy, General Counsel of BNY, and are excited to introduce Mayer Brown partner Matthew Ingber as our host for this episode. Kevin recalled several formative experiences, including one where “we made some law,” and emphasized the importance of authenticity as a personal characteristic that he has found to be key to building a successful career.",305,584,2025-04-01
