,id,title,link,published,source,summary,query,target_date,ticker,fetched_at,actual_link,full_text,summary_len,text_len,published_dt
154,7ef6aa02edf9ace24a48883c59819902beb249b9151879c1b1f9d2fc648aa720,ETF Prime: Chang Highlights 5 Notable ETF Launches - ETF Trends,https://news.google.com/rss/articles/CBMiggFBVV95cUxPQjhlc09zVWJHNWNLMXNwTC1ia0NYYXhRRG9jdEI1b0NPR2ZZX1ZCdERxczhZSy1zSWJ3c2ZBaU5lV0JvZHJsbXdFU010bGtFMy1mVERZZEF1NEloQmdzZURDYThzWm8ta2F4dmc2cEQwdTRBZ2h1THNXYjN0ejVzUkRn0gGHAUFVX3lxTE9FOVd2V1o2UVYyeG1id0pGZVpYaEhRMnVTVjhUN24yYVkybGRWWU5PY1J3ZDlVZmhSbnlZOERIWGRnYUpsLXV2dVlTWkRDMThJYjlrWXNDOWZHSkFWT3Z5dy1RNmFPS1dvaUtmNGdjSGpZVnFqLWVGZzdjZUlsY1llR1p5ZGdjaw?oc=5,"Tue, 22 Apr 2025 07:00:00 GMT",ETF Trends,"Kirsten Chang, senior industry analyst at VettaFi, and Nate Geraci discuss ETF launches from Unlimited, Cambria, and iShares, Brookmont, and Teucrium, introducing an active global asset allocation strategy inspired by endowment-style investing, with a net expense ratio of just 9 basis points, a rebalance ratio of 10%, and an in-between product for extreme dilution and large-cap, heavy-weight, top-weighted, S&P 500.","(""Bank of New York Mellon"" OR ""BNY"") -gossip -celebrity -""fantasy sports"" -""game recap""",2025-04-21,BNY,2026-01-26T17:14:53.981669-05:00,https://www.etftrends.com/etf-prime/chang-highlights-5-notable-etf-launches/,"On this week’s episode of ETF Prime, Kirsten Chang, senior industry analyst at VettaFi, joins Nate Geraci to discuss ETF launches from Unlimited, Cambria, iShares, Brookmont, and Teucrium. Later, BNY’s Ben Slavin provides an update on the ETF share class structure and product innovation.
ETF Launches Poised for Record Year
Product innovation and launches have been at an all-time high, with around 50 ETF launches just in the past three weeks.
“Even with all the market turbulence, the tariff uncertainty, and the headlines changing on a dime, there’s just no stopping each engine of ETF creation,” Chang said. “There have been about 288 new ETFs this year. That compares to roughly 120 by the same time last year.”
Right now, the industry is averaging more than 75 new ETFs coming to market a month in 2025. This means the industry could be headed for 1,000 new launches this year, which would handily break last year’s record of about 750.
Of the new ETFs, equities have dominated the scene, making up around 70% of all launches, Chang said.
Notably, about 200 of those new equity ETFs have been actively managed. “They’ve also been about 30% of all the volume. We just recently hit that $1 trillion mark on active ETF assets. That’s now 10% of the total ETF pie,” she highlighted.
Chang also noted the proliferation of derivatives-based and leveraged products. Sixty-three leveraged ETFs have launched this year already compared to 71 launched in 2024. Furthermore, single-stock ETFs in particular have really blown up. Direxion alone applied for 71 leveraged ETFs, she said.
Notable ETF Launches to Highlight
Unlimited HFGM Global Macro ETF (HFGM)
HFGM fund offers an actively managed, global macro hedge fund approach to investing across a range of asset classes.
“Bob Elliott … is bringing top-tier market expertise to the table and offering an array of hedge fund strategies in an ETF wrapper at a disruptively lower price,” Chang said. “This one uses a proprietary algorithm to invest in a number of ETF and futures contracts widely held by global macro hedge funds, and it really just changes based on the market.”
Unlimited is trying to replicate this hedge fund strategy with a slightly amplified risk/return profile since it operates with roughly twice the volatility of a given sector, according to Chang.
“This is actually the first of many ETFs Unlimited is planning to roll out in an ETF wrapper,” Chang added.
See more: Unlimited Brings Global Macro Hedge Fund Strategy to ETFs
Cambria Endowment Style ETF (ENDW)
The Cambria Endowment Style ETF offers a diversified, global investment strategy that seeks income and capital appreciation. This ETF provides exposure to major global asset classes and seeks to use an endowment style investment approach. The fund is designed to pursue returns across various market conditions while maintaining an aggressive risk profile.
The fund launched with $98 million, funded by individual advisors and investors who swapped to the ETF format from a separately managed account through a 351 Exchange, according to Chang.
“It’s an active global asset allocation strategy inspired by endowment-style investing, which was obviously done very well,” she added.
iShares S&P 500 3% Capped ETF (TOPC)
TOPC offers distinct capped exposure to the equities within the S&P 500. Following a fee waiver, the fund has a net expense ratio of just 9 basis points.
“It caps holdings so that no company has a weight of over 3%,” Chang noted. “It rebalances quarterly, and then, as I understand it, any excess weights are redistributed to the remaining holdings based on their market caps.”
Invesco’s RSP will be the fund’s chief competitor, according to Chang. RSP provides greater exposure down the cap spectrum; however, TOPC is more competitively priced.
“[TOPC is] almost reminiscent of a mutual fund strategy in that you have a cap on individual stock weightings,” she said. “To some, equal weight might just be too extreme a dilution.”
“I think [TOPC] gives you a good balance between the two. It’s kind of an in-between product for extreme dilution and the typical large-cap, heavy-weight, top-weighted, S&P 500,” Chang added.
See more: New BlackRock S&P 500 ETF Caps Companies at 3% Weight
Brookmont Catastrophic Bond ETF (ILS)
ILS is the first U.S.-listed ETF dedicated exclusively to catastrophic bonds.
“It has zero correlation with the market. It’s tied purely to unexpected natural disasters,” Chang explained. “Even if the U.S. goes into a recession or geopolitics kind of rears up again, it’s insulated from that.”
She thinks the fund is difficult to pull off because there are questions of how to price it correctly and whether holdings offer enough diversification.
“I think it’ll start off with a sophisticated investor looking for a major diversifier,” Chang said.
See more: Brookmont Unveils First U.S.-Listed CAT Bond ETF
Teucrium 2x Long Daily XRP ETF (XXRP)
Teucrium launched the first U.S.-based XRP ETF earlier this month.
Notably, the ETF itself saw over $5 million in trading volume on its debut, according to Chang.
“Obviously, there is strong institutional interest there,” she said. “This launch coincided with a nearly 40% increase in XRP overall trading volume itself, reaching approximately $9 billion.”
While many investors have questions as to why a leveraged futures-based product was approved before a spot ETF, Chang said it comes down to regulation.
“It’s a derivatives-based futures market. It’s tightly regulated; it’s tightly monitored. Regulators feel they have a better grasp,” she explained. “Cash can obviously be manipulated, whereas futures are much tougher to manipulate. So that’s why we saw sort of clearance of futures with bitcoin before the spot product itself.”
See more: New Teucrium ETF Offers Leveraged Exposure to XRP
ETF Share Class: Updates on the Regulatory Front
The rise in adoption of active ETFs is fueling the interest around the share class structure. There have been over 50 applicants who have filed, with many more asset managers on the sidelines looking to jump in, Slavin said.
“Certainly, what we are hearing is almost universal interest across our asset manager client base,” he added.
“We think the time frame does seem to be accelerating,” Slavin noted. “But, I think there’s a difference between the ability to actually do it and then the readiness for the managers and the platforms to be able to support all this.”
Listen to the entire episode of ETF Prime:
For more ETF Prime podcast episodes, visit our ETF Prime Channel.",418,6541,2025-04-22
130,7ff424404a7935cf7d5bbd17c130d4ff2ac29d17ddddeddd8f72116c1879f4cf,Chainalysis Recognizes Customer Excellence at Links NYC - Chainalysis,https://news.google.com/rss/articles/CBMidkFVX3lxTE5hSjdMTVV0b1JrUUlpdkp1UjlOZWQ0WEIzOGpNNEdDYW1RVHozTXNlcTRNM2F2MHJIWkl1Q1RHMzl5blBkRlJ2X3hxQVh1dzR5dFVhNlBsUVNDN3d6Um9KaDBSTXdfUjZBanQ2amdDc1d6Z25HVHc?oc=5,"Wed, 16 Apr 2025 07:00:00 GMT",Chainalysis,"Chainalysis hosted its inaugural Customer Awards program at Links 2025 NYC, recognizing exceptional innovation, impact, and collaboration across the global customer base, leveraging Reactor, training, and data, and leveraging Signals data to validate leads, identify high-risk entities, and share actionable intelligence with law enforcement.","(""Bank of New York Mellon"" OR ""BNY"") -gossip -celebrity -""fantasy sports"" -""game recap""",2025-04-16,BNY,2026-01-26T17:14:51.224754-05:00,https://www.chainalysis.com/blog/chainalysis-customer-awards-links/,"Chainalysis proudly hosted our inaugural Customer Awards program at Links 2025 NYC, recognizing exceptional innovation, impact, and collaboration across our global customer base. Building upon the success of the first Public Sector Awards introduced at Trace DC in July of last year, this new program recognizes achievements among Chainalysis customers that are leveraging blockchain analytics in extraordinary ways across industries worldwide.
Nominations came from across Chainalysis and were thoughtfully evaluated by an internal judging panel. Ultimately, three exceptional organizations were honored, recognized for innovation, measurable impact, and successful public-private collaboration.
Chief Revenue Officer Bas Lemmens shared, “It was incredibly difficult to choose winners — these organizations represent the best of what this ecosystem has to offer.”
Innovation Award: BNY
The Innovation Award honors organizations that have demonstrated outstanding creativity and forward-thinking use of Chainalysis solutions to drive innovation within their organizations. Whether through the adoption of cutting-edge technologies, the implementation of novel strategies, or the development of groundbreaking initiatives, the Innovation Award celebrates those who are pushing the boundaries and reshaping the landscape of compliance and investigations.
BNY took home this honor. A pioneer and valued Chainalysis customer for several years, they were one of the first large financial institutions to publicly enter into digital asset custody for crypto. BNY developed an integrated framework using the full suite of Chainalysis solutions — including our software, training, and data.
Amy Slivka, member of the Digital Assets business, accepted this award on behalf of BNY.
“We are proud to play a role in supporting market developments on behalf of our clients, including offering digital asset custody for select crypto assets for U.S. based institutional clients, and are committed to building on our 240-year legacy of trust and innovation as we bridge the blockchain and traditional finance ecosystems.” —Marissa MacDonald, Head of Digital Assets Risk, Resiliency & Controls at BNY
Beyond their internal innovation, BNY has played a key role in shaping how Chainalysis supports the broader banking sector. Their leadership has not only influenced the direction of our solutions, but has also paved the way for other institutions to confidently navigate the world of digital assets. We’re proud to recognize BNY as a trailblazer and we’re excited to see what they’ll do next.
Impact Award: Coinbase Global Intelligence Team
The Impact Award honors customers who have achieved measurable, transformative outcomes through their use of Chainalysis data and expertise. These organizations not only elevate their own operations but also contribute to broader industry and public safety goals.
This year’s winner, the Coinbase Global Intelligence Team, was recognized for its efforts to combat the misuse of crypto in fentanyl-related activity. By partnering with Chainalysis and leveraging Signals data, Coinbase was able to validate crucial leads, identify high-risk entities, and share actionable intelligence with law enforcement. The intelligence shared between both teams has expanded understanding of this growing threat, resulting in targeted disruption of criminal actors.
Lauren O’Brien Kelly and Jacob Baker accepted this award on behalf of the Coinbase Global Intelligence Team.
“Fentanyl continues to plague our country and the world, so we were happy to do our part in expanding awareness and disrupting these networks. Special thanks to Joe, Sarah, Caleb, and Collin on the Chainalysis team for enriching our data and making this initiative a great success.” —Lauren O’Brien Kelly, Senior Investigator, Global Intelligence at Coinbase
Coinbase’s continued dedication to building a safer cryptocurrency ecosystem sets a strong example for the industry. Their preventative, data-driven approach reflects the power of combining technology with mission-driven partnerships for the greater good of all.
Public-Private Partnership Award: NPCC National Cybercrime Team
Collaboration between the public and private sectors is essential to addressing today’s most complex challenges — the Public-Private Partnership Award celebrates exactly that. This award recognizes outstanding cross-sector efforts that drive innovation, enhance enforcement capabilities, and deliver meaningful outcomes for broader communities.
This year’s recipient, the UK’s NPCC National Cybercrime Team, has been a valued Chainalysis partner for many years. By leveraging Reactor, training programs, and investigative support, NPCC National Cybercrime Team has played a key role in combating illicit cryptocurrency activity across the UK. Recently, this relationship has evolved into a formal joint intelligence partnership, with Chainalysis investigators and data scientists working hand-in-hand with the NPCC National Cybercrime Team to proactively develop intelligence targeting asset seizure opportunities.
Andrew Gould accepted the award on behalf of the NPCC National Cybercrime Team.
“When we made our first crypto-related seizure over 10 years ago, we manually investigated the blockchain and wondered: ‘Where on earth are we going to store this?’ Now, Chainalysis tools are in the hands of officers across every cybercrime unit in the UK. The future for us is stepping deeper into operational partnerships, using blockchain not just to track, but alongside police tools to proactively locate and disrupt criminals globally. We’re incredibly excited and grateful for this recognition.” —Andrew Gould, Programme Lead, NPCC National Cybercrime Team.
A cornerstone of this collaboration is two-way data sharing — expanding enforcement capabilities and enabling faster, more effective disruption of criminal activity. The NPCC National Cybercrime Team has fully embraced the value of blockchain data as a core intelligence asset, and the results have been immediate and impactful.
Powering a future of collaboration
Congratulations to all of the winners. Chainalysis is proud to support your efforts, and we look forward to celebrating even more progress and success at next year’s awards.
See you next year in New York at Links 2026!
Missed out on attending Links or want to relive your favorite sessions?
The digital premiere of Links 2025 will replay a curated set of sessions. This free 2-hour experience will include CEO Jonathan Levin’s keynote on the state of the industry, an exclusive new session covering global policy developments, and our expert-led demos with real-world case studies covering investigations, compliance, data solutions, fraud prevention, and Web3 security. We’re hosting the virtual event multiple times to accommodate global time zones. Register for free and watch at your convenience.
This material is for informational purposes only, and is not intended to provide legal, tax, financial, or investment advice. Recipients should consult their own advisors before making these types of decisions. Chainalysis has no responsibility or liability for any decision made or any other acts or omissions in connection with Recipient’s use of this material.
Chainalysis does not guarantee or warrant the accuracy, completeness, timeliness, suitability or validity of the information in this report and will not be responsible for any claim attributable to errors, omissions, or other inaccuracies of any part of such material.",342,7530,2025-04-16
189,80aad7a935fdfc14e4266460ea5256b4bbef1cc35f9d1027ad2b1457061b87d3,IFG Names Kevin M. Keefe President And COO To Enhance Growth - Wealth Solutions Report,https://news.google.com/rss/articles/CBMinwFBVV95cUxNeTZHRmRzLTd5dXZlNE1qWXJucHFLaHdLRjJ0STczZnUtUFFBeTlManFyUmNDd2dyNzNuV1Jsc3dxN0lhTE84Q19jQ0o4SkoxTmZGUU1WSUxKTjVBNVZCLV9HMkRHbU5IZmdFZGM5T3JIUFp2VHV4MmpIQVZ1VFlCY0hGRnFjcTRHTkVHNVU3YnRfYzNVcGtsdHBTM1hiVGM?oc=5,"Mon, 28 Apr 2025 07:00:00 GMT",Wealth Solutions Report,"The San Diego-based independent broker-dealer Independent Financial Group (IFG) announced Thursday that it appointed Kevin M. Keefe as its CEO and Chief Operating Officer, replacing Scott Heising, IFG’s Founder, as President.","(""Bank of New York Mellon"" OR ""BNY"") -gossip -celebrity -""fantasy sports"" -""game recap""",2025-04-27,BNY,2026-01-26T17:14:57.474186-05:00,https://www.wealthsolutionsreport.com/ifg-names-kevin-m-keefe-president-and-coo-to-enhance-growth/,"San Diego-based independent broker-dealer Independent Financial Group (IFG) announced Thursday that it appointed industry veteran Kevin M. Keefe as its President and Chief Operating Officer to help shape its growth strategy and oversee its compliance, operations, supervision, and product marketing, IFG said in a news release.
He is replacing Scott Heising, IFG’s Founder, as President. Heising will now “focus exclusively on his CEO role,” the firm said.
Keefe joins IFG after more than 30 years of experience in the independent broker-dealer and RIA space, including First Allied Securities, where he served as CEO and President, and Advisor Group (now Osaic), where he was Head of Wealth Management.
He also held executive roles at LPL Financial during its transition to a public company, in addition to senior positions with firms including BNY Mellon, BISYS, Fidelity Investments and NATIXIS.
Most recently, Keefe served as CEO of Realta Wealth from March 2023 until this past January, according to his LinkedIn profile.
At Realta, Keefe “led a full-scale modernization of the 30-year-old firm, rebranding the business, enhancing advisor services, expanding revenue streams, and building a new executive leadership team,” according to IFG.
“With more than three decades of experience in the financial services industry, we are very pleased to welcome Kevin to the IFG leadership team,” said Scott Heising, CEO and Founder of IFG. “Kevin is a proven leader with a strong vision for how to elevate our offering and help our advisors thrive in an evolving landscape.”
David Fischer, IFG’s Co-Founder and Chief Marketing Officer, said, “Kevin is a well-respected figure in the industry, and we’re excited about the energy and expertise he brings. We’re confident he’ll help take IFG advisors, and our firm, to the next level.”
Keefe said, “I’m honored and thrilled to join the outstanding team at IFG, a firm widely respected in the industry for its growth, and its exceptional service with a deep commitment to its financial advisors. I’m looking forward to helping build on IFG’s strengths as we pursue the next phase of growth together.”
IFG supports more than 600 independent financial professionals across over 400 offices in 41 states, it said.
Jeff Berman, Contributing Editor and Reporter at Wealth Solutions Report, can be reached at jeff.berman@wealthsolutionsreport.com",225,2382,2025-04-28
191,8325e468446e0636ec5ba1ffa5c2307330a20304ac381bf72ad62e7a2cb66d23,House Republicans Draft Cuts to Federal Employee Pensions - plansponsor,https://news.google.com/rss/articles/CBMijwFBVV95cUxQU25BWXJMZGIyMXU5ZDhYMG9WSUthcGtzWXMxRktBdDBuakFMakt0NGVfVmZUaEx5MkRXMG1NN3VFaXBOeUZRSDY4QzUzdXk0aFkxZ1YxdnY0emZvOF9hdEduSGgtSlI5QTRnQ3lPdjg5bTdQQ3ZETlNjMWswWjZOeUhkMFFydjl2WW54OUgxNA?oc=5,"Mon, 28 Apr 2025 07:00:00 GMT",plansponsor,"James Comer, R-Kentucky chairman of the House Committee on Oversight and Government Reform, proposes to raise federal and postal employees’ contribution rates to 4.4%, which will raise $30.7 billion for the deficit reduction, with a 4.4% increase in contribution rates based on hiring date, and reducing extra retirement annuity payments to those who retire before age 62, resulting in $10.1 billion savings for new retirees.","(""Bank of New York Mellon"" OR ""BNY"") -gossip -celebrity -""fantasy sports"" -""game recap""",2025-04-27,BNY,2026-01-26T17:14:57.474186-05:00,https://www.plansponsor.com/house-republicans-draft-cuts-to-federal-employee-pensions/,"For more stories like this, sign up for the PLANSPONSOR NEWSDash daily newsletter.
House Republicans Draft Cuts to Federal Employee Pensions
The changes would cause many government workers to contribute more, while receiving reduced benefits.
Federal employees’ pensions could undergo several changes that would gradually reduce their benefits, as part of a Republican federal budget resolution working its way through Congress.
Representative James Comer, R-Kentucky, chairman of the House Committee on Oversight and Government Reform, has offered proposals that would change how federal civilian employees’ benefits are calculated, which would make them pay more into the system while receiving reduced benefits, according to an April 25 release.
“The House Oversight Committee is taking a critical step to advance President [Donald] Trump’s America First agenda and ensure taxpayer dollars are used effectively, efficiently, and responsibly,” Comer said in a statement. “The Committee will consider legislation that delivers a substantial win for fiscal responsibility, achieving a reduction in the federal deficit of over $50 billion dollars.”
The committee is set to consider the legislation on Wednesday, April 30.
The proposal would raise federal and postal employees’ contribution rates to 4.4%, which the release estimated would raise $30.7 billion for the deficit reduction. The current contribution rates are based on each employee’s date of hire, as follows: 0.8% if hired in or before 2012; 3.1% if hired in 2013; and 4.4% if hired in or since 2014, according to the U.S. Department of Commerce.
The Federal Employees Retirement System is the retirement system for federal civilian employees. It provides benefits from three different sources: a Basic Benefit Plan, Social Security and the Thrift Savings Plan, a defined contribution plan. In fiscal 2022, more than 2.7 million people received federal civil service annuity payments; 56% received annuities under the Civil Service Retirement System (which covers federal employees hired before 1984), and 44% received annuities under FERS, according to information from FERS and the Congressional Research Service.
For new federal retirees, the proposal would eliminate the extra retirement annuity payment currently provided to those who retire before age 62, lasting until they reach their Social Security retirement age and saving $10.1 billion, according to the release.
Federal pension benefits would also be reduced by basing retirees’ benefits on the highest average five years of salary, compared with the current standard of the highest average three years of salary, which would save $4.75 billion, according to the release.
Other changes include offering federal employees the option to “serve at will” to receive higher take-home pay, which would save $4.54 billion.
The proposals come as Republicans develop their larger federal budget resolution, which House Speaker Mike Johnson, R-Louisiana, has previously said he would like to finalize as early as May.
The House GOP has a goal of finding at least $2 trillion in savings to partially offset the cost of extending the 2017 Trump tax cuts, as well as adding new cuts to taxes on overtime and tips. The Senate, in its version of the budget plan, has given itself leeway to make as little as $4 billion in cuts.",425,3338,2025-04-28
