,Unnamed: 0,id,title,link,published,source,query,priority_weight,article_date,prediction_date,fetched_at,title_len,actual_link,full_text,summary
29,29,41a01e343794494e418f879868b881f8ac22ccdcd4d03ba185dfac78701557e5,Mortgage rates surge over 7% as tariffs hit bond market - CNBC,https://news.google.com/rss/articles/CBMigwFBVV95cUxOQnRabzZJeVlvYVZudXhDWFdacnFGUUE0SHE4R3J5aUsxWUJUQlhDTzVMRzJfSmZYMk92aVRWZHR2M1gxOW90ZE40d1puN3JJc0N6ZmZfWEo1ZmlvSmZQd1hITnFveHh5YnJzbDJhRUJkbmQ1QkVDdXBjTnoxRmhLRmxuUdIBiAFBVV95cUxNVXMtbGNpb1NBVmhFUlZ1emdXVklWa1JwYmpZTUJBc3JiRDRqZU1WdGR2ZUJvV0oyTzBld3hHWVB6XzlyUTFrUklWX0dxVDYxNmM3ZE1neHFmWmRfczQwUm5JOU1GNHQwekE1X2R0cm1iSjNsbmVnMXlmYm5OamVXVW0wNk90TlAz?oc=5,"Fri, 11 Apr 2025 07:00:00 GMT",CNBC,"[SOURCES] ""bond market"" AND (selloff OR rally OR volatility)",6,4/10/2025,4/11/2025,2026-02-19T14:55:00.693229,62,https://www.cnbc.com/2025/04/11/mortgage-rates-surge-tariffs-bond-market.html,"The average rate on the popular 30-year fixed mortgage surged 13 basis points Friday to 7.1%, according to Mortgage News Daily. That's the highest rate since mid-February.
Mortgage rates have been on a roller coaster ride all week, as bond yields spiked higher mid-week when President Donald Trump's new tariffs on dozens of countries went into effect. Yields dropped when Trump lowered the tariff rate on most countries hours later. Tariffs on Chinese imports, however, currently stand at 145%.
But bonds began selling off again Friday, despite a cooler-than-expected inflation report. Mortgage rates loosely follow the yield on the 10-year Treasury.
""There have been some bad weeks for bonds here and there over the careers of most anyone who's alive to read these words, but unless your career began before 1981, you just lived through the worst week you've ever seen in terms of the jump in 10-year yields,"" said Matthew Graham, chief operating officer at Mortgage News Daily.
Graham said there are two ways to look at where bonds are trading today: ""This is either the end of the worst week for 10-year yields since 1981 or the end of a fairly average two weeks that fit right in with the trend of the past 18 months.""
On Friday, another monthly report on consumer sentiment came in substantially lower than expected. The expectation for inflation jumped from 5% in March to 6.7% in April, the highest level since 1981.
All of this comes right in the heart of the all-important spring housing market. For most consumers, a home is their single largest investment.
""Forget about housing in this environment, with mortgage rates back up, consumers certainly concerned about the job market, housing will also be on the weak side,"" said Nancy Lazar, chief global economist at Piper Sandler, on CNBC's ""The Exchange"" on Friday.","Mortgage News Daily's average rate on the 30-year fixed mortgage surged 13 basis points Friday to 7.1%, despite a cooler-than-expected inflation report, with a lower expectation for inflation jumped from 5% in March to 6.7% in April, the highest level since 1981."
30,30,6095a18e44c3777980e76cb4927ad14e02474a9ce1fc8c030a8e1c1ebfd64280,Mattel and Hasbro stocks notch new lows after Trump's China tariff escalation - CNBC,https://news.google.com/rss/articles/CBMigwFBVV95cUxNR0EwQXhya0R0cVBrTjVpZV9VSGhYbThfZzZ0bjdVbV85WEpQdnJHdHVJS0FhUm1lR3B6WUF3blUtWUM4dDRVbTFsNWlXdGpJS2liaXlYUEwtZUNnUzdpSWZVZGQ3TGlBenhmckJ4bXduaVR6VU4wbGFuaktiSmtrTDdPSdIBiAFBVV95cUxPOEREVUpBNlAyRXlaVHlFYW82LTRUS3hiU3BEVXE2NnV4VVBFbkJmb2R0ZDllQzl6c2xaRGVmaVNGVXJxazBpU0FLQ3U4Z2YxbWhqX1VuNmlRWVh0RzlRUF9IMlJwa2FUTm5faV9SeVAzUDh4b3BjV282Uzktd1ZpbEhRb0c2SVlm?oc=5,"Fri, 11 Apr 2025 07:00:00 GMT",CNBC,"[SOURCES] ""reciprocal tariff"" AND (China OR global OR pause)",8,4/10/2025,4/11/2025,2026-02-19T14:55:00.693229,84,https://www.cnbc.com/2025/04/11/mattel-hasbro-stocks-trump-china-tariffs.html,"There's trouble in Toyland.
Toy giants Mattel and Hasbro have seen their stocks battered by President Donald Trump's escalated trade war with China.
On Friday, Mattel shares hit a new 52-week intraday low of $13.95 apiece, down 27% since Trump announced his aggressive and far-reaching ""reciprocal tariff"" policy last week. Shares of Rival Hasbro fell to a 52-week low of $49 on Wednesday, down more than 20% in the same time period.
The toy industry is heavily reliant on supply chains in China, leaving toy makers at the mercy of trade policy. Bank of America estimates that both Mattel and Hasbro source around 40% of their U.S. product from China.
Trump last week announced steep levies on imports from dozens of countries, hitting China with one of the highest tariff rates. On Wednesday, Trump lowered those rates for most countries to a blanket 10% tariff, except for China, which he hit even harder.
The current U.S. tariff on Chinese imports stands at 145%. China has retaliated, imposing its own levy of 125% on American goods.
Margins for toys are typically in the high single digits, meaning there's little wiggle room for companies to absorb the cost of these new fees. Expectations are that toy companies will need to pass on the entire cost of Trump's tariffs to the consumer through higher prices on the shelf.
These price hikes, which could see some toy product double in cost, is set to coincide with this year's back-to-school season.
— CNBC's Tom Rotunno contributed to this report.","On Friday, Mattel shares hit a new 52-week intraday low of $13.95 apiece, down 27% since Trump announced his aggressive tariff policy last week, with Rival Hasbro down to $49, down more than 20% in the same time period, and the current U.S. tariff on Chinese imports stands at 145%, while China's levy of 125% on American goods is set to coincide with back-to-school season."
31,31,6551b1c48f38ed767a18beb7c7c2b338f882f1f16bdc10090072b0ba8c5335ee,Oil Prices Drop as China Retaliates With 125% Tariff on U.S. Goods - Crude Oil Prices Today | OilPrice.com,https://news.google.com/rss/articles/CBMisAFBVV95cUxQQkl2WUF2eWp6YTRTb0ZzNVdZMDBfandadEluYWViREF3WXFGX0FJcFloLUJJWlVDdGI2R0tjaHkyV2lvbEhsYWptQlhqZUdsbUl6bGRDbmxiaHBjRWVvR05lMGxkSHF2SkdJNHhYOEN3UmlLTEUwNzJPdjJUUHVUcHNpcDljX2tram8zWkd6eFl2TEdNZFhRQWw5ZG43MGpzc3gwVUl1NVlINVFBYVVCSdIBtgFBVV95cUxQQ0M1SjB0NUE3RU0xUS13MWpyZWpibzl0bjlfRkdjZXNWRVNSQnVqUHh2MGhYeTVVdTZiSWltRmw4aXkxR0x1cUM3cGtEaElidExxTk5fV2lhWGMzUkE1RlZtXzVCMUNMMGFUZHZ4NG1hekFRYTFiaElpdl9lTXRRbXYzUEQ5R1c2TnBsWEdjci0wa094WXFRa0FsRFJkOEpqQ0FOeHFCUEh0azY1V1IwZ1dIZUEtZw?oc=5,"Fri, 11 Apr 2025 07:00:00 GMT",Crude Oil Prices Today | OilPrice.com,"[SOURCES] ""tariff"" AND (China OR Europe OR Canada OR Mexico) AND retaliate",8,4/11/2025,4/12/2025,2026-02-19T14:56:02.119755,106,https://oilprice.com/Energy/Energy-General/Oil-Prices-Drop-as-China-Retaliates-With-125-Tariff-on-US-Goods.html,"China hit back at the U.S. tariffs by raising on Friday the Chinese tariff on U.S. goods to 125% from 84% earlier, escalating the U.S.-China standoff.
“The U.S. imposition of abnormally high tariffs on China seriously violates international and economic trade rules, basic economic laws and common sense and is completely unilateral bullying and coercion,” China’s Finance Ministry said in a statement.
Oil prices, which had been climbing before China's announcement, dropped in response to the news. At the time of writing, both WTI and Brent were in the red at $59.91 and $63.16, respectively.
U.S. President Donald Trump backed down earlier this week from a full-blown trade war with the entire world and announced a 90-day pause in the planned tariffs on all countries. However, China remained in the crosshairs of the Trump Administration, which continued to impose higher and higher tariffs on imports from China.
The U.S. Administration had signaled that countries would be “rewarded” if they did not retaliate.
On Friday, China retaliated and hiked its tariff to 125% for U.S. goods.
“Even if the U.S. continues to impose higher tariffs, it will no longer make economic sense and will become a joke in the history of world economy,” according to a CNBC translation of a statement from the Customs Tariff Commission of the Chinese State Council.
While equity markets took a breather with a short-lived relief rally after the 90-day tariff pause, oil prices continued to be hammered by the U.S.-China trade and tariff tit-for-tat as investors fear economic downturns would dent demand for oil.
Early on Friday in Asian trade, crude oil prices were on track to book their second consecutive weekly loss as markets reel from President Trump’s tariff offensive.
“While the pause offers some relief to markets, there’s still plenty of uncertainty on the trade front,” ING commodity analysts Warren Patterson and Ewa Manthey wrote in a note on Thursday.
“This uncertainty is still likely to drag on global growth, which is clearly a concern for oil demand. Still, conditions are not looking as bad as they were just a few days ago.”
By Tsvetana Paraskova for Oilprice.com
More Top Reads From Oilprice.com
- Cautious Calm in Canada’s Oil Patch as Prices Slide
- U.S. Shale Faces Toughest Challenge Since the 2020 Oil Price Plunge
- Is Oil Demand About to Surge?
The Chinese Customs Tariff Commission said in a statement that “Even if the U.S. continues to impose higher tariffs, it will no longer make economic sense and will become a joke in the history of world economy”.
Early on Friday in Asian trade, crude oil prices were reeling from Trump’s tariff offensive. However, China feels it has nothing to lose since its economy is the world's most competitive and is capable of absorbing Trump's tariffs of 104% and still beating him at his game.
Dr Mamdouh G Salameh
International Oil Economist
Global Energy Expert","China hit back at the U.S. tariffs by raising its tariffs to 125% from 84% earlier, escalating the standoff, with WTI and Brent in the red at $59.91 and $63.16, respectively, and WTI, Brent, and Ewa Manthey in the green, with a 90-day relief rally on Friday, with investors fearing economic downturns would dent oil demand."
32,32,6b7d8be5550466a49b435844f816bfa53aa809b99cec51714650fef4f1a51d27,"Top Stories | China hits back with 125% tariffs, volatility grips markets, Vance may visit India soon & more - LinkedIn",https://news.google.com/rss/articles/CBMiowFBVV95cUxNVEZwc1k3bDNudE00VmZJX3dCQUtGRndYUDNlQklkSlBMc2lRMUgxQ2VBOTNQTGdoMzZobTRyZDdzSXhzcHQyMkZRc19Da2pDWGNsdk1ZQy0yYUFEd0VOaWFyRzIyRWtFc25CcHRfQXVLYWdoTzdhVmRxak5rMGVTSEc1QV9uTFdtTUR1b1hScURfd3R6ZUh5bDNLeGEyYkp0MHYw?oc=5,"Fri, 11 Apr 2025 07:00:00 GMT",LinkedIn,"[SOURCES] ""trade war"" AND ""United States"" AND escalate",8,4/10/2025,4/11/2025,2026-02-19T14:55:00.693229,119,https://www.linkedin.com/pulse/top-stories-china-hits-back-125-tariffs-volatility-grips-markets-m1zlc,"Top Stories | China hits back with 125% tariffs, volatility grips markets, Vance may visit India soon & more
🔝 Top 10@10 — CNBC-TV18’s daily newsletter featuring the top 10 stories on markets, corporate updates, economic insights, and financial highlights — delivered at 10 pm.
US-China tensions intensified as Beijing fired back with 125% tariffs on American goods, vowing to “fight to the end” if provoked. Chinese President Xi Jinping, addressing the trade conflict publicly for the first time, said China is “not afraid” of external pressure. As global markets reeled, oil extended its decline and gold surged to record highs in both India and international markets.Back home, Indian equities fared better than most global peers, even as the Nifty and Sensex posted mild weekly losses of 0.3%. A sharp Friday rebound, backed by global cues and broad-based buying, helped recoup earlier losses. The Nifty soared 429 points to close at 22,829, while the Sensex rallied 1,310 points to 75,157. PSU stocks led the charge, even as IT and metal names lagged.Meanwhile, India and the US are working to finalise a bilateral trade pact within 90 days, with a visit by US Vice-President JD Vance expected soon. India may also cut import duties on luxury vehicles to aid the trade talks.On the corporate front, TCS reported minor ramp-downs amid tariff uncertainty, while Apple may shift more focus to India. Wall Street cheered JPMorgan and Morgan Stanley’s strong Q1 results, and Dabur’s Hajmola candy landed in a GST classification row.
‘Fight to the end’: China hits back with 125% tariffs on US goods after Trump’s latest hike
China has escalated its trade dispute with the United States, announcing additional tariffs of up to 125% on a broad range of American goods starting April 12.
The Chinese Ministry of Commerce issued a stern warning, saying: “If the US insists on continuing to substantially infringe upon China’s rights and interests, China will resolutely counterattack and fight to the end.”
China has also filed a new complaint with the World Trade Organization (WTO) against the latest tariff measures by the US.
Oil’s selloff gathers pace as trade war roils global markets
Oil headed for a second weekly loss as mounting disorder in global markets triggered by US President Donald Trump’s aggressive trade policy spurred concerns about a recession and a flight from risk.
Brent fell toward $63 a barrel, and is about 4% lower this week after hitting a four-year low, while West Texas Intermediate was below $60. Frantic selloffs have hit US stocks, bonds and the dollar on rising concerns about the impact of US tariffs, including on China, the biggest crude importer.
Nifty logs weekly loss despite Friday surge; IT, metals lag, PSUs shine
Indian markets posted mild weekly losses on Friday, but outperformed global peers, with a sharp rebound in the final session helping pare much of the earlier damage. The Nifty and Sensex ended the week 0.3% lower, while the Nifty Bank dropped nearly 1%, dragged by weakness in IT, metal and realty stocks.
Friday’s rally, powered by strong global cues and broad-based buying, saw the Nifty jump 429 points to close at 22,829, while the Sensex rose 1,310 points to finish at 75,157. The Nifty Bank climbed 762 points to 51,002 and the Nifty Midcap 100 added 919 points to 50,502.
India, US aim to finalise trade pact framework in 90 days; JD Vance may visit soon for talks
India and the United States are working towards finalising the form and framework of a Bilateral Trade Agreement (BTA) within the next 90 days, sources told CNBC-TV18.
Sources have told CNBC-TV18 that US Vice-President JD Vance may visit India soon for further trade talks, as both sides are looking to sign the first tranche of a BTA, focusing on goods, by the fall of 2025.
India is treading carefully in its pursuit of Free Trade Agreements (FTAs), with Commerce and Industry Minister Piyush Goyal emphasising that the country will not be pressured into signing deals that compromise national interest.
India considers slashing import duties on high-end cars to ease trade deals
India is reportedly considering a significant reduction in tariffs on premium imported cars, potentially paving the way for smoother trade negotiations with the United States, the United Kingdom, and the European Union.
Sources familiar with the matter suggest that while India is firm on not offering any unilateral concessions to the US, a substantial cut in duties on high-end vehicles priced above ₹40 lakhs, coupled with a fixed annual quota, is under active discussion within the government.
Gold prices hit all-time high in India, globally: Check today’s rates for 10 grams
Recommended by LinkedIn
Gold prices surged to all-time highs in both international and Indian markets on Friday (April 11), as investors rushed to the safety of the yellow metal amid a global economic storm.
In India, the price of 24-karat gold touched ₹93,390 per 10 grams, while 22-karat gold was priced at ₹85,610 per 10 grams. Even 18-karat gold, widely used in jewellery, climbed to ₹70,050 per 10 grams, according to Goodreturns data.
TCS sees minor delays and ramp-downs, but no major project cancellations amid tariff worries
Tata Group IT services provider Tata Consultancy Services (TCS) is seeing some minor ramp downs and delays in decision-making by clients, but no major project cancellations so far, despite uncertainty around US tariffs.
K Krithivasan, Managing Director and Chief Executive Officer of TCS, said, “Our customers are also in a wait-and-watch mode regarding how things will unfold. I have not seen any panic from them.”
Milind Lakkad, Chief Human Resources Officer at TCS, said the company is yet to take a final call on salary hikes for FY26 due to the uncertain business environment.
Apple may strengthen India business over US-China tensions: WSJ's Peter Landers
Apple could grow its business in India due to ongoing uncertainty in US-China trade relations, says Peter Landers, Business Editor at The Wall Street Journal Asia.
“I think they have no choice unless there is a deal very quickly between the US and China, and the tariffs go back to where they were before Trump became president for a second time,” Landers said. “Then Apple would probably try to stick closer to the status quo.”
He noted that President Donald Trump’s trade policies have been unpredictable, creating a lot of uncertainty for companies like Apple. “His tariff policies have changed so frequently, sometimes day by day,” he added.
JPMorgan Q1 profit beats estimates on $46-billion revenue; Jamie Dimon flags economic risks
US bank JPMorgan Chase on Friday (April 11) reported first quarter earnings that surpassed Wall Street expectations, driven by stronger-than-anticipated revenue from trading, consumer banking, and wealth management, as per a CNBC report.
The bank posted earnings of $5.07 per share, compared to the $4.61 consensus estimate from LSEG (London Stock Exchange Group), though the figures may not be directly comparable. Revenue came in at $46.01 billion, topping the $44.11-billion forecast.
The investment banking company noted strong performance across its global franchise, particularly in Asia and services for hedge funds, fuelled by increased client activity in a volatile trading environment.
Exclusive | Dabur’s Hajmola candy under DGGI scanner over GST classification
In yet another classic case of a GST classification issue, Dabur India's popular Hajmola candy is under investigation by the Directorate General of GST Intelligence (DGGI).
According to sources, Dabur India and the DGGI are at loggerheads. ""Directorate General of GST Intelligence (DGGI) investigating GST classification of Hajmola Candy under GST,"" sources added.
The probe is being led by DGGI's Coimbatore zone, which is currently examining whether Hajmola candy should be treated as an ayurvedic medicine attracting 12% GST or as a candy taxed at 18%.
Beyond #Newsroom
Follow the CNBC-TV18 channel on WhatsApp
Catch crispy news updates on the go!- CNBCTV18 Minis
Watch all #videos under one segment- CNBCTV18 Binge
We bring you real-time updates and analysis of the stock market- Real-time market updates
We'll see you tomorrow with another engaging 'Top 10@10.'
The recent market volatility is certainly concerning. It's crucial for businesses to stay informed and adaptable in these unpredictable times. The potential visit from Vance could also open new avenues for international collaboration.","China hit back with 125% tariffs on US goods after Trump's latest hike, with Nifty and Sensex posting mild weekly losses, Nifty soared 429 points to close at 22,829, and Nifty Bank jumped 1,310 points to 75,157, while Nifty bank climbed 762 points to 51,002 and Xi Jinping's Q1 results, with a rebound backed by global cues and broad-based buying recouping earlier losses, and a slashing trade pact with"
