,Unnamed: 0,id,title,link,published,source,query,priority_weight,article_date,prediction_date,fetched_at,title_len,actual_link,full_text,summary
17,17,cbceb5767d0cd2a6f1d9542ed73e97578466635b8d2c7300320ea3aa2ab1f627,"Trump open to tariff negotiations, contradicting White House aides - CNBC",https://news.google.com/rss/articles/CBMijwFBVV95cUxOLWNBdENiNTlBTERwWUQ2VkZ5OHBNN3MxZUl3U3gwWE5BSTVBNy1aRXk1OV8xUXhjUnFFb01NRjBIS0hZTXRiME54b0k3d3ZTbTl1dHNoQkxjY2RxX3lSZllFNEo3U183Q09JOWcwTXgyLTg4dHltenpoNUhfSTdncExsQW9GUHQwQWY3WFJoTdIBlAFBVV95cUxPQThaYlRNNEt0ZGV6WWc0bHNfNEdvOUUxeFdVbmVtZkVKUzdDS3ptUUZtUFhJT21idjZwMnNNT3lQQjRMX21hcUFDZ0JpczcwOXNOa1hWWXVWaGRQYWF6RGE3Y3hsdU9GaU81ZWFVaElMLWxGMU5ITmd4REoxODA3TmF0MmpYbEtMTHBOTVoxN3Q4ZmRJ?oc=5,"Fri, 04 Apr 2025 07:00:00 GMT",CNBC,"[SOURCES] ""Federal Reserve"" AND (emergency OR surprise OR pivot)",10,4/3/2025,4/4/2025,2026-02-19T14:44:55.355735,73,https://www.cnbc.com/2025/04/03/trump-tariffs-live-updates-stock-market-trade-war.html,"What you need to know
- Markets dropped the day after President Donald Trump imposed a far-reaching ""reciprocal tariff"" policy, including a 10% baseline tariff on almost every country.
- The plan slaps much steeper tariff rates on many countries, including 34% on China, 20% on the European Union, 46% on Vietnam and 32% on Taiwan.
- Economists and U.S. trade partners are raising questions about how the White House calculated the tariff rates it claimed other countries ""charge"" the U.S. Experts continue to debate the full potential effects.
- New U.S. tariffs on auto imports also took effect overnight, prompting Stellantis to pause production at its plants in Canada and Mexico.
- Trump now says he is open to negotiations, contradicting White House aides who insist the sweeping tariffs are not a bargaining tactic.
- European stocks closed the day 2.7% lower.
CNBC's reporters covered the tariffs and their effects, live on air and online from our bureaus in Washington; London; Singapore; San Francisco; and Englewood Cliffs, New Jersey.","CNBC's reporters covered the tariffs and effects, live on air and online from our bureaus in Washington, London, Singapore, San Francisco, and Englewood Cliffs, New Jersey, and CNBC, covering their effects on European markets, including 34% on China, 20% on the European Union, 46% on Vietnam and 32% on Taiwan."
18,18,cfab42b13ce30d398f05a2be7755605e88d9c385694a40cd4649d3b78e9efdc3,Trump tariffs could make an already challenging job market even harder: 'It's so incredibly uncertain and unprecedented' - CNBC,https://news.google.com/rss/articles/CBMiqwFBVV95cUxNc0tmamZBazctZnk0dDlBZGdVdnduVUxfSkxvVmZZY1IydXVvbHhIcXZwLTB5ZnpwdXhVN3ZVRG9QRVdoamU0RzBCb0Z4bjUwZWpWbGJneEp2ckc2QlVyZEtnS1VGVFQ4M3NNV3hldXBXQmtsODNTd09URkI0U1lTb1FUOERfQ1V6XzU5TnBKVmVVdTdfcGpleG9sc3d6QzhMdFdnbUR4eVFFMzjSAbABQVVfeXFMT2pIRV8xU3FhOUNnTmUwamo0X2VkTm90eFpuZmFFYmVlQndRMV81NkJpWXVfRzJzSzFTenp6V2J0Z1V6a011Rmp4RXJ2SWw3NHNQTUdVQXMxNHFFQzc3Tmw5NVA4RDJlOW84RzM2UE5nSEdHa1pSWGVTbjZsYlowVjZram83eHRCLTJKYmthbEFXOFhqUkV4RGtTMFpOaVM0RVdmbFlqQndTVXhEMDZFTmU?oc=5,"Fri, 04 Apr 2025 07:00:00 GMT",CNBC,"[SOURCES] ""unemployment rate"" AND (spike OR jump OR unexpected)",10,4/3/2025,4/4/2025,2026-02-19T14:44:55.355735,127,https://www.cnbc.com/2025/04/04/trump-tariffs-could-make-an-already-challenging-job-market-even-harder.html,"Job-seekers could be in for a rougher labor market as a result of the Trump administration's rollout of new tariffs.
The sweeping tariff policy, which includes a 10% baseline tariff on most countries and steeper rates among certain trade partners, caused markets to drop, factories to pause production, and many businesses scrambling to figure out what the moves mean for their workforce and bottom line.
Debra Boggs, founder and CEO of D&S Executive Career Management, an executive search firm, says U.S. companies may react to new tariffs by slowing their hiring. There have been mixed employment reports that show lower than expected job creation, as well as an unexpected March jobs upside surprise.
The economy added 228,000 jobs in March, according to the latest Labor Department data, driven by new roles in health care and social assistance. This was higher than expected and shows steady employment so far.
But the stronger than expected numbers are ""already out of date,"" Mischa Fisher, economist at Udemy, said in a statement. Roughly 280,253 federal workers have been laid off in DOGE-related cutting efforts, and sluggish growth in key sectors like information, finance, manufacturing and professional and business services are ""a warning sign for the strength of the labor market entering the second quarter,"" Fisher said. ""And that's before the tariff announcements.""
What's more, Fisher said, ""hiring has slowed to a level typically associated with an unemployment rate nearly double where it stands now"" at 4.2% in March, an increase from the previous month but still near historic lows.
Boggs tells CNBC Make It her clients, who are vice president-, C suite- and board-level leaders, usually spend two to three months in the hiring process to land a new job; these days, that stretches up to nine months of interviewing.
""We're seeing candidates go through seven, eight, nine rounds of interviews,"" Boggs says.
A March survey of 400 firms showed that a quarter of the companies' chief financial officers said they are scaling back hiring and capital spending plans in 2025 because of tariffs.
Where hiring is stable, and where it's slowing down
Hiring has remained stable in some industries, including health care and technology, Boggs says. But opportunities in manufacturing and alternative energies like wind and solar power have declined, she says.
Now industries reliant on global trade, including retail and consumer packaged goods, ""are all seeming to slow down and really get nervous about what's coming,"" Boggs says.
We have seen a couple of offers get pulled, which is very rare, and lately it's been a little more common.Debra BoggsFounder and CEO of D&S Executive Career Management
Some of her clients are senior-level federal leaders now pivoting to the private sector as the Trump administration works to drastically cut the size of the federal workforce. Others, still, are being told their hiring process is being put on hold as companies lose federal contracts and vendors and must re-evaluate their staffing needs, Boggs says.
In some cases not yet related to the tariff news, ""we have seen a couple of offers get pulled, which is very rare, and lately it's been a little more common,"" Boggs says.
Boggs describes the experience as awful, heartbreaking and devastating for job-seekers she works with. When a candidate spends months on a promising opportunity, she says, it's tough to start from scratch when the position gets eliminated or changes.
""It takes an emotional toll,"" she says.
""I talked to a gentleman the other day, a high-level executive, who spent 45 minutes on the call just openly weeping with me,"" she says. ""It affects every facet of their lives.""
'No one is leaving if they don't have to'
Boggs's senior-level clients tend to be currently employed and looking for their ""next best thing"" or opportunities for career advancement. But ""now, no one is leaving if they don't have to.""
""Then the other side of that is people who have lost their jobs and are in a state of panic about finding the next thing, how long they're going to be out, how hard it is,"" Boggs says. ""They're in a cycle of worry and concern, and that's affecting their job search as well.""
A demoralizing job search feeds into itself, she says: ""If you're going to show up well in an interview, you need to have a strong sense of confidence and a healthy ego. And if you've gotten rejection after rejection, your concern and panic will show up in your job search.""
Boggs says she's heard that many businesses pausing their hiring decisions now are looking to figure out their plans for the second half of the year, ""because we're kind of saying things aren't going to bounce back in Q2.""
She's at a loss of how to coach some clients about what to expect in the future job market.
""It's so incredibly uncertain and unprecedented. I have no idea,"" she says. She encourages job-seekers to not wait out the current market and to understand they'll have to ""do everything you can to compete at the highest level.""
""It's really hard to help clients through tough times when we don't now how long it's going to last,"" she says.
Do you want a new career that's higher-paying, more flexible or fulfilling? Take CNBC's new online course How to Change Careers and Be Happier at Work. Expert instructors will teach you strategies to network successfully, revamp your resume and confidently transition into your dream career. Pre-register today and use coupon code EARLYBIRD for an introductory discount of 30% off $67 (+taxes and fees) through May 13, 2025.
Plus, sign up for CNBC Make It's newsletter to get tips and tricks for success at work, with money and in life.","Debra Boggs, founder and CEO of D&S Executive Career Management, says U.S. companies may react to new tariffs by slowing hiring, sluggish growth in health care and social assistance industries, and job-seekers are ""in a cycle of worry and concern, and that's before the tariff announcements,"" writes Mischa Fisher, economist at Udemy."
19,19,cfcae62e180d27f5494cb1e0eb6ded1d2d5d582ae557ead23f737dc6a473e9e7,President Donald Trump says Fed Chair Powell should cut interest rates and 'stop playing politics' - CNBC,https://news.google.com/rss/articles/CBMickFVX3lxTE9BZUFPd0pPQUZpMlZoaVVPa3RQTUMxX1I3WW51Vi1CM1pyMzBmclpxX1BKOExzTEtpbGJRS0Zmdk82NEZoSUFDOEVITFdFZC1IYzNaUk83QVJ5VVVEUVpldi1aLTJ5WnM2T2ktR0FkNnhHUdIBd0FVX3lxTFAxb2didFVzWDVVOU43dmY0UmVPMnJBd2hvSjBPdzE0MGpiR1A2SzVOaEgtUHZVMUd4Y0QycG4wZUh3b2tVR013ZTdYa2ZIMHNmM2dvNlREa3FmQVZZNkdmaXlUUHd2NmtpU0tZM1J2VHhJZXdheFFj?oc=5,"Fri, 04 Apr 2025 07:00:00 GMT",CNBC,"[SOURCES] ""Federal Reserve"" AND (emergency OR surprise OR pivot)",10,4/3/2025,4/4/2025,2026-02-19T14:44:55.355735,105,https://www.cnbc.com/2025/04/04/trump-tariffs-jerome-powell.html,"President Donald Trump on Friday called for Federal Reserve Chair Jerome Powell to cut interest rates, even as his tariff blitz roiled markets and raised fears of a rebound in inflation.
""This would be a PERFECT time for Fed Chairman Jerome Powell to cut Interest Rates. He is always 'late,' but he could now change his image, and quickly,"" Trump said in a post on Truth Social. ""Energy prices are down, Interest Rates are down, Inflation is down, even Eggs are down 69%, and Jobs are UP, all within two months - A BIG WIN for America. CUT INTEREST RATES, JEROME, AND STOP PLAYING POLITICS!""
Trump's post comes as global equity markets are selling off sharply. The president's new tariff policy, unveiled Wednesday, has raised concerns about a global economic slowdown.
The new trade policies may also be a barrier that keeps the Federal Reserve from cutting. The central bank has paused its rate cuts in recent meetings, in part because progress on reducing inflation appeared to have plateaued. The new tariffs could lead to a widespread rise in prices, at least temporarily, that further complicates the inflation picture.
On Friday, Powell told business journalists in Arlington, Virginia, that the Fed was ""well positioned to wait for greater clarity"" before making changes like rate reductions. He also said that the tariffs announced were ""significantly larger than expected.""
Market-based interest rates have already fallen sharply this week, with the 10-year U.S. Treasury yield now below 4%. Treasury yields often fall when investors are worried about a potential recession.
Movement in the fed funds futures market implies that traders now expect at least four rate cuts of 0.25 percentage point from the central bank this year, according to the CME's FedWatch tool. At a meeting last month, central bankers projected just two rate reductions.
Trump has downplayed concerns about this week's market volatility, at one point comparing the reaction to a patient who undergoes surgery.
When asked about those comments Friday, Powell said, ""I make it a practice not to respond to any elected officials comments, so I don't want to be seen to be doing that. It's just not appropriate for me.""
Trump regularly commented on central bank policy during his first term as president and was often at odds with Powell. That has led to speculation that he might look to remove the Fed chair before his term ends next year. Trump said in December that he does not intend to fire Powell, and the Fed chair has said he doesn't think the president is legally allowed to do so.
The Fed has two main goals in promoting price stability and maximizing employment. The March nonfarm payrolls report released Friday showed a slight increase in unemployment to 4.2%, but the rise of 228,000 jobs was more than expected.
Friday's jobs report does not reflect any impact of the tariffs announced this week.","Donald Trump on Friday called for Federal Reserve Chair Jerome Powell to cut interest rates, even as his tariff blitz roiled markets and raised fears of a rebound in inflation, said the Fed was ""well positioned to wait for greater clarity"" before making rate reductions, and said the tariffs were ""significantly larger than expected"" in Arlington, Virginia."
20,20,0c85b157c8f738af79446a2ee9b546bc2fac3c041a5a9c2716f7c66e46b827fa,"Trump's pharmaceutical tariffs could raise costs for patients, worsen drug shortages - CNBC",https://news.google.com/rss/articles/CBMipgFBVV95cUxNQ1V2MWl6Sk5HQTBIdFRvdjlsRmFkN2RyLVIteHBKVFpiaFFWa1BpWW5NTkJLRVpfdUplcDdiTkJCMDd2dFRxM1gxYTZoNlY2eDU5RnZrUlZrWjc4SWU5VzlnRnFhaGhuUjRmcjRrdmlOV0JpR0pMckN6NEpFOHZKMVJfZ2hSbzlwOWVaVFZjQmpRclEtLUJ2WVc0RzVUN21ldnJxcE5R0gGrAUFVX3lxTE4xNl9BY0NVeGdNVVhzNFdTQUFEUjlMRW5ibnZ6OFFhMHJCYVdSVlhBdEJZT3BzMDBaUVJ6Q2xFMmtKTlhCYkFpZ0hFSERxZDRqTnZRY1VQMUluTnhzNDRYTGNSMVpBNnRNd293OWNzTlNxM29PcU5CRFRHdXZ4dkxCVmhtRXlrcnZVTTNCcE9SVlhabG1XN1lEM0p5TkR2T1AzbThDTm1ZZ1FkQQ?oc=5,"Fri, 11 Apr 2025 07:00:00 GMT",CNBC,"[SOURCES] ""Trump"" AND ""tariff"" AND (announce OR pause)",8,4/11/2025,4/12/2025,2026-02-19T14:56:02.119755,91,https://www.cnbc.com/2025/04/11/trump-pharmaceutical-tariffs-may-raise-costs-worsen-drug-shortages.html,"President Donald Trump's planned tariffs on pharmaceuticals imported into the U.S. could have wide-ranging consequences for drugmakers and American patients, some experts told CNBC.
The duties could disrupt the complex pharmaceutical supply chain, drive up the prices of drugs in the U.S. and exacerbate shortages of critical medicines, some health policy experts said. Drugmakers often rely on a global network of manufacturing sites for different steps of the production process.
""We are already in a state where prescription drugs are unaffordable to many,"" Mariana Socal, a health policy professor at the Johns Hopkins Bloomberg School of Public Health, told CNBC.
""Anything that we change, any trade policies, any tariff policies, anything that further increases the cost of prescription drugs, be it in the supply chain, the distribution network, risks increasing costs to the consumer even further and just worsening the affordability crisis for drugs in America that we've had for a long time,"" she said.
Trump this week doubled down on plans to impose ""major"" pharmaceutical-specific tariffs ""very shortly,"" which battered the stocks of some drugmakers early Wednesday. He said he would pause steep tariff rates on dozens of countries following a market fallout that same day, but it does not appear to apply to levies on specific industries like autos, steel, aluminum and pharmaceuticals.
Trump exempted pharmaceuticals from his sweeping tariffs unveiled last week. Still, he has said duties on drugs will encourage drugmakers to move manufacturing operations into the U.S. at a time when domestic production in the industry has shrunk significantly.
But experts said it's unclear whether tariffs will influence more companies to make more drugs in the U.S. It would cost drugmakers billions of dollars and take at least several years for them to do so, they added.
Some drugmakers, such as Eli Lilly, Bristol Myers Squibb and AbbVie, may be better positioned than others to weather tariffs because they have more major manufacturing plants in the U.S. than internationally, TD Cowen analyst Steve Scala said in a note last week. The majority of their sites responsible for producing the active ingredients in drugs are also in the U.S., he added.
Meanwhile, Novartis and Roche ""look more at risk"" because they have few U.S. plants and a higher share of active ingredient sites that are international, Scala said.
The impact of tariffs will look different depending on the type of drug, experts said. Manufacturers of already cheaper generic drugs, which account for about 90% of the medicines prescribed in the U.S., could get squeezed the most by tariffs, according to Arda Ural, EY Americas Life Sciences Leader.
Those medications, which are generally much more affordable for patients, have far lower profit margins than branded drugs and often rely on ingredients made in China and India, so tariffs could force some generic drugmakers to leave the U.S. market altogether.
Pharmaceutical tariffs could ultimately undermine the government's efforts to rein in the high costs of health care in the U.S. Americans pay around two to three times more for prescription drugs than people in other developed countries, according to a 2024 report from RAND.
Drug shortages could get worse
The tariffs could worsen the unprecedented shortfall of medicine in the U.S., which is driven by factors such as manufacturing quality control and demand surges. There are 270 active drug shortages in the U.S., which has remained unchanged for the past three quarters, according to data from the American Society of Health-System Pharmacists.
But some drug categories will likely be more vulnerable to shortages than others if tariffs go into effect, said Marta Wosińska, a senior fellow at the Brookings Institution's Center on Health Policy.
Generic sterile injectable drugs, which are commonly used in hospitals, are already more prone to shortages and have faced persistent supply issues for years. Those include products like IV saline bags, cancer chemotherapy drugs and lidocaine, which is used to numb pain.
Generic sterile injectables have complex manufacturing processes and low profit margins, which could make it more difficult for their producers to absorb tariff-induced cost increases.
Manufacturers of those injections also have limited ability to pass on cost increases due to certain contracts with so-called group purchasing organizations that lock in the prices but not the quantity of what they buy, Wosińska said. Group purchasing organizations broker drug acquisitions for hospitals and other health-care providers, and their contracts with manufacturers generally last one-to-three years.
If manufacturers of generic sterile injectables can't pass on higher costs, they may exit the U.S. market and worsen shortages of those essential drugs, said Wosińska. She said their other option is cutting costs, which is ""concerning"" because it could affect a product's quality and lead some manufacturers to temporarily slow down production due to issues like contamination.
Generic oral drugs similarly face low margins, but their manufacturing is less complex and the market is more competitive. These include common pills such as statins for high cholesterol, multiple blood pressure medications and metformin for blood sugar control.
Those oral drugs are used the most by Americans, as about 187 billion generic drug tablets and capsules were dispensed in retail and mail pharmacies in 2024 alone, according to a recent Brookings report by Wosińska.
She told CNBC that those drugs function more like a ""spot market,"" where pharmacies and buyers can quickly switch suppliers if one source is disrupted by tariffs. While levies may drive up prices, manufacturers of these drugs have fewer binding contracts, allowing them to pass on higher costs more easily than their injectable counterparts can, according to Wosińska.
Costly medications could get pricier
The impact of tariffs on costly branded medications, which have patent protections and don't face competition from generic drugs, will look a lot different, some experts said. Tariffs on medications imported from Europe would likely hit the hardest, as a significant amount of branded drug manufacturing is done there and in the U.S.
""Branded products are already predominantly manufactured in the U.S. at about 50%, and the primary importation is from Europe at about 35%,"" said EY's Ural.
There is ""little to no manufacturing"" of those drugs in China or India, he said.
Still, branded drugs typically have higher profit margins and more stable supply chains than generic medications. That makes branded manufacturers better positioned to absorb higher costs from tariffs or pass them onto payers – and ultimately, consumers.
Since manufacturers of a given branded drug monopolize its market, they could raise its price, leaving ""the American consumer with no other choice because those products are protected by patents that no one else has,"" Johns Hopkins' Socal noted.
""With tariffs, the question will become, how much higher prices are we going to pay for these branded products?"" she said.
Patients will likely notice higher prices for branded drugs more than increases to generic medication prices, Wosińska said. A price hike on a branded drug would directly translate to higher out-of-pocket spending for people in high-deductible commercial insurance plans or with high coinsurance rates, she noted.
It's still unclear what Trump's tariffs will look like. But a patient with a 20% coinsurance rate could see their monthly out-of-pocket expenses rise if tariffs are imposed, since their share of the cost is directly tied to the branded drug's price.
By contrast, generic medications already have lower price points, so ""even if a $3 drug increases by 25%, that is not going to be something that will really show up for patients,"" Wosińska told CNBC. She added that many patients have insurance plans with fixed co-pays for those drugs.
But overall, ""the primary impact on patient pocketbooks would be indirect—premiums would likely rise as the payer spending on drugs increases,"" she noted in her Brookings report.
The question is whether manufacturers will want to raise prices as they face fierce blowback from patients and lawmakers on both sides of the aisle for charging higher drug prices in the U.S. compared to other countries. Both the Trump and Biden administrations have targeted that imbalance.
In a March 28 note, Evercore ISI analyst Umer Raffat said he heard from multiple CEOs of pharmaceuticals that ""they may have to pass on some of the impact [from tariffs] as a price increase.""
But he said doing so will ""add more fire"" to criticism of the higher prices of many drugs in the U.S. relative to Europe. Raffat said it could backfire ""in a big way,"" and could revive a plan from Trump's first term that ties U.S. prices to those paid in other similar countries.
Reshoring manufacturing won't be easy
Some Wall Street analysts have raised concerns that it will be difficult to reshore production in the U.S. because it is costly and could take several years.
""Global supply chains are complex, with Pharma among the most–it's not as simple as moving where someone screws in little screws to make an iPhone,"" BMO Capital Markets analyst Evan Seigerman said in a note on Wednesday.
He said the tariffs will ""likely do little to shift manufacturing"" back to the U.S. since companies already have robust operations in the country. Seigerman said he expects most large pharmaceutical companies will likely set a goal of ""waiting until the end of Trump's presidency to consider more permanent manufacturing decisions.""
Some companies have already invested billions to boost U.S. manufacturing. This year, Eli Lilly and Johnson & Johnson both announced new domestic manufacturing investments worth $27 billion and $55 billion, respectively, over several years.
But some of those drumakers have already pushed back on tariffs, warning about their potential impact on research and development in the industry.
""We can't breach those agreements, so we have to eat the cost of the tariffs and make trade-offs within our own companies,"" Eli Lilly CEO Dave Ricks told BBC in an interview last week. ""Typically, that will be in reduction of staff or research and development, and I predict R&D will come first. That's a disappointing outcome.""","The President Donald Trump's planned tariffs on generic sterile injectables, including IV saline bags, cancer chemotherapy drugs, and lidocaine, will disrupt the U.S. supply chain, drive up prices, and exacerbate shortages of critical medicines, experts say, with 270 active drug shortages in the US, a TD Cowen analyst says."
