,Unnamed: 0,id,title,link,published,source,query,priority_weight,article_date,prediction_date,fetched_at,title_len,actual_link,full_text,summary
11,11,a344fff80935371acd93781664d651acd6a2bca8dfd95076f1ee2a267609fa0b,Live updates: Stock market suffers worst week since 2020 after China retaliates against Trump tariffs - Associated Press News,https://news.google.com/rss/articles/CBMiakFVX3lxTFBMUFVNN0lnVFFMUU9CbHpfWHBQY1NoV1E4QnoxWTUtUDJQQ2tJN0U4UmQzRmpWQnNDdTdGdHMxQi1kQjkwWGg5X2JjaEZwSjd2aEhreHhBNEY0UGQyT2Q4cFdNNlFCVllnTHc?oc=5,"Fri, 04 Apr 2025 07:00:00 GMT",Associated Press News,"[SOURCES] ""trade war"" AND ""United States"" AND escalate",8,4/3/2025,4/4/2025,2026-02-19T14:44:55.355735,125,https://apnews.com/live/donald-trump-news-updates-4-4-2025,"Live updates: Stock market suffers worst week since 2020 after China retaliates against Trump tariffs
Follow the latest news on President Donald Trump and his administration | April 4, 2025
Markets are facing their worst crisis since the COVID crash after China matched President Donald Trump’s big raise in tariffs in the U.S. president’s escalating trade war. The S&P 500 plummeted 6% Friday, the Dow Jones Industrial Average plunged 5.5% and the Nasdaq composite dropped 5.8%.
Not even a better-than-expected report on the U.S. job market, which is usually the economic highlight of each month, was enough to stop the slide.
Other news we’re following:
- China halts TikTok deal following Trump tariff announcement: Trump had a TikTok deal in place Wednesday for the app’s operations to be spun off into a new company owned and operated by a majority of American investors, but the deal collapsed Thursday after the U.S. president announced wide-ranging tariffs, according to a person familiar with the negotiations.
- Republicans move ahead with Trump’s ‘big’ bill of tax breaks: More than a month after House Republicans surprised Washington by advancing their framework for Trump’s $4.5 trillion in tax breaks and $2 trillion in spending cuts, Senate Republicans voted Thursday to start working on their version. The largely party-line vote, 52-48, sets the stage for a potential Senate all-nighter Friday, spilling into the weekend.
- Fed Chair says tariffs will likely raise inflation: The Trump administration’s expansive new tariffs will likely lead to higher inflation and slower growth, Fed Chair Jerome Powell said Friday. Wall Street investors, meanwhile, now expect five interest rate cuts this year, a number that has increased since the tariffs were announced Wednesday.
It’s called vote-a-rama in the Senate, and it’s just what it sounds like
The Senate is about to dive into a late night — or all-nighter — of contentious debate over the GOP’s plan for trillions of dollars in tax breaks and spending cuts, what Trump has dubbed a “big, beautiful bill.”
But first, amendments.
It’s a unique Senate process called “vote-a-rama” in which senators will be voting on dozens of amendments to shape the bill – mostly from Democrats trying to gut the GOP priorities and replace them with their own.
Expect proposals from the Democrats to stop Trump’s tariffs, end tax breaks for billionaires and save Medicaid from potential cuts. None are expected to be accepted as Republicans, who have majority control of Congress, push their plan forward, and off to the House for next steps.
Navy lists books removed from Naval Academy library in new DEI purge
Books on the Holocaust, histories of feminism, civil rights and racism, and Maya Angelou’s famous autobiography, “I Know Why the Caged Bird Sings,” were among those removed from the U.S. Naval Academy’s library earlier this week, after Defense Secretary Pete Hegseth’s office ordered the school to get rid of ones that promote diversity, equity and inclusion.
The Navy late Friday provided the list of 391 books that have been take out of its library. The move marks another step in the Trump administration’s far-reaching effort to purge so-called DEI content from federal agencies, including policies, programs, online and social media postings, and curriculum at schools.
Pentagon leaders turned their attention to the Naval Academy last week when a media report noted the school hadn’t removed books that promoted DEI.
Tune in: It’s Friday night live in the Senate
The pizzas have been carted in for the Republicans. Tacos on the Democratic side.
Senators are preparing to work through the night on the GOP’s budget framework for Trump’s “big” bill of tax breaks and spending cuts, despite the economic turmoil from his new tariffs.
Republicans are eager to take this next step toward what they hope will be the centerpiece of the GOP domestic policy agenda.
Democrats, who as the minority party don’t have enough votes to stop the plan, at least intend to shine a bright light on the details — and drag out the process.
Columbia must give 30 days’ notice before sharing student records with Congress’ antisemitism probe
A Manhattan federal judge says Columbia University must give detained activist Mahmoud Khalil and other students 30 days’ notice before handing over any more documents to Congress as it investigates antisemitism on college campuses.
But U.S. District Judge Arun Subramanian on Friday stopped short of outright blocking the Manhattan university from providing records to the House Education and Workforce Committee, as lawyers for the activists sought.
U.S. Rep. Tim Walberg, who chairs the House committee, called the decision a “victory for credible oversight.”
Lawyers for Khalil and the other students said the decision means they can continue pursuing their legal fight.
▶ Read more about the court actions regarding Congress’ college antisemitism investigation
Trump administration nixes plan to cover anti-obesity drugs through Medicare
Trump’s administration has decided not to cover expensive, high-demand obesity treatments under the federal government’s Medicare program.
The Centers for Medicare and Medicaid Services said late Friday that it would not cover the medications under Medicare’s Part D prescription drug coverage.
Trump’s predecessor, Joe Biden, proposed a rule in late November after Trump won reelection that would have extended coverage of drugs like Zepbound and Wegovy. The rule was not expected to be finalized until Trump took office.
Medicare does pay for drugs like Wegovy for patients who have heart disease and need to reduce their risk of future heart attacks, strokes and other serious problems.
Interior secretary orders national parks to be open and accessible as workforce is cut
Interior Secretary Doug Burgum is directing national parks to “remain open and accessible” and says officials will ensure proper staffing to do so.
The order, issued late Thursday, also calls for a detailed review of each park’s operating hours, trail closures and other limits on visitor services.
Burgum said his department and the National Park Service “are committed to ensuring that all Americans have the opportunity to visit and enjoy our Nation’s most treasured places.”
But park advocates and others questioned how park employees could comply, given the Trump administration’s workforce reductions. Fewer workers can mean shorter hours, delays, closed campgrounds, overflowing trash bins, unkept bathrooms, and risks to public safety, they say.
The park service has lost around 1,500 permanent employees since the beginning of this year, Rick Mossman, president of the Arizona-based Association of National Park Rangers, said Friday in a statement. And it’s “bracing for another reduction in force expected in the very near future.”
WATCH: How Trump’s latest tariffs could affect your wallet, AP Explains
President Donald Trump’s sweeping new tariffs, on top of previous levies and retaliation worldwide, are expected to increase prices for everyday items. Steeper tariffs mean you’ll likely see higher prices from the grocery aisle to your next car repair.
US says it’s providing another $7 million for Myanmar quake victims
Criticized for a slower and smaller U.S. response than usual, the Trump administration said Friday it was providing about another $7 million to aid victims of the 7.7 magnitude quake in Myanmar, on top of the $2 million promised earlier.
State Department spokesperson Tammy Bruce announced the aid in a post on the social media site X. Bruce said the money would help stricken communities in the Southeast Asian nation with shelter, food, medical care and water.
The Trump administration has worked with Elon Musk to dismantle the main U.S. aid agency and most of its programs, and lay off almost all of its staff. While China and some other nations have sent scores or hundreds of people to help with the aftermath of the March 28 quake, the U.S. has disclosed sending only a three-member assessment team, announced days after the quake.
Reader post: Can you explain currency manipulation?
Currency manipulation takes place when a country deliberately pushes the value of its currency lower, which makes its companies’ exports cheaper in foreign markets and gives them an unfair competitive advantage. It can do this by selling its own currency and buying another country’s — usually the U.S. dollar — in foreign exchange markets.
In announcing sweeping tariffs this year, Trump has accused other countries of using this tactic to gain an unfair edge over American companies. China, in particular, was notorious for years for manipulating its currency lower to boost exports. But last November, the Biden administration’s Treasury Department concluded that “no major U.S. trading partner’’ had manipulated its currency to gain an unfair advantage in the fiscal year that ended in June 2024.
The U.S. dollar’s status as the world’s “reserve currency’’ — used far more than others in global commerce — tends to keep its value high, which can put U.S. exporters at a disadvantage.
Reader question: What is Trump trying to accomplish with tariffs?
It is often unclear what the president’s endgame is, which adds to the uncertainty surrounding his trade wars. He has given different reasons for his sweeping import taxes, and sometimes they contradict each other.
Trump has said that tariffs can raise money for the U.S. Treasury, protect U.S. industries, draw factories to the United States and serve as a negotiating tactic to get other countries to bend to his will, whether it means getting them to reduce their own tariffs or to crack down on the illegal flow of drugs and immigrants into the United States.
But if tariffs mean Americans buy fewer imports or if companies relocate factories to the United States, then revenue from tariffs will fall, undercutting his plan to use them as a money generating alternative to the income tax.
Trump and his own aides have also offered competing explanations for the sweeping “reciprocal’’ tariffs he announced Wednesday.
The president on Thursday said the levies “give us great power to negotiate’’ and were coaxing other countries into offering to lower their own trade barriers. “Every country is calling us,” Trump said. “That’s the beauty of what we do. We put ourselves in the driver’s seat.’’
The same day, White House trade adviser Peter Navarro told CNBC that the tariffs were meant to stay: The idea is to get companies to produce goods in America, not abroad, bringing down longstanding U.S. trade deficits. “Let me make this very clear,” he said. “This is not a negotiation. This is not that. This is a national emergency.’’
Supreme Court allows Trump administration to cut teacher-training money, for now
The justices split 5-4, with Chief Justice John Roberts joining the three liberal justices in dissent.
A federal judge in Boston issued a temporary restraining order sought by eight Democratic-led states that argued the cuts were likely driven by efforts from Trump’s administration to eliminate diversity, equity and inclusion programs.
The federal appeals court in Boston turned away an appeal from the administration to allow the cuts to resume.
The emergency appeal is among several the high court is considering in which the Justice Department argues that lower-court judges have improperly obstructed Trump’s agenda.
▶ Read more about the Supreme Court’s ruling
JUST IN: Supreme Court, for now, allows Trump administration to cut teacher-training money as part of its anti-DEI efforts
S&P 500 plunges 6% to close its worst week since 2020
The worldwide sell-off for financial markets slammed into a higher, scarier gear. The S&P 500 plummeted 6% Friday, the Dow Jones Industrial Average plunged 5.5% and the Nasdaq composite dropped 5.8%.
Markets are facing their worst crisis since the COVID crash after China matched President Donald Trump’s big raise in tariffs in an escalating trade war.
TikTok deal fell apart after Trump tariff announcement, source says
Trump had a TikTok deal in place Wednesday for the app’s operations to be spun off into a new company based in the U.S. and owned and operated by a majority of American investors. Under that deal, ByteDance would maintain a minority position.
But the deal collapsed Thursday after Trump announced wide-ranging reciprocal tariffs, including against China.
ByteDance representatives called the White House to indicate that China would no longer approve the deal until there could be negotiations about trade and tariffs. That’s according to a person who spoke on the condition of anonymity to discuss the sensitive details of the negotiations.
Washington and Oregon are latest states to ask a court to reject order overhauling US elections
The two states made the move a day after Democratic officials in 19 others filed a similar lawsuit.
Washington Attorney General Nick Brown told a news conference that Washington and Oregon sued separately because they conduct elections entirely by mail and would be particularly harmed by the president’s efforts.
“Neither the Constitution nor any federal law gives the president authority to set rules for how states conduct elections,” Brown said.
Friday’s lawsuit is the fifth against the executive order since it was issued last week. The order includes new requirements that people provide documentary proof of citizenship when registering to vote and a demand that all mail ballots be received by Election Day.
White House spokesperson Harrison Fields responded on Friday, calling the proof-of-citizenship requirements “common sense” and objections from Democrats “insane.”
JUST IN: S&P 500 drops 6% and Dow plunges 2,200 to close the worst week since 2020 after China retaliates against Trump’s tariffs
Defense Secretary Pete Hegseth to travel to Panama for meetings with country leaders
The planned meeting follows recent Trump administration complaints about alleged Chinese interference with the operations of the critical Panama Canal shipping lane.
Trump has spoken negatively about the U.S. move more than 20 years ago to relinquish control of the waterway to Panama, and has threatened to retake it. He has argued that the U.S. was being overcharged for using it.
Sean Parnell, chief Pentagon spokesperson, said Hegseth will participate in the 2025 Central American Security Conference. He said Hegseth will be in meetings that “will drive ongoing efforts to strengthen our partnerships with Panama and other Central American nations toward our shared vision for a peaceful and secure Western Hemisphere.”
Judge blocks Trump from dismantling agency that funds community groups in Latin American countries
A federal judge agreed on Friday to block the Trump administration from dismantling the Inter-American Foundation, an independent agency that distributes grant money to community development groups in Latin American and Caribbean countries.
U.S. District Judge Loren AliKhan ruled that the administration doesn’t have the authority to remove the head of the group. Congress created the foundation more than 50 years ago. It has disbursed $945 million to thousands of grant recipients in roughly three dozen countries.
AliKhan, who President Biden appointed, found that only the foundation’s board can fire its head.
“Because neither President Trump nor Mr. Marocco had the authority to fire her from her position as the president of the IAF, Ms. Aviel is likely to succeed on the merits of her case,” AliKhan wrote.
▶ Read more about the judge’s ruling
TikTok creators react to the deadline extension
Terrell Wade, a comedian and content creator with 1.5 million followers on TikTok, is relieved to hear that the platform will continue to operate in the U.S., but he’s also been hedging his bets by growing his presence on other services.
“I’m glad there’s an extension, but to be honest, going through this process again feels a bit exhausting,” he said.
Singer Ellise Gitas, 26, who goes by the mononym Ellise, agrees that the unpredictability of the social platform’s status makes planning difficult.
“The whiplash of uncertainty around TikTok has been creatively draining for myself and many other musicians,” she said. “Artists need stability to build momentum, and right now, it feels like we’re being asked to sprint on a moving treadmill.”
JUST IN: White House was nearing TikTok deal, but China hit brakes after Trump announced wide-ranging tariffs, AP source says
US has twice as many measles cases so far this year than in all of 2024
The once common, vaccine-preventable virus continues to spread in active outbreaks in at least five states.
Health experts in Texas and elsewhere have said the outbreak could continue for months and even threaten the U.S.’s status as having eliminated measles spread.
The new count Friday from the U.S. Centers for Disease Control and Prevention comes as a proposal to cut billions of dollars of health funding winds its way through the courts.
Health Secretary Robert F. Kennedy Jr. has delivered a tepid message on the importance of vaccination against measles, saying it should be encouraged while also claiming the shots cause “deaths every year.” The measles, mumps and rubella vaccine has been used safely to prevent illness for more than 60 years and is 97% effective against measles after two doses.
More than 500 law firms sign brief criticizing Trump’s executive orders targeting legal community
Friday’s legal brief supports the law firm of Perkins Coie in its challenge to a Trump executive order meant to punish its attorneys. It urges the judge to permanently block the order.
Perkins Coie is among roughly a half-dozen law firms subject to the order, which seeks to suspend lawyers’ security security clearances, terminate federal contracts and block access to federal buildings. The firm won a court order temporarily blocking enforcement of several provisions, but its court case is still pending.
The brief says the executive order poses a “grave threat to our system of constitutional governance and to the rule of law itself.”
JUST IN: Judge blocks Trump administration from dismantling a US agency that funds community groups in Latin American countries
EU trade commissioner met with Trump officials: ‘The EU-US trade relationship needs a fresh approach”
Maros Sefcovic said he had a “frank” two-hour discussion Friday with U.S. Commerce Secretary Howard Lutnick and U.S. Trade Representative Jamieson Greer and told them the U.S. tariffs are damaging and unjustified.
“E.U.'s committed to meaningful negotiations but also prepared to defend our interests,” Sefcovic wrote on X. In terms of concrete results from the discussion, Sefcovic could only offer, “We stay in touch.”
Trump picked 20% as his rate for taxing European imports as part of a sweeping set of tariffs on countries that trade with the US.
EU officials have said they’re ready to negotiate to rescind or modify the European Union’s response but will otherwise impose retaliatory tariffs on a range of U.S. goods.
The US must return a Maryland man mistakenly deported to an El Salvador prison, judge says
Kilmar Abrego Garcia was expelled last month despite a court order shielding him from deportation to his native El Salvador, where he faced likely persecution by local gangs.
Federal prosecutors he was mistakenly put on the plane, but they can’t get him back now because the Salvadoran national is outside U.S. jurisdiction.
U.S. District Judge Paula Xinis described his deportation as “an illegal act” and questioned why he was sent to a Salvadoran prison where observers say human rights abuses are routine. “Why is he there, of all places?” the judge asked.
The ruling came after Abrego Garcia’s wife, a U.S. citizen, joined dozens of supporters at a rally urging his immediate return.
The White House has alleged that he’s a member of the MS-13 gang. His lawyers say there’s no evidence of that.
Judge moves legal case of detained Turkish Tufts University student to Vermont
A federal judge has moved a case involving a Tufts University doctoral student being held at an immigration facility in Louisiana to Vermont.
Rumeysa Ozturk, who is from Turkey, was taken into custody as she walked along a street in a Boston suburb on March 25. After being taken to New Hampshire and then Vermont, she was moved to an Immigration and Customs Enforcement detention center in Basile, Louisiana.
Justice Department lawyers had argued that Ozturk’s petition was filed in the wrong state, that it should be dismissed and that her case should go before an immigration judge.
A judge on Friday moved the case to Vermont, where Ozturk was being held at the time her lawyers filed the petition seeking her release.
Ozturk is among several people with ties to American universities who attended demonstrations or publicly expressed support for Palestinians during the war in Gaza and who recently had visas revoked or have been stopped from entering the U.S.
▶ Read more about the decision to move Ozturk’s case to Vermont
JUST IN: A Massachusetts judge moves the legal case of a Turkish Tufts University student who is detained in Louisiana to Vermont
Leading US Jewish group suggests Trump crackdown on foreign students has gone too far
The CEO and national director of the Anti-Defamation League said it’s important to preserve the civil rights of protesters while fighting antisemitism.
“We should be holding people accountable for actual crimes, not Orwellian thoughtcrimes,” Jonathan Greenblatt wrote in a Thursday op-ed for the website eJewishPhilanthropy.
The State Department has been revoking visas for international students in a crackdown on pro-Palestinian activism, and Greenblatt said it “hasn’t been even remotely clear” that their due process rights have been upheld.
The op-ed marks a shift from the ADL’s statement supporting the Trump administration’s first arrest of a Columbia University student.
“We appreciate the Trump Administration’s broad, bold set of efforts to counter campus antisemitism,” the ADL posted on X on March 9. That post also called for due process in “any deportation action or revocation of a Green Card or visa.”
Congress members demand answers on Trump’s NSA firings
Members of Congress are condemning Trump’s decision to abruptly fire the director and deputy director of the National Security Agency. They’re demanding explanations.
U.S. Rep. Jim Himes, ranking member of the House Intelligence Committee, sent a letter to Director of National Intelligence Tulsi Gabbard and Secretary of Defense Pete Hegseth asking why Gen. Timothy Haugh and his deputy Wendy Noble were fired.
“Public reporting suggests that your removal of these officials was driven by a fringe social media personality, which represents a deeply troubling breach of the norms that safeguard our national security apparatus from political pressure and conspiracy theories,” Himes, D-Conn., wrote.
Far-right activist and commentator Laura Loomer appeared to take credit for the firings Friday in a post on X, saying she raised concerns to Trump about Haugh’s ties to Gen. Mark Milley and the Biden administration and questioned the NSA chief’s loyalty to the president.
▶ Read more about Trump’s National Security Agency firings
Trump abruptly fires the 4-star general who led the National Security Agency
That’s according to U.S. officials and members of Congress. The White House and the Pentagon have provided no reasons for the move.
Senior military leaders were informed Thursday of the firing of Air Force Gen. Tim Haugh, who also oversaw the Pentagon’s Cyber Command, the officials said. They received no advance notice about the decision to remove a four-star general with a 33-year career in intelligence and cyber operations, according to the officials, who spoke on the condition of anonymity to discuss personnel decisions.
The move has triggered sharp criticism from members of Congress. This latest dismissal of national security officials by Trump comes as his Republican administration faces criticism over his failure to take any action against other key leaders’ use of an unclassified Signal messaging chat that included The Atlantic Editor-in-Chief Jeffrey Goldberg to discuss plans for a military strike.
The Energy Department identifies thousands of ‘nonessential’ positions at risk of DOGE cuts
These workers would not be protected if there is another round of large-scale firings, according to a document obtained by The Associated Press.
The jobs at risk include more than 8,500 positions across the Energy Department and the National Nuclear Security Administration — which upgrades and maintains the nation’s nuclear warheads. It was not immediately clear if every position identified as nonessential would be eliminated.
States sue over billions of dollars in delayed NIH research
Sixteen states sued the Trump administration Friday for disrupting research funding from the National Institutes of Health, citing billions of dollars of science in limbo.
The lawsuit filed in federal court in Boston challenges “unreasonable and intentional delays” in grant applications — many that directly impact patients, such as possible Alzheimer’s-preventing drugs — as well as terminations of already-issued grants.
Since January, required meetings to review NIH grant applications have been repeatedly canceled or postponed. The suit also says NIH has withheld final approvals of grants that had already passed initial steps — and withheld payments for multi-year projects that are supposed to be automatically renewed.
The suit, the latest in a string of lawsuits against research cuts and mass firings, argues that this violates congressional allocations.
Dow plunges 2,100 in a worsening global sell-off after China retaliates against Trump tariffs
The worldwide sell-off for financial markets is slamming into an even higher, scarier gear.
The S&P 500 tumbled 5.7% Friday, the Dow Jones Industrial Average plunged 2,100 points and the Nasdaq composite dropped 5.7%. Markets are facing their worst crisis since the COVID crash after China matched President Donald Trump’s big raise in tariffs in an escalating trade war.
Not even a better-than-expected report on the U.S. job market, which is usually the economic highlight of each month, was enough to stop the slide. The price of oil slid to its lowest level since 2001.
JUST IN: Dow drops 2,000 as market plunge deepens after China retaliates against Trump tariffs
Trump says he needs more time to bring TikTok under American ownership
Congress had mandated that the platform be divested from China by Jan. 19 or barred in the U.S. on national security grounds, and the Supreme Court unanimously upheld that law. But Trump moved unilaterally to extend the deadline to this weekend, and now he’s giving his administration another 75 days to find a U.S. owner.
Trump has entertained an array of offers from U.S. businesses seeking shares of the popular social media site, but China’s ByteDance, which owns TikTok and its closely held algorithm, has insisted the platform is not for sale.
TikTok also has said it prioritizes user safety, and China’s Foreign Ministry has said China’s government will not ask companies to “collect or provide data, information or intelligence” in foreign countries. But if the extension means ByteDance keeps control of TikTok’s algorithm, those national security concerns persist.
▶ Read more about Trump’s TikTok decisions
Sell-off worsens worldwide and Dow drops 1,700 after China retaliates against Trump tariffs
Stock markets worldwide are careening even lower Friday after China matched President Donald Trump’s big raise in tariffs in an escalating trade war. Not even a better-than-expected report on the U.S. job market, which is usually the economic highlight of each month, was enough to stop the slide.
The S&P 500 was down 4.8% in afternoon trading, after earlier dropping more than 5%, following its worst day since COVID wrecked the global economy in 2020. The Dow Jones Industrial Average was down 1,714 points, or 4.2%, as of 2:12 p.m. Eastern time, and the Nasdaq composite was 4.9% lower.
So far there are few, if any, winners in financial markets from the trade war. European stocks saw some of the day’s biggest losses, with indexes sinking more than 4%. The price of crude oil tumbled to its lowest level since 2021. Other basic building blocks for economic growth, such as copper, also saw prices slide on worries the trade war will weaken the global economy.
▶ Read more on market reactions to Trump trade war
Federal judge orders FEMA to comply with his order to release millions in funding to states
Despite Judge John McConnell’s preliminary injunction last month requiring the Federal Emergency Management Agency funding to resume, nearly two dozen states said they have not received any “significant dispersal of funds since February.”
The federal government argued the delays were not tied to a directive from the White House Office of Management and Budget — which was the subject of the lawsuit — but rather a FEMA decision to add “internal controls” to prevent fraud and abuse.
McConnell sided with the states who argued there has been no processing of awards and that FEMA’s review process was based “covertly” on an executive order from Trump on immigration that among other things targeted so-called sanctuary cities.
Data obtained by AP shows 20% vacancy rates at nearly half of National Weather Service offices; experts warn on safety
An analysis of all 122 National Weather Service field offices following Trump administration job cuts also shows eight offices missing more than 35% of their staff as severe weather chugs across the nation’s heartland, according to detailed vacancy data obtained by The Associated Press.
The weather offices issue up-to-the-minute warnings during dangerous storm outbreaks such as the tornadoes that killed seven people this week and this weekend’s “catastrophic” flooding. But staffing shortages and continued severe weather left meteorologists at the Louisville office unable to immediately survey tornado damage to improve future forecasts.
“It’s a crisis situation,” said Brad Coleman, a past president of the American Meteorological Society.
▶ Read more from the AP’s analysis of National Weather Service cuts
Trump to extend TikTok closure delay
President Donald Trump on Friday posted on his Truth Social media site that he would sign an executive order to keep TikTok “up and running” for another 75 days.
“We do not want TikTok to ‘go dark,’” he said. “We look forward to working with TikTok and China to close the Deal.”
Congress had mandated that the platform be divested from China by Jan. 19 or barred in the U.S. on national security grounds, but Trump moved unilaterally to extend the deadline to this weekend, as he sought to negotiate an agreement to keep it running.
US Attorney General predicts a Supreme Court victory on deportation flights
Pam Bondi defended the Trump administration’s actions to rush hundreds of immigrants to El Salvador while a federal judge sought to block their deportations.
Whether the Trump administration ignored U.S. District Judge James Boasberg’s orders to turn around planes deporting immigrants is a question likely to land before the Supreme Court, Bondi said. And if it does, she anticipates a Trump administration victory.
When asked at a Fort Lauderdale press conference whether she was involved in that decision to ignore Boasberg’s order, Bondi did not answer.
“We should be concerned about the victims of these crimes here in our states more than these defendants,” Bondi said.
Senators gripe at tariff restrictions, express optimism for change in policy
“We’ve heard from businesses across New Hampshire, from the tourism industry to manufacturing, who are very worried about the ability to continue to operate, about the losses that they’re incurring,” said Sen. Jeanne Shaheen.
Some said the uncertainty led their Canadian suppliers and customers to cancel contracts, the New Hampshire Democrat said.
But some GOP senators expressed optimism over the tariffs levied against U.S. trading partners.
Montana Republican Steve Daines said he’s “encouraged” by reports that the Vietnamese government is “actively engaged at the moment with the administration finding ways to lower tariffs.”
Daines said that he hoped the White House will “find ways to reduce some of these tariff and non tariff barriers that’s affecting a lot of our American businesses, American farmers and ranchers.”
Senate Democrats pin blame for plunging markets squarely on Trump
“Regular people cannot ride this out,” said Sen. Brian Schatz, D-Hawaii.
He noted that the first day’s trading after Trump’s tariffs announcement was the worst in five years, and that stock values were still plummeting, wiping out retirement savings, as he prepared to speak on the Senate floor.
S&P 500 companies lost $2.4 trillion in value on Thursday, Sen. Gary Peters, D-Mich., said, and “as I speak right now, another $2 trillion lost.”
“He’s playing poker with Americans’ livelihoods, with Americans’ retirement savings and with Americans’ hard-earned income,” Peters said.
California governor hopes trading partners won’t retaliate against his state
“California leads the nation as the #1 state for agriculture and manufacturing — and it’s our workers, families, and farmers who stand to lose the most from this Trump tax hike and trade war,” Gavin Newsom said in a statement.
“To our international partners: As the fifth largest economy in the world, the Golden State will remain a steady, reliable partner for generations to come, no matter the turbulence coming out of Washington. California is not Washington, D.C.”
Under Newsom’s direction, the state will seek “new strategic trade relationships” with key partners, including Mexico, Canada and China, since over 40% of California imports come from the three countries, his office said.
Brazil sees other big trade agreements sidelining the US
Brazil’s Vice President Geraldo Alckmin said Trump’s sweeping tariffs could accelerate the Mercosur–European Union trade agreement, which was signed in December and awaits ratification by each member nation in Europe and South America.
Alckmin — who also serves as Brazil’s minister of industry, development and trade — told the podcast Direto de Brasilia Thursday night that the government will continue to negotiate and doesn’t intend to use a fast-tracked retaliation bill that President Luiz Inácio Lula da Silva has yet to sign.
“It’s a good and necessary piece of legislation, but we don’t intend to use it. What we want to do is engage in dialogue and negotiation,” Alckmin said. “Even though Brazil got the lowest tariff, 10%, it’s still bad. No one wins in a tariff war.”
Democratic leader says Trump’s tariffs trap American families. Republican hopes for more dealmaking
Sen. Chuck Schumer called them “a brutal pincer move with American families trapped in the middle.”
“Trump’s tariffs raise costs on one side, and Trump’s budget cuts rob people of health care, nutrition, Medicaid, more on the other, and it squeezes them,” Schumer said.
GOP senate leaders meanwhile gave room for what they hope are presidential parleys with each nation’s leaders.
“The president is a dealmaker if nothing else, and he’s going to continue to deal country by country with each of them,” said Sen. John Barrasso, a Wyoming Republican who is no. 2 in GOP Senate leadership.
Barrasso said Treasury Secretary Scott Bessent told Senate Republicans this week that the tariffs would be a “high level mark with the ultimate goal of getting them reduced” unless other countries retaliate.
Federal Reserve chair says Trump tariffs likely to raise inflation and slow US economic growth
Jerome Powell said the tariffs and their likely economic and inflationary impacts are “significantly larger than expected” and are “highly likely” to lead to “at least a temporary rise in inflation.”
“Our obligation is to ... make certain that a one-time increase in the price level does not become an ongoing inflation problem,” Powell said in remarks delivered in Arlington, Virginia.
Powell’s focus on inflation suggests that the Fed will likely keep its benchmark interest rate unchanged at about 4.3% in the coming months. He emphasized that the Fed will likely stay on the sidelines until the full impact of the tariffs on the economy become clear.
“That just seems like the right thing to do in this period of uncertainty,” Powell said.
▶ Read more about the Federal Reserve chairman’s views on Trump tariffs impact
Federal labor unions sue Trump over union-busting executive order
The federal lawsuit filed in Oakland, California on Thursday challenges his order to end collective bargaining in agencies with national security missions.
The unions say Trump’s March 27 order applies the national security exemption too broadly and seeks to punish them for speaking out against his agenda.
“AFGE is not going to be intimidated by a bully who is throwing a temper tantrum because our union is beating them in the court of law and in the court of public opinion,” said Everett Kelley, national president of the American Federation of Government Employees.
The National Treasury Employees Union is challenging the same order in Washington, D.C. federal court, and the Justice Department has a pending suit in the Western District of Texas on behalf of eight federal agencies that want to end their collective bargaining agreements.
Trump pressures Fed chair Powell to cut interest rates
Trump suggested that the stock market turmoil caused by worldwide tariffs makes it the “PERFECT time” for Fed Chairman Jerome Powell to cut interest rates.
“He is always ‘late, but he could now change his image, and quickly,” Trump wrote on his social media platform.
Presidents of both political parties have respected the Federal Reserve’s status as an independent agency, but Trump continues to pressure Powell. Trump nominated Powell in 2017 to serve as chair.
“CUT INTEREST RATES, JEROME, AND STOP PLAYING POLITICS!” he wrote.
Trump says he had a ‘very productive call’ with Vietnam’s leader
Trump posted on his Truth Social platform Friday that Vietnamese President To Lam “wants to cut their Tariffs down to ZERO if they are able to make an agreement with the U.S.”
The sweeping “Liberation Day” tariffs Trump said he’s imposing on countries around the world includes a 46% tariff on Vietnam, which is a major trading partner with America.
Since the two nations restored diplomatic relations in 1995, bilateral trade has grown to a record high of $138 billion in goods trading in 2022.
US attorney general on MS-13 arrests: ‘We’re coming after you’
Pam Bondi announced federal charges Friday against three men arrested last month in the 2015 killing of a man who was stabbed about 100 times and shot. The cases were reopened in 2020 after going cold.
Bondi joined law enforcement officials in Fort Lauderdale to promote the Justice Department’s efforts to go after the MS-13 gang, which the Trump administration has labeled a “foreign terrorist organization” to justify deportations.
“More arrests are coming,” Bondi said. “If you are a gang member living in this country, I’d self-deport right now.”
The announcement comes a week after Bondi lauded the arrest of the alleged East Coast leader of the MS-13 gang.","President Trump's sweeping ""Liberation Day"" tariffs reopened in 2020, reaffirming his commitment to a ""high level mark with the ultimate goal of reducing inflation and slow US economic growth,"" a federal judge announced Friday, citing a 'very productive call' with Vietnamese President To Lam ""wants to cut their Tariffs down to ZERO if they are able to make an agreement."""
