,Unnamed: 0,id,title,link,published,source,query,priority_weight,article_date,prediction_date,fetched_at,title_len,actual_link,full_text,summary
0,0,0798677b1df2aff47a7df7014fa72de4ce745b87258843557073099007affcd6,"US Stock Market Highlights: Dow slides 1,600 points, S&P 500, Nasdaq post biggest single-day losses since 2020 - CNBC TV18",https://news.google.com/rss/articles/CBMizgFBVV95cUxOQnppZ2R3OXZTak5kWjBDUzNnbGFNWl9uWkVRNlRxT3NDbmdrdVdubkU4YV9iWUk0QnpVbzg1aVF5amdhV0txaTdGcGw3emJ5UDB5eEhIMnp4LWRUeVFPSkVPSFJuWHdWam1KZVN5RG9XM1pLNmt2Nlp0WkQ2X0FTNGdDWGJNbThhYVhGVGRSN1hlTzM4VjRZMUxtNDg1ZFVtYUFkNXhLYm1DNV9NcEh5T1JJYjlQaUNWdG9Hd3BwUnFza3NpRm50S01NZU95QdIB0wFBVV95cUxPb0Q0ZFlodExpUC1FNVJPazBzeXBTaHJUQ3hDRVgySENOQzFwTzh4QVFhWHRhLWxnY053U2N3OXhWOXJNYVM5SG8wUkllb1NLNDYtNXRER3IzOGQxQjhvZU8zX0E4SkJKQjQzU1JsRzJCWFJZQkc3YnU1RXNPaV9FU0Vva2ZORlZ1T0ktanE5NFh2ME1NUnVZOXQ5RWwzTFRWQXF0aTFra09YVlBXVGNXZndZQkIzLWtmTW9NVTB4c2x3eERmeW5rMnQ0MjJWX3lMX3FR?oc=5,"Fri, 04 Apr 2025 07:00:00 GMT",CNBC TV18,"[SOURCES] ""interest rate"" AND ""Federal Reserve"" AND unexpected",10,4/3/2025,4/4/2025,2026-02-19T14:44:55.355735,122,https://www.cnbctv18.com/world/us-markets-live-today-dow-jones-djia-nasdaq-futures-trump-liberation-day-tariffs-liveblog-19583858.htm,"Stay tuned for other updates on our website: CNBCTV18.com.
You can follow us on Twitter: @CNBCTV18Live @CNBCTV18News
S&P 500 down 275.05 points, or 4.85%
Nasdaq Composite down 1,053.60 points, or 5.99%
Dow Jones Industrial Average down 1,682.61 points, or 3.98%
The US stock market is down almost 10% since President Donald Trump’s inauguration, marking the worst 10-week start under a new president since George W. Bush in 2001 during the height of the dot-com selloff.
US President Donald Trump’s new tariffs could lead to a 1% contraction in global merchandise trade volumes this year, according to the WTO chief. The WTO director-general urged members to manage tensions responsibly and safeguard gains made under WTO’s Most-favoured-nation status.
“I think it’s going very well. It was an operation, like when a patient gets operated on, and it’s a big thing. I said this would exactly be the way it is. … The market’s are going to boom. The stock is going to boom. The country is going to boom. And the rest of the world wants to see is there any way they can make a deal,” Trump said.
Nike and Apple dropped 13% and 9%, respectively. Five Below fell 26%, Dollar Tree down 11%, and Gap falls 20%. Nvidia down 7% and Tesla 5%.
The SPDR S&P Bank ETF (KBE) have fallen around 8%, while the SPDR S&P Regional Banking ETF (KRE) is down more than 9%. Both are on track to post their biggest single-day fall since the regional banking crisis in March 2023. Western Alliance Bancorp is the top sectoral loser, falling around 14%. Citigroup and Bank of America are down 11% and 10%, respectively.
The US dollar experienced its largest single-day decline on record, dropping by 2.1% against major currencies. Investors are concerned about the potential negative impact of President Trump’s sweeping trade tariffs on the US economy, leading to a shift away from the dollar and towards safer assets like the Japanese yen and Swiss franc. The decline in the dollar is further fuelled by expectations of interest rate cuts by the Federal Reserve to stimulate growth, potentially weakening the dollar further.
US President Donald Trump’s new tariffs could lead to a 1% contraction in global merchandise trade volumes this year, according to the WTO chief. The WTO director-general urged members to manage tensions responsibly and safeguard gains made under WTO’s Most-favoured-nation status.
US alcohol companies were relieved by Trump’s tariff announcement, as imports from Mexico and Canada remain largely unaffected. However, imported canned beer and empty aluminium cans were hit with a 25% tariff, impacting companies like Constellation Brands. The threat of a 200% tariff on European wines and spirits remains, posing a risk for US whiskey exporters like Brown-Forman.
Trump’s tariffs on major cocoa-producing countries could significantly impact US chocolate makers. This would make the cost of supplies relatively more expensive compared to other regions. Chocolatiers have already faced challenges due to a supply shortage that drove cocoa futures to record highs last December. Jonathan Parkman, head of agricultural sales at commodities broker Marex Group, expressed the severity of the situation. He warned that the cost increase will likely be passed on to consumers, potentially harming US chocolate demand and making the country’s chocolate exports less competitive.
US companies lost billions in value after President Trump imposed sweeping tariffs on foreign imports. The tariffs, which economists predicted would be worse than expected, led to a significant drop in the US financial markets, impacting sectors like airlines, clothing, and technology.
Consumer staples are the best performers today, with bond proxy utilities also slightly in the green. This is because of the strong performance of large food and household goods companies, such as Philip Morris and Altria (tobacco), Coca-Cola and Pepsi (soft drinks), Colgate-Palmolive (toothpaste), General Mills (cereal and snacks), and Campbell’s. This offsetting performance is in contrast to the declines experienced by retailers such as Target, which source products overseas.
The US stock market has plummeted by almost 10% since Trump’s inauguration, marking the worst 10-week start under a new president since George W Bush in 2001, during the height of the dot-com selloff. The S&P 500 Index is virtually in a correction, having experienced over $3 trillion in value erosion over the 52 trading sessions since Trump took office on January 20. This decline surpasses the start of the previous five administrations, with only Bush’s first term (roughly 18%) coming close.
Apple suppliers fell as much as 10% following the Trump administration’s tariff announcement, with Apple itself dropping 8.4%. Despite the drop, Jefferies remains positive on Apple’s supply chain, emphasising the need for diversification efforts.
Stocks plummeted on Thursday, sending the S&P 500 back into correction territory. This decline was triggered by President Donald Trump’s announcement of sweeping tariffs of at least 10% and even higher for certain countries. These tariffs raise the risk of a global trade war that could further exacerbate the already struggling US economy. The broad market index experienced a significant drop of 3%, putting it on track for its worst day since September 2022. The Dow Jones Industrial Average plummeted by 1,000 points, or 3%, while the Nasdaq Composite fell by 4%. The decline was widespread across equities, with the number of decliners at the New York Stock Exchange far surpassing the number of advancers by a ratio of six to one. As a result, the S&P 500 reached its lowest level since before Trump’s election victory in November, and nearly $2 trillion was erased from the index.
European stock markets closed sharply lower on Thursday following US President Donald Trump’s unexpected and aggressive tariff announcements. The Stoxx 600 index dropped by around 2.7%, with major global retailers facing significant losses. German sportswear giant Adidas saw a steep decline of 11%, while shipping leader Maersk dropped 9.5%, reflecting concerns over global trade. The Stoxx Autos index fell 3.9%, as Trump’s 25% tariffs on imported vehicles to the US took effect, further exacerbating the impact of existing duties on steel and aluminum. In the UK, the FTSE 100 fell by 1.6%, while France’s CAC 40 and Germany’s DAX recorded deeper losses, sliding 3.3% and 3.1%, respectively.
Ridiculed for imposing trade tariffs on frozen islands largely inhabited by penguins, Donald Trump’s formula for calculating those levies has a serious side: it is also hitting some of the world’s poorest nations hardest.
The math is simple: take the U.S. goods trade deficit with a country, divide it by that country’s exports to the U.S. and turn it into a percentage figure; then cut that figure in half to produce the U.S. “reciprocal” tariff, with a floor of 10%.
That’s how the volcanic Australian territory of Heard Island and McDonald Islands in the Antarctic ended up with a 10% tariff. The penguins got off lightly, you might say.
But Madagascar – one of the poorest nations in the world with gross domestic product (GDP) per head of just over $500 – meanwhile faces a 47% tariff on the modest $733 million of exports of vanilla, metals and apparel that it did with the U.S. last year. (Source: Reuters)
UBS strategists have issued a concerning inflation outlook following President Donald Trump’s recent tariff announcement. In a note released Thursday, strategist Bhanu Baweja warned that if these tariffs persist, inflation could surge to nearly 5%, causing significant damage to the broader macroeconomic environment.
Tech and consumer discretionary stocks led market losses on Thursday, with the so-called “Magnificent 7” stocks taking a heavy hit after President Trump’s announcement of reciprocal tariffs. E-commerce giant Amazon dropped more than 9%, while iPhone maker Apple plunged over 8%, wiping out nearly $300 billion in market cap. The Trump administration’s newly introduced tariffs impose levies of up to 54% on imported goods from China and 46% on products from Vietnam. Nvidia also saw a sharp decline, falling more than 6% after being downgraded to Hold from Buy by HSBC.
The US dollar weakened against other global currencies on Thursday as markets reacted to President Trump’s tariff announcement. The US Dollar Index was trading at 101.41, down 2.2% for the session. This marks the first time the index has fallen below the 102 level since October 3. The drop represents a sharp reversal from the rally seen in currency markets following Trump’s election. The dollar index had briefly surged above the 110 mark in early January.
US President Donald Trump will “buckle under pressure” and reconsider his tariff policies if Europe acts together, according to acting German economy minister Robert Habeck. In a press conference on Thursday, Habeck stated, “I believe Donald Trump will adjust his stance under pressure, but the logical consequence is that he also needs to feel that pressure.” He added that this pressure must come from Germany, Europe, and an alliance with other countries, suggesting that it will reveal who is stronger in this “arm wrestle.”
The yield on the 10-year US Treasury bond fell below 4% for the first time since October, driven by growing concerns that President Trump’s trade war could harm the US economy. On Thursday, the yield dropped as much as 13 basis points, hitting its lowest level since Trump’s election. Other yields also retreated, as money markets now anticipate a 50% chance the Federal Reserve will implement four quarter-point rate cuts this year. The first rate reduction is now expected in June, a shift from earlier expectations.
Stocks plunged dramatically on Thursday, with the S&P 500 entering correction territory as market fears escalated following President Trump’s tariff announcement. The S&P 500 fell 4%, marking its worst day since September 2022, while the Dow Jones Industrial Average plummeted 1,500 points, or 4%. The Nasdaq Composite also dropped by 4%, as a widespread sell-off gripped the market. Decliners at the New York Stock Exchange outnumbered advancers by a staggering six-to-one ratio. Multinational companies were hit hard, with shares of Nike and Apple falling 13% and 8%, respectively. Retailers heavily reliant on imported goods were among the hardest hit, with Five Below sinking 28%, Dollar Tree tumbling 10%, and Gap plunging 22%. Tech stocks also saw significant declines, with Nvidia and Tesla each losing 5% amid a broader risk-off sentiment.
Stellantis NV, the automaker behind Ram trucks and Jeeps, announced on Thursday that it would temporarily lay off 900 workers at five US facilities following President Donald Trump’s recent tariff announcement. The company will also pause production at its assembly plants in Mexico and Canada. The impacted US facilities include powertrain and stamping plants, with Stellantis’ Windsor Assembly, which produces the Chrysler Pacifica minivan and Dodge Charger Daytona, being shut down for two weeks. Meanwhile, the Toluca Assembly plant, responsible for the Jeep Compass and Jeep Wagoneer S, will halt production for the entire month of April. As a result, Stellantis’ stock plunged 6% in response to the news.
Nvidia’s stock dropped over 5% on Thursday, while its competitor Advanced Micro Devices (AMD) saw a decline of about 4%. Broadcom fell around 7%, and Micron, which supplies memory chips for Nvidia’s graphics processing units (GPUs), also sank 7%. TSMC, the Taiwanese chip manufacturer that produces some of the world’s most advanced semiconductors for companies like Nvidia and Apple, saw a decline of about 5%.
Apple is confronting significant financial pressures following the Trump administration’s imposition of tariffs on imports from key manufacturing countries, notably China, Vietnam, and India. These tariffs are poised to impact Apple’s production costs and profit margins. Apple shares fell 8.5% when markets opened in New York on Thursday, wiping out $255 billion in market value. The decline comes after the stock had already dropped 11% this year as part of a wider retreat in the tech sector.
Bitcoin and other cryptocurrencies faced significant pressure on Thursday following President Donald Trump’s announcement of new tariffs, which sent shockwaves through the stock market. The price of Bitcoin slid 5%, reaching $81,849.63, according to Coin Metrics. Ether dropped by 7%, while Solana’s token saw a more dramatic 13% decline.
Technology stocks plummeted on Thursday following President Donald Trump’s announcement of new tariff policies, triggering widespread market panic. Apple led the declines among the “Magnificent Seven,” plunging more than 8%. The iPhone maker, which manufactures its devices in China and other Asian countries, is on track for its sharpest drop since 2020. Other major tech companies also faced significant losses. Meta Platforms and Nvidia each saw declines of over 6%, while Tesla and Amazon also dropped. Nvidia, which manufactures its chips in Taiwan and relies on Mexico for assembling its AI systems, was particularly affected. Microsoft and Alphabet both saw more modest losses, each falling around 2%.","The S&P 500 index fell 4% on Thursday, triggering a 1% contraction in global merchandise trade volumes, while the Dow Jones Industrial Average plummeted 26%, Dollar Tree tumbling 10%, and Gap plunging 22%, while Nvidia and Tesla sank 7%, while TSMC, a Taiwanese chip manufacturer, suffered a sharp fall in technology markets, and a weakening US economy."
1,1,20e587c2e29a7b2f6f785ea1d69cb26b66c5f801d785e72d109b79a48287a0f9,Trump throws half a punch: 27% reciprocal tariff on imports from India - CNBC TV18,https://news.google.com/rss/articles/CBMiyAFBVV95cUxQeXVhS2hsdlhROFp1NXdTN3NBbmV3UEVtY0JJelEya19VQ0RaNEJXYWZIeG5HUXp5UXNaNUlJbEZTM09SWEhvcWtybWwtLThTaUtBMDJ2WVZsaWJuaWxfN1NxLUU0M0pzeV9yV1hvOFpWU3p1QlVyM0NjdVpWLTVBeFJhQ2k0YXg2RFBWM2F4RmtDenY3QTJRZDd5X1BaTzFpYlJXNWprU09RSWJsQ1MyZlNNNXRVaGhjQWw2aFZZUldSVktFWW9ZTdIBzgFBVV95cUxPY1dlbEd4X1FoVGwtTUpCVU5IcFJDMlZBc0xhcjRwelBFNkVtb3VPNlRQblBPM0VEOUR4OU1QY09DRHZHN2l1TnVMYXhFeDFoVm01LTFiMWFzWnFRVFc0WkhoS2NQMmdBLXdFcHBkN2YyN1VFdzVsbTdSNkZpeHFiWTRkU0FRMTEyaWhiX3h1RUZmWDlxYUt1UXpMTE1CekdNUUc4cEt5bkh1WU5sNFVVSUpZSVZaVmwzNGhqTnc0LWZIU1ZoekNHY2hlRFhEdw?oc=5,"Fri, 04 Apr 2025 07:00:00 GMT",CNBC TV18,"[SOURCES] ""currency manipulation"" AND dollar",8,4/3/2025,4/4/2025,2026-02-19T14:44:55.355735,82,https://www.cnbctv18.com/economy/donald-trump-reciprocal-tariffs-liberation-day-us-market-impact-india-import-duties-19583403.htm,"US President Donald Trump has announced stopping short of imposing fully reciprocal tariffs. Instead, Trump said the US would charge half of the tariff a country imposes on US imports.
Under Trump's plan, the US would impose a 26% tariff on Indian imports. Trump said the rate was calculated based on cumulative tariffs, including non-monetary barriers, imposed by a country on American goods. By this calculation, Trump said India imposes a 52% tariff on US goods.
A chart Trump used during his announcement said a 26% tariff would be imposed on Indian goods, but an annexure shared by the White House pegged the tariff on Indian goods at 27%. This was again corrected to 26% the following day.
India vs US Current Tariff Comparison
| Category | India's Tariffs on US Imports | US Tariffs on Indian Imports |
|---|
| All products | 13.7% | 3.7% |
| Agricultural products | 40.6% | 6.6% |
| Non-agricultural products | 11.6% | 3.4% |
Note: All figures represent Simple Average MFN (Most Favored Nation) Applied Rates; Source: WTO IDB, Trade Data Monitor
Trump has also announced his intention to establish a universal baseline tariff of 10% that will apply to all countries, in addition to the tariffs he has announced.
Trump, who referred to April 2 as ""Liberation Day"", made the announcement from the Rose Garden of the White House in an event attended by steel and auto workers.
India's largest trading partner is the US, with metal ores and gemstones, electrical equipment, pharmaceuticals and textiles constituting the bulk of its exports. While sectors such as semiconductors, furniture and rubber represent a smaller share of India's US-bound exports, they are heavily reliant on US demand, with semiconductors being particularly vulnerable, as 85% of exports in this sector go to the US market.
Trump's tariffs on sectors such as automobiles, pharmaceuticals and semiconductor chips, along with potential non-tariff barriers, pose significant risks to these industries.
Breaking Down India's Exports to the US
| Export Category | Value (USD) | India's Share in US Exports |
|---|
| Electronics | $11.1 billion | 14.3% |
| Gems & Jewellery | $9.9 billion | 12.8% |
| Pharma Products | $8.1 billion | 10.4% |
| Nuclear Reactors, Parts, Machinery etc. | $6 billion | 7.8% |
| Refined Petroleum Products | $4.6 billion | 5.9% |
| Articles of Iron and Steel | $2.8 billion | 3.6% |
| Textiles | $2.6 billion | 3.4% |
| Organic Chemicals | $2.6 billion | 3.4% |
| Iron and Steel | $2.5 billion | 3.2% |
| Non-Industrial Manufactured Goods | $2.4 billion | 3.1% |
| Agricultural Products | $2.3 billion | 3% |
| Organic Chemicals | $2.1 billion | 2.7% |
| Medical Instruments | $2 billion | 2.6% |
| Plastic and Plastic Articles | $1.9 billion | 2.4% |
| Furniture and Accessories | $1.8 billion | 2.3% |
| Total exports to the US | $78 billion | |
Trump, during his speech, promised a “golden age” for America with the return of jobs and factories and claimed that his tariff policies would generate “trillions and trillions of dollars” to reduce taxes and pay down the national debt.
Trump called the announcement America's “declaration of economic independence” and described it as one of the most important moments in American history.
Justifying the reciprocal tariffs, Trump said many countries have targeted the US with “non-monetary barriers”, such as currency manipulation, subsidies, exorbitant taxes, and theft of intellectual property.
Trump said a 25% tariff on foreign-made automobiles,
announced last week, will come into effect at midnight ET on April 2 (9.30 am IST on April 4),
Follow our live coverage of the ""Liberation Day"" event here","Trump announced a 25% tariff on foreign-made automobiles on April 2 (9.30 am IST on April 4) in India, with India imposing a 52% tariff on Indian goods, with an annexure from the White House pegging Indian goods at 27%, while India imposes a 26% tariff based on cumulative tariffs (including non-monetary barriers) imposed by a country on American goods, while a chart indicating a 16% tariff would be imposed on Indian products, with a graph showing 27% tariffs being imposed in India."
2,2,220604846c4b42ee4b4e3ec520922e83242b9aaf6393ebe3454b0d11978b8c60,"Trump tariffs fallout: China retaliates, Vietnam talks, U.S. markets melt down - CNBC",https://news.google.com/rss/articles/CBMijAFBVV95cUxOVUtFeFZHS3NtVGhIM1Bqc1cxUlV5bVg3d1NQLW5sd0Nrd2pnWURJV19BTzNnNzBQTmFzcHVPcDAybEJ6NEo3TFN6cTBQbGNSU2JveUNjOVByNm1zanphSklYX3MxOTVpX3dhMkVUMm9KT01RdU55TXhXdGNUNHFGeHlYRVllWFNRd1RsZdIBkgFBVV95cUxNdWI1aTB6dnJOS0Nlek93N2swdzZGazQ3ZEJWZ0JleV80bjBxVEZIbUI4YjVvZEpNMVBOUkxzbjJZYWlNMThHcDN3OTd5ZWlGYXdEY2ZxeERPSktDUHdGVU0wRjNqOGNsODJaUGlfQmN4NGZiejNTdlQ2Zm9KMGhYcUEwbGZmbFVlX0Z1aXJTUnQ3Zw?oc=5,"Fri, 04 Apr 2025 07:00:00 GMT",CNBC,"[SOURCES] ""Federal Reserve"" AND (emergency OR surprise OR pivot)",10,4/3/2025,4/4/2025,2026-02-19T14:44:55.355735,85,https://www.cnbc.com/2025/04/04/trump-tariff-live-updates-retaliation-trade-war.html,"What you need to know
- U.S. markets dropped Friday after China announced retaliatory tariffs of 34% on all goods from America.
- Oil fell to pandemic lows.
- European stocks fell more than 2% after their worst session in eight months.
- Fed Chair Jerome Powell warned that Trump's tariffs would raise inflation and lower growth.
- Nintendo cited tariff uncertainty as it delayed pre-orders of its hotly anticipated Switch 2.
- The risk of a U.S. recession is now ""uncomfortably high,"" warned Allianz's Chief Economic Advisor Mohamed El-Erian.
- On Wednesday, President Donald Trump imposed a far-reaching ""reciprocal tariff"" policy, including a 10% baseline tariff on almost every country and much higher duties for many.
CNBC's reporters covered the tariffs and their effects, live on air and online from our bureaus in Washington; London; Singapore; San Francisco; and Englewood Cliffs, New Jersey.","CNBC reports that US markets dropped Friday after China announced retaliatory tariffs of 34% on all goods from America, with oil falling to pandemic lows, European stocks falling more than 2% after their worst session in eight months."
