,id,title,link,published,source,summary,query,target_date,ticker,fetched_at,actual_link,full_text
0,8c99e5bd72729f037e0aab5e383952477bf501da173e283a30e0fff3d13ee469,Crossing the $3 trillion threshold - Global Custodian,https://news.google.com/rss/articles/CBMijgFBVV95cUxOSzhQVk1DR3psZHFqRU9yaGFzZm1JNzFWX0tLbm1zMWNONGlYRUNZYzBReWtzT2dpM09IWkxMYVU3cTdfSFZGQWJNNW9sSzY3UjFhRVZpNFhkb0tfYWlicmZaV0xaMVhheElnSTFJSTh1Y0doUDdaQ0dmV0RmcTAtSlVMRG5jS2IwZzBPT3Nn?oc=5,"Thu, 24 Apr 2025 07:00:00 GMT",Global Custodian,"Mal Cullen, chief executive of CIBC Mellon, is a Canadian leader backed by the global strength of BNY’s global asset servicing network, leveraging global expertise and global expertise to provide clients with cutting-edge technologies, risk management practices, and product capabilities, demonstrating a juggling act to defining asset servicing in the years ahead.","(""Bank of New York Mellon"" OR ""BNY"") -gossip -celebrity -""fantasy sports"" -""game recap""",2025-04-23,BNY,2026-01-26T17:14:55.273239-05:00,https://www.globalcustodian.com/thought-leadership/crossing-the-3-trillion-threshold/,"As the closing bell rang at the Toronto Stock Exchange, Mal Cullen, chief executive of CIBC Mellon, stood alongside colleagues to celebrate a landmark achievement.
Cullen had just helped close the market, marking the firm’s milestone of surpassing C$3 trillion in assets under administration (AUA). For the CEO who took the helm barely two years ago, the moment was more than ceremonial. “I’m incredibly proud,” said Cullen, noting that reaching the C$3 trillion mark reflects “the trust our clients place in us and the hard work of our talented team”.
Cullen’s praise for the work of the nearly 2,000-strong team stretched to every employee who had contributed to the success over nearly three decades whether through solidifying, onboarding, or supporting the business during its history.
“This achievement isn’t just about the number,” he continued. “It’s about delivering meaningful progress… and continuing to innovate for our clients.” In other words, crossing the $3 trillion threshold is not a finish line, but a springboard for CIBC Mellon’s next evolution.
Spurring further innovation
Hitting C$3 trillion in AUA places CIBC Mellon in rarefied air. It ranks the Toronto-based custodian among a select group of global asset servicing firms that have ever reached such scale, reinforcing the firm’s role as a trusted provider in the industry.
The joint venture – co-owned by two powerhouses – administers assets on behalf of Canada’s largest banks, insurance companies, pension plans, investment funds, corporations and other institutional investors.
The growth has been striking. As at 31 December 2024, CIBC Mellon’s administered assets were roughly double the level from just a few years prior.
Spurring further innovation
Hitting C$3 trillion in AUA places CIBC Mellon in rarefied air. It ranks the Toronto-based custodian among a select group of global asset servicing firms that have ever reached such scale, reinforcing the firm’s role as a trusted provider in the industry.
The joint venture – co-owned by two powerhouses – administers assets on behalf of Canada’s largest banks, insurance companies, pension plans, investment funds, corporations and other institutional investors.
The growth has been striking. As at 31 December 2024, CIBC Mellon’s administered assets were roughly double the level from just a few years prior.
Cullen attributes this climb to strong client relationships and operational resilience. “It’s a significant milestone that reflects our clients’ confidence in us,” he explains to Global Custodian. “We have a relentless focus on making sure that the clients know that we are looking out for Canadian requirements. We’re advocating for regulatory changes and we’re supporting what is somewhat unique in the Canadian market.”
Beyond the sheer number, Cullen sees symbolic weight in the milestone. It coincides with a period of stability and expansion for the firm. CIBC Mellon was founded in 1996 as a 50-50 joint venture between Canadian Imperial Bank of Commerce (CIBC) and The Bank of New York Mellon – now known more succinctly as BNY. The unique parentage has always been a key to CIBC Mellon’s success – and never more so than now, as global investors increasingly seek both local insight and international reach.
With the support of BNY, CIBC Mellon has steadily broadened its service offerings. The firm has long provided custody, fund administration, pension benefit services and unitholder recordkeeping, as well as enabling access to parent company services such as foreign exchange and securities lending.
In more recent years, the CIBC Mellon has launched and grown capabilities in emerging areas like digital and data services, helped launch the world’s first bitcoin and ether ETFs in Canada, advanced into the insurance business and inked alliances with a growing array of fintechs to improve its efficiency and offerings.
The milestone places CIBC Mellon ahead as the largest Canadian custodian and also validates the company’s strategy of running the business better and innovating for clients. For CIBC Mellon, scale has come hand-in-hand with trust – and with pressure to keep raising the bar.
Global scale, local expertise
Global scale, local expertise
Cullen is the first to highlight the advantage of CIBC Mellon’s parentage. “Our unique position as a Canadian leader backed by the global strength of BNY allows us to offer our clients a combination of local expertise and global capabilities,” he explains.
In practice, this means clients benefit from a massive global network – BNY’s custody platform spans over $52 trillion in assets worldwide – while dealing with a team on the ground in Canada that understands the local market and regulatory landscape.
It’s a balance of big and small, global and local. Cullen often describes CIBC Mellon as the Canadian arm of BNY’s global asset servicing network, with deep roots and client relationships in Canada thanks to CIBC.
This dual identity enables the firm to tap into cutting-edge technologies, risk management practices and product capabilities from its multinational parents, then tailor them to Canadian client needs.
He points to the firm’s culture of focus on client service, innovative technology and operational excellence – a culture reinforced by both parent organisations.
Innovation in operations
Innovation in operations
Perhaps the most dramatic change Cullen has witnessed in asset servicing is the rise of automation and data analytics in what was once a manual, paper-driven business.
“Innovation in the custody space is largely driven by rapid advancements in technology and the growing power of data analytics,” he says. “At CIBC Mellon, teams are witnessing transformative progress in areas such as automation and artificial intelligence, which are revolutionising how transactions are managed and processed allowing for greater efficiency, accuracy and speed in daily operations.”
Subsequently, mundane back-office tasks that might have taken hours of human effort can now be completed in seconds with the right algorithms. Cullen notes that the firm is actively investing in cutting-edge technologies to streamline processes and deliver real-time insights to clients. The goal is to shift staff away from repetitive workload and toward higher-value analysis and client service.
One recent example is CIBC Mellon and BNY’s launch of the first integrated investment operations solution for a Canadian insurance company. “This solution represents a comprehensive service model, including the first outsourced general insurance fund accounting solution in Canada,” says Cullen.
He stresses that innovation isn’t pursued for its own sake, but to add tangible value: “Our commitment to continuous improvement, agility and staying ahead of industry trends enables us to provide exceptional value and maintain our competitive edge,” he says.
The future of asset servicing
The future of asset servicing
Looking ahead, Cullen expects the asset servicing landscape to continue shifting – and perhaps at an even faster pace. “The industry is poised for significant transformation in the coming years,” he predicts.
On the horizon are new technologies like digital assets and blockchain, which “will revolutionise the way securities are issued, traded and settled,” according to Cullen.
Today’s custodians may soon find themselves safekeeping tokenised stocks or bonds, not just paper certificates or electronic records. At the same time, clients and regulators are demanding greater transparency, security and real-time processing in every transaction. This is pushing firms to upgrade systems and rethink old processes.
Regulation, too, remains a wild card. From evolving accounting rules to heightened cybersecurity requirements, asset servicers will need robust, flexible infrastructures to keep up.
“At CIBC Mellon, we are committed to staying at the forefront of these changes,” he says, ensuring the firm continues to provide clients with cutting-edge solutions and services whatever the future may hold.
Part of that readiness comes from drawing on its shareholders’ strengths – whether it’s CIBC’s deep knowledge of Canadian banking or BNY’s investments in global fintech and risk management.
If the past few years have proven anything, it’s that adaptation is essential. Cullen admits that one of his constant concerns is cybersecurity, given the rising sophistication of cyber threats. But here again, he draws confidence from preparation: “Our cybersecurity strategy benefits from the considerable focus, investment and resources of CIBC in Canada and BNY globally, ensuring we are well positioned to protect our clients,” he notes.
From his vantage point, the future of asset servicing will be defined by those who can blend scale with agility. As Mal Cullen guides CIBC Mellon beyond the $3 trillion milestone, he is effectively balancing two imperatives: safeguarding the trust it took decades to earn, and reinventing the business to meet the demands of the next decade. It’s a juggling act he embraces.
After all, as Cullen puts it, relentless adaptation is part of the job description when you’re a “leader in asset servicing.” And if CIBC Mellon’s trajectory is any indication, the company is well on its way to defining what asset servicing will look like in the years ahead – global yet local, efficient yet innovative, and always prepared for what’s next."
1,20a068e6da29aa7bfa2ec5de3788ad37529e65e11065dc1c5b87d1eae2ac321b,Soter Holdings Appoints Curtis Arledge as Independent Director - citybiz,https://news.google.com/rss/articles/CBMiowFBVV95cUxNa3VGOFhSNDRWejdJYWF4UHM5bXVQcEdHYlZEbjlrejNRVjlPSlZGTUlxaUNCYTBlU09uT2dFN3ZtUXdsZ1hjemoxcnJERjFnakx4WlZINHhQVlFZYS05d0JBU1hCRGhxWDk4NllST215cFZwcEhFLVBRdWRzNl9lMElRcmE5WkVzcGNLV1BwT29ocHpGX19qVjVpYkYtUnZHUFFj?oc=5,"Wed, 23 Apr 2025 07:00:00 GMT",citybiz,"Soter Insure is a leading provider of specialized insurance solutions for the institutional digital asset ecosystem, appointing Mariner Investment Group CEO Curtis Arledge as an Independent Director, and Mohamed Hamdy as CEO of BNY Mellon Investment Management, Vice Chairman of the Bank and Markets Group.","(""Bank of New York Mellon"" OR ""BNY"") -gossip -celebrity -""fantasy sports"" -""game recap""",2025-04-23,BNY,2026-01-26T17:14:55.273239-05:00,https://www.citybiz.co/article/685893/soter-holdings-appoints-curtis-arledge-as-independent-director/,"Soter Holdings Limited, parent company to Soter Insurance Limited, a provider of specialized insurance products tailored to the digital asset economy, appoints Mariner Investment Group CEO, Curtis Arledge as an Independent Director.
Mr. Arledge is also a member of Mariner Investment Group’s Management and Risk Committees. He previously served as the CEO of BNY Mellon Investment Management, Vice Chairman of the Bank and was also responsible for the firm’s Markets Group. Prior to BNY Mellon, he was the chief investment officer for fundamental fixed income portfolios at BlackRock, Inc.
Mr. Arledge is an Advisory Council member at Princeton’s Bendheim Center for Finance. He previously served as Vice Chairman of the U.S. Treasury Borrowing Advisory Committee and was inducted into the Fixed Income Analysts Society Hall of Fame in 2014. Mr. Arledge is a member of the board of directors of Autism Speaks, an autism advocacy organization that sponsors autism research and family services.
As the Company’s Non-Executive Director, Mr. Arledge will bring his wealth of knowledge in directorship, financial oversight, and executive experience to Soter.
“I’m very excited to work with Henson, whom I have known for years, the rest of the Board, and the Soter team to pursue this incredible mission and business opportunity,” said Curtis Arledge, Mariner Investment Group CEO and Independent Director of Soter Holdings Limited.
Mohamed Hamdy, Chairman of Soter Holdings Limited and Managing Partner at Further Ventures said, “We are delighted to welcome Curtis Arledge to our board. His extensive leadership experience in financial services and risk management will significantly enhance our governance and strategic capabilities. Curtis’s deep insights and proven track record will be invaluable as Soter continues to grow and navigate the evolving landscape of digital asset insurance.”
For more information about Soter Insure, visit soter.insure.
About Soter Insure
Soter Insure is a leading provider of specialized insurance solutions for the institutional digital asset ecosystem. Soter offers a range of innovative insurance products that address the unique risks of the blockchain ecosystem. Soter Insure is committed to providing robust, transparent, and secure risk management solutions. For more information, visit www.soter.insure."
2,2f63007818708a015b25ee5a07fd30cfa193dd831a2fecbb20c49042e762f762,FOMO Pay Leverages BNY's Capability to Power GBP & EUR Cross-Border Payments - FOMO Pay,https://news.google.com/rss/articles/CBMirAFBVV95cUxObkk4by1yTjVuQ1BXNG8zd3lzR056eTRiajIzcDNta09aQUpZZVFQc0U2d1pFa2lnUjNtVDJhRTFkM1JFMm5ERDl4Zkx6ZGw0YTVaeVRxSFB6bHBRQlpOa29MdFQzZ0lsbjNDYmFNeDVIOHN0aVVuNmVZd2VGVzA4N0ljWFRaX25XbDJ4R1BmVm5fYzJUaWtKQzM3NHZRaC16S3Bxc3IwQ0hfSDBW?oc=5,"Wed, 23 Apr 2025 07:00:00 GMT",FOMO Pay,"FOMO Pay Pte Ltd (FOMO Pay), a Singapore-based major payment institution, expands its cross-border payment network, leveraging BNY’s direct clearing network to access streamlined British Pound (GBP) and Euro (EUR) corridors via its direct clearing system, enabling corporate clients faster settlement times, greater transparency, reduced intermediary costs, and enhanced reliability and efficiency, with BNY's digital payment infrastructure enhancing existing capabilities, empowering businesses to scale internationally with confidence, agility, and regulatory compliance.","(""Bank of New York Mellon"" OR ""BNY"") -gossip -celebrity -""fantasy sports"" -""game recap""",2025-04-23,BNY,2026-01-26T17:14:55.273239-05:00,https://www.fomopay.com/news-media/fomo-pay-leverages-bnys-capability-to-power-gbp-eur-cross-border-payments,"FOMO Pay Pte Ltd (“FOMO Pay”), a Singapore-based major payment institution, has expanded its cross-border payment network, tapping into the clearing capabilities of The Bank of New York Mellon Corporation (""BNY""), a global financial services company. In addition to USD, FOMO Pay’s clients can now access streamlined British Pound (GBP) and Euro (EUR) corridors via BNY’s direct clearing network.
By leveraging BNY’s direct access to major clearing systems, FOMO Pay’s corporate clients benefit from faster settlement times, greater transparency, and reduced intermediary costs when sending or collecting payments in USD, GBP and EUR. Coupled with FOMO Pay’s digital payment infrastructure, businesses gain access to near real-time, multi-currency cross-border settlement with enhanced reliability and efficiency.
This latest development builds on FOMO Pay’s established cross-border capabilities across key regional markets, including the Middle East and North America (MENA), Southeast Asia (SEA), Greater Bay Area (GBA). The addition of the EUR channel enhances FOMO Pay’s existing capabilities, offering clients more flexibility and improved performance when transacting in Euro.
With the expanded services powered by BNY, FOMO Pay reinforces its commitment to streamlining global payment corridors, empowering businesses to scale internationally with confidence, agility, and regulatory compliance.
About FOMO Pay
Founded in 2015, FOMO Pay is a Major Payment Institution licensed in Singapore, Hong Kong and the United Arab Emirates (UAE). The firm has become a leading one-stop digital payment, digital banking, and digital asset solution provider. It is currently building Asia's fully licensed financial platform, helping institutions and businesses connect between traditional and next-generation financial services. The firm offers its three flagship products:
Visit www.fomopay.com for more information. For media inquiries, contact marketing@fomopay.com."
