,id,title,link,published,source,summary,query,target_date,ticker,fetched_at,actual_link,full_text
0,9c1d1806684b8d06816512f08d6bf66deb93a6ab088f40562be9e1e0a7b72f51,Foreign investors are selling more Treasurys. That’s bad news for U.S. borrowers. - MarketWatch,https://news.google.com/rss/articles/CBMiwgNBVV95cUxQbFhnRFloX3FiVTBIQ21iN2YxWTRHWTJQWVUxemZLWDYyaFhjY1VIb2dQNE1UVzZVYXc1VlZTSmtoVW9TQk00b2RKSWtlN1BuUlExU3Nuc0d3Ykd3cnJWRkRfYzdMVExjOWxUSGZyZUF6c0lPZnp3eXRSS09qc0JIVEozc1FUNXNkN1dHOVg3NDRrT0VUa3o5bWQ3bVNMVmw4bWtyVllKcThxdEQta1FVVmJvbmNuekhLOTJsbWF5UFhZQktIT3pPbklvLVIxbUowdGFaSzJqZFRmWk94MWp5SU9RSlptNnhncXdIZWN5NVZ6MTRKRTRQdEY4OV9UQ3dCdmk4OWpfSlhRZDVDVjZfZnJ2VG1XLUwxdFVrU2xWYVByMHY1QTB5MUlyc1JwQnhUdTRQWjFBZ1IxUzNzaE1FbHhWb3ZDNzc3MGYzQ0JVNlRxV29PQmpNWnJ4WVZZSW5aUmRfc2N2TFVDbmUyN2JGNWRMa004TXRtUmtKclpIRHBVUXF6UFF2aUgyZWVTY2I5czNZMUFieEhGVGVKbXh2T0ZSdEstMVlYMzdpUk54Qnd6RDh4dGtvVmIzYTFTa0syMGc?oc=5,"Tue, 22 Apr 2025 07:00:00 GMT",MarketWatch,,"(""Bank of New York Mellon"" OR ""BNY"") -gossip -celebrity -""fantasy sports"" -""game recap""",2025-04-22,BNY,2026-01-26T17:14:54.666120-05:00,https://www.marketwatch.com/story/foreign-investors-are-selling-more-treasurys-thats-bad-news-for-u-s-borrowers-6f325b0f?gaa_at=eafs&gaa_n=AWEtsqceaJUsgiqlco899zYfRA_Yyb_bcHnD0T5C_4tpSmMEBGbi5JY5rxN-&gaa_ts=6977eae3&gaa_sig=i5x7lqNc17t3tJJySjsnDccKGtxWmZfX4Yp1dvvg4PavnVO5UQ4dBJXW0j3OJFB0DU3eayhXXKXsY8lVih7eWA%3D%3D,
1,20a068e6da29aa7bfa2ec5de3788ad37529e65e11065dc1c5b87d1eae2ac321b,Soter Holdings Appoints Curtis Arledge as Independent Director - citybiz,https://news.google.com/rss/articles/CBMiowFBVV95cUxNa3VGOFhSNDRWejdJYWF4UHM5bXVQcEdHYlZEbjlrejNRVjlPSlZGTUlxaUNCYTBlU09uT2dFN3ZtUXdsZ1hjemoxcnJERjFnakx4WlZINHhQVlFZYS05d0JBU1hCRGhxWDk4NllST215cFZwcEhFLVBRdWRzNl9lMElRcmE5WkVzcGNLV1BwT29ocHpGX19qVjVpYkYtUnZHUFFj?oc=5,"Wed, 23 Apr 2025 07:00:00 GMT",citybiz,,"(""Bank of New York Mellon"" OR ""BNY"") -gossip -celebrity -""fantasy sports"" -""game recap""",2025-04-22,BNY,2026-01-26T17:14:54.666120-05:00,https://www.citybiz.co/article/685893/soter-holdings-appoints-curtis-arledge-as-independent-director/,
2,2f63007818708a015b25ee5a07fd30cfa193dd831a2fecbb20c49042e762f762,FOMO Pay Leverages BNY's Capability to Power GBP & EUR Cross-Border Payments - FOMO Pay,https://news.google.com/rss/articles/CBMirAFBVV95cUxObkk4by1yTjVuQ1BXNG8zd3lzR056eTRiajIzcDNta09aQUpZZVFQc0U2d1pFa2lnUjNtVDJhRTFkM1JFMm5ERDl4Zkx6ZGw0YTVaeVRxSFB6bHBRQlpOa29MdFQzZ0lsbjNDYmFNeDVIOHN0aVVuNmVZd2VGVzA4N0ljWFRaX25XbDJ4R1BmVm5fYzJUaWtKQzM3NHZRaC16S3Bxc3IwQ0hfSDBW?oc=5,"Wed, 23 Apr 2025 07:00:00 GMT",FOMO Pay,"FOMO Pay Pte Ltd (FOMO Pay), a Singapore-based major payment institution, expands its cross-border payment network, leveraging BNY’s direct clearing network to access streamlined British Pound (GBP) and Euro (EUR) corridors via its direct clearing system, enabling corporate clients faster settlement times, greater transparency, reduced intermediary costs, and enhanced reliability and efficiency, with BNY's digital payment infrastructure enhancing existing capabilities, empowering businesses to scale internationally with confidence, agility, and regulatory compliance.","(""Bank of New York Mellon"" OR ""BNY"") -gossip -celebrity -""fantasy sports"" -""game recap""",2025-04-22,BNY,2026-01-26T17:14:54.666120-05:00,https://www.fomopay.com/news-media/fomo-pay-leverages-bnys-capability-to-power-gbp-eur-cross-border-payments,"FOMO Pay Pte Ltd (“FOMO Pay”), a Singapore-based major payment institution, has expanded its cross-border payment network, tapping into the clearing capabilities of The Bank of New York Mellon Corporation (""BNY""), a global financial services company. In addition to USD, FOMO Pay’s clients can now access streamlined British Pound (GBP) and Euro (EUR) corridors via BNY’s direct clearing network.
By leveraging BNY’s direct access to major clearing systems, FOMO Pay’s corporate clients benefit from faster settlement times, greater transparency, and reduced intermediary costs when sending or collecting payments in USD, GBP and EUR. Coupled with FOMO Pay’s digital payment infrastructure, businesses gain access to near real-time, multi-currency cross-border settlement with enhanced reliability and efficiency.
This latest development builds on FOMO Pay’s established cross-border capabilities across key regional markets, including the Middle East and North America (MENA), Southeast Asia (SEA), Greater Bay Area (GBA). The addition of the EUR channel enhances FOMO Pay’s existing capabilities, offering clients more flexibility and improved performance when transacting in Euro.
With the expanded services powered by BNY, FOMO Pay reinforces its commitment to streamlining global payment corridors, empowering businesses to scale internationally with confidence, agility, and regulatory compliance.
About FOMO Pay
Founded in 2015, FOMO Pay is a Major Payment Institution licensed in Singapore, Hong Kong and the United Arab Emirates (UAE). The firm has become a leading one-stop digital payment, digital banking, and digital asset solution provider. It is currently building Asia's fully licensed financial platform, helping institutions and businesses connect between traditional and next-generation financial services. The firm offers its three flagship products:
Visit www.fomopay.com for more information. For media inquiries, contact marketing@fomopay.com."
3,afe24f0472e7f7a5978cadf1eef709236906c7ba648f4d5127f1a8ba12f3dc01,Agentic AI: The Rise Of Autonomous Decisions In The Financial Industry - Forbes,https://news.google.com/rss/articles/CBMiwAFBVV95cUxQQS02TXFqQXJKNDJVa21jUktTSFpJZVdZUGtZLUg5eE9UTGdKWmN3TEtXNUlmTkRMdGIzaGRsTFVhNEpkWlBDQ21QalFBZE10VGFjdVJRcDQzUDJubU1FejFEdVcxczBzamZtWlpUMHRQd3JiNmlIMm5xaE9MU2lqSHpSRXZEa0t6UlFCX2RxRTQzMlZGZm42VDJFMTBYcS1ZN3Z6OUlnSUM5YUlWeDFwVW14N3ZxaFU1dTFYaWl1dEU?oc=5,"Wed, 23 Apr 2025 07:00:00 GMT",Forbes,"The Bank of England’s Monetary Authority (MAS) completed a thematic review of AI modelrisk controls in mid2024 and published a 28page information paper outlining expectations for generative and agentic systems, from datalineage tracking to killswitch design, to global authentication rails and datacentre transcripts, and a rewrite of job descriptions, demonstrating that generative agents dominate the AI agenda in 2025, shifting boardroom metrics from topline growth to margin expansion as tasks that once consumed analyst","(""Bank of New York Mellon"" OR ""BNY"") -gossip -celebrity -""fantasy sports"" -""game recap""",2025-04-22,BNY,2026-01-26T17:14:54.666120-05:00,https://www.forbes.com/sites/zennonkapron/2025/04/23/agentic-ai-the-rise-of-autonomous-decisions-in-the-financial-industry/,"A pre‑market shuffle no one noticed
Just after dawn in London, a tier‑one bank’s treasury bot scans the liquidity position, matches it to day‑ahead cash‑flow forecasts and silently sweeps £210 million from a low‑yield reserve account into the overnight repo market. A risk notice and rationale land in the human treasurer’s inbox minutes later, but the decision, trade execution and journal entry were all performed end‑to‑end by software. Similar scenes are playing out in credit‑card pricing teams in Singapore and fraud‑monitoring squads in New York. The common actor behind them is agentic AI: autonomous, goal‑seeking systems that perceive, reason, act and, crucially, learn inside production environments.
Only eighteen months ago the conversation was still about prompt engineering. Today, the frontier has shifted to whether banks can allow software “colleagues” to run unsupervised for minutes, hours or even days. The answer is already a tentative yes, and the implications, commercial, operational and regulatory, are profound.
From generative to agentic: adding the feedback loop
Generative AI dazzled executives by spinning up text, code and images; yet it still required a human hand on the prompt. Agentic AI bolts a continuous feedback loop onto that capacity. The agent ingests streaming data, evaluates it against a set of objectives and constraints, decides on an action, executes the action via APIs or internal systems and then watches the outcome to refine its future policy. The World Economic Forum has described this closed‑loop autonomy as finance’s next step toward “process self‑governance.” It is not artificial general intelligence as each agent is still narrow, but when hundreds operate in concert, the functional perimeter of the firm begins to change.
Why finance?
Financial services deliver the very things agentic systems feed on: dense, structured data; repeatable, rule‑bound workflows; and markets that punish latency. The industry also suffers from margin compression: cost‑to‑income ratios at many global banks still sit uncomfortably above 50 percent, which makes even small efficiency gains valuable. Finally, customers transact around the clock. A human trader may pause for sleep; an agent never does.
Those conditions explain why banks, asset managers and insurers have become early laboratories. The work rarely makes front‑page news, but internal programme names: Quest IndexGPT, Eliza, GPT Store, are already part of everyday Slack chatter in the institutions that run them.
Quest IndexGPT: a data scientist that never clocks out
J.P. Morgan’s asset‑management arm went live with IndexGPT in May 2024. The tool asks an LLM to generate keywords around an investment theme, for example, “circular economy” or “quantum‑safe cybersecurity,” then pipes the list into a separate NLP engine that trawls filings and news, scores corporate exposure and re‑balances a real index. Human portfolio managers still sign‑off, but the cognitive lift has shifted to silicon. The bank touts faster time‑to‑market for bespoke thematic baskets and lower running costs for small, long‑tail indices that would have been uneconomic under a fully human process.
BBVA’s GPT Store: autonomy through crowdsourcing
Spain’s BBVA took a different route. In late 2024 it rolled out an internal GPT Store where any employee could publish an approved agent and any colleague could reuse it. Within four months the store held roughly 3,000 micro‑agents handling tasks from legal‑query triage to sentiment analysis of call‑centre transcripts. Licence utilisation among the initial user base exceeded 80 percent, a figure that astonished even the bank’s AI leadership team. The lesson: once knowledge‑workers taste autonomy at the task level, adoption can snowball without top‑down mandates.
BNY Mellon’s Project Eliza: custodianship meets ChatGPT
February 2025 brought another milestone when custody giant BNY Mellon announced a partnership with OpenAI to co‑develop Eliza, a proprietary agentic platform set to underpin every product line from securities services to payments. BNY’s chief information officer framed the move bluntly: “We no longer think of AI as a bolt‑on. It is the operating system of the bank.” The firm’s roadmap calls for thousands of self‑service agents, each governed by a central risk office but deployed and iterated by business users.
2025: the “year of the agent”
If these early adopters feel niche, consider the macro trend. Executives polled at the Reuters NEXT summit predict that autonomous agents will dominate the AI agenda in 2025, shifting boardroom metrics from top‑line growth to margin expansion as tasks that once consumed hours of analyst labour collapse to seconds of compute. Venture capital is shifting likewise: deal memos now obsess over agent‑centric architectures rather than foundation‑model bragging rights.
Goldman Sachs analysts go further. In a March 2025 note they argue that tomorrow’s infrastructure super‑cycle, billions in cloud capex, “hinges on AI agents” able to keep data‑centre utilisation above 90 percent and dynamically arbitrage compute across regions. In other words, the financial logic of the cloud itself may soon depend on autonomous software rulers.
Regulators step onto the pitch
Supervisors are anything but idle observers. Singapore’s Monetary Authority (MAS) completed a thematic review of AI model‑risk controls in mid‑2024 and published a 28‑page information paper outlining expectations for generative and agentic systems, from data‑lineage tracking to kill‑switch design. A follow‑up circular on cyber‑risks highlighted the prospect of “malicious prompt injection” that could redirect an agent’s objectives without breaching the underlying model, an attack vector far subtler than SQL injection yet potentially as damaging.
Across the Channel, the EU’s AI Act put financial applications into its “high‑risk” tier, demanding technical documentation, human oversight and post‑market monitoring. Critics warn the Act’s product‑safety framing will age badly as agents evolve, but for now compliance officers must treat every credit‑scoring or robo‑advice agent as though it were a medical device. The Bank of England’s latest industry survey puts data protection, model explainability and talent shortages at the top of banks’ AI pain points, a hierarchy that neatly mirrors the MAS findings.
Governance moves from slides to source‑code
For years “human‑in‑the‑loop” was the comfort blanket of AI risk frameworks; agents force a harder conversation. The emerging consensus looks like this: the board sets an agent charter linked to enterprise risk appetite; a central AI risk unit validates models, red‑teams behaviours and signs off on every new objective function; immutable logs feed a real‑time dashboard monitored by operations staff authorised to pull the plug. Crucially, the fail‑safe is coded as a circuit‑breaker on specific metrics, market‑value‑at‑risk spikes, unexplained model drift, rather than a generic panic button. MAS explicitly endorses such role‑based, telemetry‑driven controls in its guidance.
Talent wars: less data scientist, more AI ops engineer
Autonomy also rewrites job descriptions. BBVA doubled its dedicated AI headcount to more than 400 in 2024 and opened “AI Factories” in Mexico and Turkey. The fastest‑growing title in this space is neither quant nor prompt engineer but “AI operations officer” professionals fluent in Basel III liquidity ratios as well as retrieval‑augmented generation pipelines. These hybrid operatives babysit swarms of agents, write policy tests and negotiate with regulators. Banks that fail to cultivate such talent risk strangling innovation in second‑line approvals; those that succeed gain an engine of perpetual experimentation.
Competitive lines are redrawn
Who is best placed to own the agentic future? The card schemes start with global authentication rails and data on billions of transactions; add decision autonomy and they could morph into de‑facto credit‑decision utilities. Hyperscalers control the foundation‑model stack and sell agent orchestration as a service; the danger for banks is dependency on computational landlords with competing retail ambitions. Incumbent banks retain the balance‑sheet licences and decades of labelled data, but they must move fast, often by taking equity stakes in start‑ups that supply agentic middleware.
The Path Ahead
By year‑end 2025, analysts expect agentic AI to run perhaps five percent of intraday liquidity buffers at global systemically important banks. The first supervisory stress‑tests that explicitly model agent failure channels are penciled in for 2026. And by 2027, at least one advanced economy may permit autonomous underwriting for retail loans, matched by a new “algorithmic accountability” statute somewhere in Asia. Whether these dates slip or accelerate, the trajectory points in only one direction: deeper machine agency over the financial stack.
“Trust, but verify”
Agentic AI is not just another incremental efficiency play; it is a delegation of decision rights that strikes at the orthodox structure of a bank. The upside is extraordinary: 24‑hour trading desks that never tire, personalised offers generated, and risk‑priced, in real time, operating ratios that finally look more like fintech than legacy finance. The downside, should governance fail, is systemic: black‑box trades, cascading model drift, concentration risk in a handful of foundation models.
The pragmatic path is already visible in the institutions leading the charge: small, revenue‑bearing pilots like IndexGPT; crowd‑sourced innovation sandboxes like BBVA’s GPT Store; platform‑level commitments like BNY’s Eliza; and regulator‑aligned guard‑rails that make every agent auditable by design. Banks that treat agents as genuine colleagues, complete with job descriptions, performance reviews and the occasional disciplinary memo, will convert the promise of autonomy into sustainable competitive advantage. Those that do not will discover, perhaps abruptly, that trust without verification is simply abdication.
Either way, when the markets open tomorrow morning, an invisible software co‑worker will already have taken the first trade. It is time the rest of us caught up."
4,7ef6aa02edf9ace24a48883c59819902beb249b9151879c1b1f9d2fc648aa720,ETF Prime: Chang Highlights 5 Notable ETF Launches - ETF Trends,https://news.google.com/rss/articles/CBMiggFBVV95cUxPQjhlc09zVWJHNWNLMXNwTC1ia0NYYXhRRG9jdEI1b0NPR2ZZX1ZCdERxczhZSy1zSWJ3c2ZBaU5lV0JvZHJsbXdFU010bGtFMy1mVERZZEF1NEloQmdzZURDYThzWm8ta2F4dmc2cEQwdTRBZ2h1THNXYjN0ejVzUkRn0gGHAUFVX3lxTE9FOVd2V1o2UVYyeG1id0pGZVpYaEhRMnVTVjhUN24yYVkybGRWWU5PY1J3ZDlVZmhSbnlZOERIWGRnYUpsLXV2dVlTWkRDMThJYjlrWXNDOWZHSkFWT3Z5dy1RNmFPS1dvaUtmNGdjSGpZVnFqLWVGZzdjZUlsY1llR1p5ZGdjaw?oc=5,"Tue, 22 Apr 2025 07:00:00 GMT",ETF Trends,"Kirsten Chang, senior industry analyst at VettaFi, and Nate Geraci discuss ETF launches from Unlimited, Cambria, and iShares, Brookmont, and Teucrium, introducing an active global asset allocation strategy inspired by endowment-style investing, with a net expense ratio of just 9 basis points, a rebalance ratio of 10%, and an in-between product for extreme dilution and large-cap, heavy-weight, top-weighted, S&P 500.","(""Bank of New York Mellon"" OR ""BNY"") -gossip -celebrity -""fantasy sports"" -""game recap""",2025-04-22,BNY,2026-01-26T17:14:54.666120-05:00,https://www.etftrends.com/etf-prime/chang-highlights-5-notable-etf-launches/,"On this week’s episode of ETF Prime, Kirsten Chang, senior industry analyst at VettaFi, joins Nate Geraci to discuss ETF launches from Unlimited, Cambria, iShares, Brookmont, and Teucrium. Later, BNY’s Ben Slavin provides an update on the ETF share class structure and product innovation.
ETF Launches Poised for Record Year
Product innovation and launches have been at an all-time high, with around 50 ETF launches just in the past three weeks.
“Even with all the market turbulence, the tariff uncertainty, and the headlines changing on a dime, there’s just no stopping each engine of ETF creation,” Chang said. “There have been about 288 new ETFs this year. That compares to roughly 120 by the same time last year.”
Right now, the industry is averaging more than 75 new ETFs coming to market a month in 2025. This means the industry could be headed for 1,000 new launches this year, which would handily break last year’s record of about 750.
Of the new ETFs, equities have dominated the scene, making up around 70% of all launches, Chang said.
Notably, about 200 of those new equity ETFs have been actively managed. “They’ve also been about 30% of all the volume. We just recently hit that $1 trillion mark on active ETF assets. That’s now 10% of the total ETF pie,” she highlighted.
Chang also noted the proliferation of derivatives-based and leveraged products. Sixty-three leveraged ETFs have launched this year already compared to 71 launched in 2024. Furthermore, single-stock ETFs in particular have really blown up. Direxion alone applied for 71 leveraged ETFs, she said.
Notable ETF Launches to Highlight
Unlimited HFGM Global Macro ETF (HFGM)
HFGM fund offers an actively managed, global macro hedge fund approach to investing across a range of asset classes.
“Bob Elliott … is bringing top-tier market expertise to the table and offering an array of hedge fund strategies in an ETF wrapper at a disruptively lower price,” Chang said. “This one uses a proprietary algorithm to invest in a number of ETF and futures contracts widely held by global macro hedge funds, and it really just changes based on the market.”
Unlimited is trying to replicate this hedge fund strategy with a slightly amplified risk/return profile since it operates with roughly twice the volatility of a given sector, according to Chang.
“This is actually the first of many ETFs Unlimited is planning to roll out in an ETF wrapper,” Chang added.
See more: Unlimited Brings Global Macro Hedge Fund Strategy to ETFs
Cambria Endowment Style ETF (ENDW)
The Cambria Endowment Style ETF offers a diversified, global investment strategy that seeks income and capital appreciation. This ETF provides exposure to major global asset classes and seeks to use an endowment style investment approach. The fund is designed to pursue returns across various market conditions while maintaining an aggressive risk profile.
The fund launched with $98 million, funded by individual advisors and investors who swapped to the ETF format from a separately managed account through a 351 Exchange, according to Chang.
“It’s an active global asset allocation strategy inspired by endowment-style investing, which was obviously done very well,” she added.
iShares S&P 500 3% Capped ETF (TOPC)
TOPC offers distinct capped exposure to the equities within the S&P 500. Following a fee waiver, the fund has a net expense ratio of just 9 basis points.
“It caps holdings so that no company has a weight of over 3%,” Chang noted. “It rebalances quarterly, and then, as I understand it, any excess weights are redistributed to the remaining holdings based on their market caps.”
Invesco’s RSP will be the fund’s chief competitor, according to Chang. RSP provides greater exposure down the cap spectrum; however, TOPC is more competitively priced.
“[TOPC is] almost reminiscent of a mutual fund strategy in that you have a cap on individual stock weightings,” she said. “To some, equal weight might just be too extreme a dilution.”
“I think [TOPC] gives you a good balance between the two. It’s kind of an in-between product for extreme dilution and the typical large-cap, heavy-weight, top-weighted, S&P 500,” Chang added.
See more: New BlackRock S&P 500 ETF Caps Companies at 3% Weight
Brookmont Catastrophic Bond ETF (ILS)
ILS is the first U.S.-listed ETF dedicated exclusively to catastrophic bonds.
“It has zero correlation with the market. It’s tied purely to unexpected natural disasters,” Chang explained. “Even if the U.S. goes into a recession or geopolitics kind of rears up again, it’s insulated from that.”
She thinks the fund is difficult to pull off because there are questions of how to price it correctly and whether holdings offer enough diversification.
“I think it’ll start off with a sophisticated investor looking for a major diversifier,” Chang said.
See more: Brookmont Unveils First U.S.-Listed CAT Bond ETF
Teucrium 2x Long Daily XRP ETF (XXRP)
Teucrium launched the first U.S.-based XRP ETF earlier this month.
Notably, the ETF itself saw over $5 million in trading volume on its debut, according to Chang.
“Obviously, there is strong institutional interest there,” she said. “This launch coincided with a nearly 40% increase in XRP overall trading volume itself, reaching approximately $9 billion.”
While many investors have questions as to why a leveraged futures-based product was approved before a spot ETF, Chang said it comes down to regulation.
“It’s a derivatives-based futures market. It’s tightly regulated; it’s tightly monitored. Regulators feel they have a better grasp,” she explained. “Cash can obviously be manipulated, whereas futures are much tougher to manipulate. So that’s why we saw sort of clearance of futures with bitcoin before the spot product itself.”
See more: New Teucrium ETF Offers Leveraged Exposure to XRP
ETF Share Class: Updates on the Regulatory Front
The rise in adoption of active ETFs is fueling the interest around the share class structure. There have been over 50 applicants who have filed, with many more asset managers on the sidelines looking to jump in, Slavin said.
“Certainly, what we are hearing is almost universal interest across our asset manager client base,” he added.
“We think the time frame does seem to be accelerating,” Slavin noted. “But, I think there’s a difference between the ability to actually do it and then the readiness for the managers and the platforms to be able to support all this.”
Listen to the entire episode of ETF Prime:
For more ETF Prime podcast episodes, visit our ETF Prime Channel."
5,9e683e187e07a6a145f6da662c51bc69cb31084ed9bb345623e3950d8fd52cc2,DHF: Risks Are Too Great For A Contrarian Purchase (DHF) - Seeking Alpha,https://news.google.com/rss/articles/CBMijwFBVV95cUxQRVBYNlJFaEo5bmFaNWZoU0I1UTdIcVhxYXZTQWc2ZEk5akNJSlc2eDJ6dWw2eGg4b1hZNVlsZHVrbGRQZjFJOWJ0UXBuY3ppSVpsTzFLcG1CbkxFaVJCZm5jVHRqNzhSc29sbG5FQmNZVGVtMHlkYmtteTk2a1hiM3N0cjlmUUhWbnhCTTlBNA?oc=5,"Wed, 23 Apr 2025 07:00:00 GMT",Seeking Alpha,,"(""Bank of New York Mellon"" OR ""BNY"") -gossip -celebrity -""fantasy sports"" -""game recap""",2025-04-22,BNY,2026-01-26T17:14:54.666120-05:00,https://seekingalpha.com/article/4777365-dhf-risks-too-great-for-a-contrarian-purchase,
