,id,title,link,published,source,summary,query,target_date,ticker,fetched_at,actual_link,full_text
0,6b0239a16c76b524fbcab3399c6c65a61aac301fc69c442b20a4f5e1cc34af99,iFlow | Short Thoughts | The Fed Slows Quantitative Tightening - BNY,https://news.google.com/rss/articles/CBMi6AFBVV95cUxOYmh4TDZTajRsSC1TMU1RTGhpSVEtbThDa2E0QTN0TWZIeTVsaWF0RzZXS2JoR2ljeGpyLXVOYWdVbmFsVFFMQktfUDRqT24yclRXRS03RVZqb3ZpRzREWHYtOEd3VWp5aFFIM214YWRzdmNIN1dfaUZJQ2VsMERkNkkwRk1rRWZlMS1xS3Q4RmpzVWMwYkUxajQ2b2Q0WGpCR25KdmlMN2NOUWc5azdpVDFzbUpKWjVxR3Y2Wk9XNHdLX1VKUllYejRfbndETnhrUkNhUzNESGRkalRiNUllUTQwMHJrdFZD?oc=5,"Tue, 15 Apr 2025 07:00:00 GMT",BNY,"The iFlow Exhibit #1 shows cumulative cross-border flows into U.S. dollar-denominated financial assets in the past twelve months, with a sharp sell-off in bond yields pushing up to 5.7% intraday, and a slew of T-bill issuance affecting debt ceiling debt ceiling resolutions, revealing a short-lived trend in US dollar-denominated assets, while a Federal Reserve argues rates are on hold until signs of weakness emerge.","(""Bank of New York Mellon"" OR ""BNY"") -gossip -celebrity -""fantasy sports"" -""game recap""",2025-04-15,BNY,2026-01-26T17:14:50.560650-05:00,https://www.bny.com/corporate/global/en/solutions/platforms/execution-services/iflow/short-thoughts/cross-border-outflows-persist-in-us-fixed-income.html,"Cross-border Outflows Persist in U.S. Fixed Income
Short Thoughts offers perspectives on US funding markets, short-term Treasuries, bank reserves and deposits, and the Federal Reserve's policy and facilities.
John Velis
Time to Read: 2 minutes
EXHIBIT #1: CROSS-BORDER SELLING OF USTS SINCE APRIL 2
Source:BNY Markets, iFlow
Our iFlow data confirms that cross-border investors are exiting U.S. dollar-denominated financial assets. Last week, our U.S. Treasury flow registered its third largest outflow by foreign-based investors since the early days of the pandemic. As Exhibit #1 shows, cross-border outflows from USTs have been almost entirely across the yield curve, with only the very long (10y and higher) segment seeing inflows from abroad.
The sharp sell-off in bond yields, with the 10y note pushing up to 5.7% intraday at the end of last week, has keyed speculation in the markets of foreign shedding of USD-based assets and musings about “de-dollarization”, or the beginning of the end of the USD as a global reserve currency. Even with the DXY U.S. dollar index moving below 100, we think that discussion is premature from a long-term structural economic perspective. There is no doubt that U.S. assets, including Treasuries, are seeing increased selling pressure.
Exhibit #1 shows average daily flows (on a scored basis) for different yield buckets on the curve and cash and short-term instruments (“CAST”) since April 3, the first day after the administration announced sweep universal and retaliatory tariffs. While the selling – save for the very long end – has been unequivocal, it is hardly a recent development.
EXHIBIT #2: FLOWS WEAKER SINCE BEGINNING OF YEAR
Source: BNY Markets, iFlow
Exhibit #2 shows cumulative cross-border flows into (or out of) USTs over the past twelve months, starting on April 12, 2024. We accumulate overseas flows every day, allowing us to see the ebbs and flows of foreign demand. In mid-2024, after the resolution of the debt ceiling crisis, we see a large jump in foreign inflows into USTs, primarily due to a slew of T-bill issuance that occurred upon the debt ceiling’s resolution. From that point on, save for a few brief and discernable episodes – like October 2024 and late December last year- foreign demand has been tepid at best. By the end of 2024 and early 2025, we have observed persistent and sustained selling by foreign domiciled real money investors, reaccelerating after early April 2025.
EXHIBIT #3: EXITING US FIXED INCOME
Source: BNY Markets, iFlow
We have seen evidence of foreign selling across other USD assets as well. In U.S. equities, selling by cross-border investors has been persistent since late 2024. Across non-UST fixed income assets, we see selling in MBS securities, munis, and corporate bonds over the past 5 days. This shedding of USD-denominated assets is broad based, as seen in Exhibit #3.
Forward look
Foreign investors exiting USD denominated assets, especially in fixed income, has been a feature of post-election U.S. markets. However, since April 2, it has accelerated and become broad-based, which we don’t think is a short-lived phenomenon. While U.S. economic policy uncertainty remains at historically high levels and U.S. asset volatility is similarly elevated, investors remain skittish. Additionally, the Federal Reserve argues that rates are on hold until clear signs of weakness in U.S. growth data emerge."
1,c290b7e3e2bef5d1a72df56809ff3e1809c549e6affc7633fca413f6358fdeb1,Data Share: The Next Level in Data Management - BNY,https://news.google.com/rss/articles/CBMiigFBVV95cUxOd25GZTRlYUh4d2F1OHhuQ0hQaU9MUERnRzhRc2dqMGE4elp4c0htbmEtTmdhTldyQ1dQYnU3QWlMVGRnd1FtVlExUG1WVVFrakN6YTN3a0xHcGIzZ1BNZk9xMURZT0VWR0t2X2x0bUlUZDhZdk5WLWVfdWJ0XzFNLWpKMEF2LXN2bXc?oc=5,"Tue, 15 Apr 2025 07:00:00 GMT",BNY,A BNY Cloud-based data share is a tool in a data consumption solution that aggregates data from one cloud-based account with other data consumers via subscription or authentication.,"(""Bank of New York Mellon"" OR ""BNY"") -gossip -celebrity -""fantasy sports"" -""game recap""",2025-04-15,BNY,2026-01-26T17:14:50.560650-05:00,https://www.bny.com/pershing/us/en/insights/the-next-level-in-data-management.html,"April 15, 2025
  Alicia Shems
Data has become the lifeblood of wealth management firms, but managing it effectively poses numerous challenges. From data silos to disconnected technology, firms can struggle to find an enterprise view. And, if data isn’t harmonized across the organization, it’s hard to use for gleaning insights, growing businesses, and adapting to the fast-changing and demanding financial market.
Many wealth management firms have turned to the cloud for data management, but shifting data, pipelines and operations to the cloud is not a magic bullet. Firms also must have both a clear strategy and robust framework for maintaining the accessibility, catalogue, quality, and governance of their data. A secure data share can help an enterprise uphold these four pillars of cloud data management.
What Is a Data Share?
As its name suggests, a data share is a tool in a data consumption solution that shares data from one cloud-based account with other cloud-based accounts. More technically, a share is a package of data offerings on a cloud account that other data consumers can subscribe to. In addition, shared database objects are immutable, as they are read-only and cannot be altered.
BNY and Snowflake: A Powerful Data Share Team
The flexibility of a Snowflake share enables consumers to enhance their data sets, and they can then share data back with the provider1. With the data located in one place, consumers know where to find data, when they need it. Moreover, a unique differentiator of Snowflake is that there is no file transfer, which means data is immediately available for reading.
Clients without a Snowflake account can participate in a data share via an authentication process that links the client’s chosen cloud account to BNY’s Snowflake instance. In either circumstance, the near-instantaneous access to high-quality data offers firms the tools to collaborate, innovate, and grow.
Accessibility: The Key to Collaboration
Access to data is necessary for any aspect of wealth management—be it estate planning, investment management, business succession, and more. When teams across the enterprise can access data across the firm, they can collaborate more easily, which in turn enables them to:
- Solve business challenges to improve performance and outcomes.
- Drive innovation to create new products, services, and business models.
- Enhance differentiation to gain an edge over competitors.
With a cloud data share, data is accessible in near real time. In BNY’s Snowflake data share, BNY aggregates data from multiple sources and then makes it accessible to the consumer via either a subscription or authentication process. This way, data consumers within BNY and data consumers who are clients of BNY can easily access the data they need. In addition, since cloud updates are nearly instantaneous, consumers can be sure they are working with the latest information.
Catalogue: Benefiting from a Data Superset
Nevertheless, access to data is not enough. Consumers must also be able to find the right data at the right time. A data share offers a centralized, easy-to-use data catalogue. The distinct data marts in a share are large databases organized around a unifying principle. Just as a library has different sections (e.g., Fiction, Young Adult, Nature), a data share provider offers various data marts (e.g., Accounts, Transactions, Market Value). Within each share that consumers subscribe to, data is documented and organized.
For instance, one firm might only subscribe to streaming custody data, but another may subscribe to both streaming data and the derived data that provides performance information. Regardless of their subscription details, both firms can:
- Scan and index data sources across platforms and environments
- Identify the gaps and overlaps in their data landscape
- Optimize data storage and performance
The result is a wealth management data superset fit for purpose. Data consumers know what data assets they have, where they are, how they’re structured, and who owns them.
Quality: Confidence Behind Innovation
Knowing where and how to find data is great, but data integrity and quality are also critical to addressing business needs. On the one hand, a share mitigates version control issues that can arise from repeated consumer use. Since a share is read-only, the number of consumers who download, interrogate, and examine the data will not affect its quality.
On the other hand, a share enables providers to set up automated functions that scan the data and measure key quality metrics. Snowflake, for example, offers pre-defined data metric functions (DMFs) to monitor the data’s quality, but it also enables other data share providers to customize their own DMFs, schedule assessments, and define when alerts regarding quality should be instigated.
In addition, a share can provide real-time data quality dashboards and reports that enable you to track and visualize the quality of your data, thereby reducing errors, risks and the time spent evaluating data for inconsistencies.
Governance: The Foundation for All Pillars
Governance is the set of policies, standards, and processes that define how data is collected, stored, accessed, and used across the enterprise. Cloud-based data governance can provide the tools and workflows to manage data policies, roles, and permissions. A data share enhances:
- Compliance: Knowing the state of your data and where it is helps you meet regulatory and industry standards
- Accountability: With clearly delineated roles and responsibilities among data stewards and engineers of a data share, teams can rely on quality data and meet client and partner goals.
- Data-driven culture: Accurate, easily accessible data fosters data literacy across the organization.
Data governance, then, is inextricably linked to data inventory, quality, and accessibility. Most important, a data share implements all encryption, backup, and recovery policies, as well as subscription rules and access requirements.
Cloud-Based Data Share Is the Future
Cloud-based data platforms offer tools to access, explore, and visualize data for various types of reporting and analytics. A secure data share is the foundation for an effective and scalable way to access high-quality data when and where you need it.
An experienced partner, an interoperable platform, and fit-for-purpose products, such as a data share, can help wealth management firms scale their operations in the cloud. By adopting best practices and using the right tools for data inventory, quality, governance, and accessibility, firms can overcome longstanding data challenges and successfully create and sustain a modern culture of data-driven growth.
To learn how a BNY cloud-based data share can help you grow your wealth management business, contact your BNY Pershing relationship team.
1 Bi-directional data-sharing is part of Snowflake’s platform, and this capability is in design for BNY Pershing’s Wove platform.
Related Content
Ask how we can help transform your business"
2,33d751a88479efdc5d945a18a2ed53479dde1fd0598650d741a831c9a8933f6e,"JPMorgan, BNY Limit Information Sharing With OCC After Hack - Bloomberg.com",https://news.google.com/rss/articles/CBMirgFBVV95cUxPNEx5T0FoZTNoeTBseGQ5QVhoS1huRlFrRUhsN3JmdTJvN0trbXV6V3J1TFVBb2JtbElFVVRuMzV0bHYzNUx6ZGF6NzZBM1ZlekJnTWZ0SmVRSEhWMnh4UHRqNE9FSzdObmVSUWZmYzRTdmd4QmIyQTFlQ2t6QXQwRGxiZ3Z0Tm1rVmdSeXdFUERYRlpjSEpSYXBsdDNMamtBR2VEVy1Wc192bzRUTmc?oc=5,"Tue, 15 Apr 2025 07:00:00 GMT",Bloomberg.com,,"(""Bank of New York Mellon"" OR ""BNY"") -gossip -celebrity -""fantasy sports"" -""game recap""",2025-04-15,BNY,2026-01-26T17:14:50.560650-05:00,https://www.bloomberg.com/news/articles/2025-04-14/jpmorgan-bny-limit-information-sharing-with-occ-after-hack,
3,2e3481800983beb08dbf5e5bdf0ffecdb4296fab3e8c40bc6fa6db9fc0d402e2,OCC takes stock of breach as some banks limit info sharing - Banking Dive,https://news.google.com/rss/articles/CBMimAFBVV95cUxNVEw4Ri1RdVBpaE1jYURYRjllb28tY1BoZU1kYXN5dXQtcDQwSFlEaFNscXJ6OFhjTUxzRld3MXg4VE1uYU9VWHB3MUNVZVFIT1FISW93N2ZPSGdJTmN4cmstSnBFOVJ4ZldGTFZmaHhWT1Z1SFhVeGUxQWxaYTJVXzBpREdqeUZ0UnZZemxNRnFnbjU2UGM3Sw?oc=5,"Wed, 16 Apr 2025 07:00:00 GMT",Banking Dive,"The Office of the Comptroller of the Currency is ""now determining what data has been accessed"" in a security breach of its email system reported last week, revealing that the OCC is taking stock of ""the extent to which highly sensitive information relating to federally regulated financial institutions was compromised,"" a source told Banking Dive.","(""Bank of New York Mellon"" OR ""BNY"") -gossip -celebrity -""fantasy sports"" -""game recap""",2025-04-15,BNY,2026-01-26T17:14:50.560650-05:00,https://www.bankingdive.com/news/occ-takes-stock-breach-some-banks-limit-info-sharing/745548/,"The Office of the Comptroller of the Currency is “now determining what data has been accessed” in a security breach of its email system reported last week, Acting Comptroller Rodney Hood wrote Monday in a draft letter to bank CEOs.
The agency has made improvements to its IT security, Hood said, adding that the OCC is taking stock of “the extent to which highly sensitive information relating to the financial condition of federally regulated financial institutions was compromised.”
Meanwhile, several large banks are limiting the information they share with the agency.
JPMorgan Chase has put a hold on sharing information electronically with the OCC, a source familiar with the matter told Banking Dive. The bank is ensuring that it’s communicating with its regulators safely, according to the source.
BNY has also paused sharing information over security concerns, sources told Bloomberg; as has Bank of America, sources told The Wall Street Journal.
Not all banks are limiting their info sharing. Citi, for one, hasn’t moved to do so, as it wasn’t in its practice to share classified information via email, according to a source familiar with the matter.
Citi declined to comment to Banking Dive, as did BNY. Bank of America did not return a request for comment.
The OCC will inform each regulated institution if the hackers accessed information specific to their company, Hood wrote. The agency will also provide all institutions with email addresses that were included in the compromised information so they can determine what information was shared with the OCC during the time frame the breach occurred.
The OCC is partnering with Microsoft Global Hunting Oversight and Strategic Triage, as well as cybersecurity firms Mandiant and CrowdStrike, to perform a full investigation relating to the incident. The agency has globally reset all credentials associated with its Microsoft tenant to eliminate further threat by the same hacker, Hood wrote.
During an internal review, the OCC found that hackers accessed sensitive information, Hood wrote. The OCC then determined the breach qualified as a “major incident” under the Federal Information Security Modernization Act, meaning its either likely to “result in demonstrable harm to the national security interests, foreign relations, or the economy of the United States, or to the public confidence, civil liberties, or public health and safety of the American people.”
The OCC learned Feb. 12 that an unauthorized user accessed a number of agency email accounts and activated incident response protocols, it said. The agency notified the public Feb. 26.
Hackers gained access to more than 100 email accounts and roughly 150,000 emails from May 2023 until February, including the mailboxes of senior deputy comptrollers and international banking supervisors, Bloomberg reported April 8, citing a draft letter to Congress."
4,df5901655035d08dbbd6cf691ed35ea7c554abae2fe4c37333bff78fbd798b61,Bank of New York Mellon: A Stagflation Winner At A Fair Valuation (NYSE:BK) - Seeking Alpha,https://news.google.com/rss/articles/CBMilwFBVV95cUxQa3ZyUDhmdFVTUnIzQTVNRERZNXhCUXBWelAwNWlTbVBoWFBWOG1scUFNTkd6MGpPOFBIWWtYcjdDT2l4RjZZNUVkM0FzUnZSLXZ3QXQwSDByRlQ0VE9NT1JmMU8wZ04tNnNqYWM4bDA5eEstazVvS3JCMlRZeE9aV19kUkNsS3BDN3UwZWJXdTdsbkZxR09R?oc=5,"Tue, 15 Apr 2025 07:00:00 GMT",Seeking Alpha,,"(""Bank of New York Mellon"" OR ""BNY"") -gossip -celebrity -""fantasy sports"" -""game recap""",2025-04-15,BNY,2026-01-26T17:14:50.560650-05:00,https://seekingalpha.com/article/4775186-bny-mellon-a-stagflation-winner-at-a-fair-valuation,
5,2d31e78f2de44705862cdb95e10dff27fd6c36656e1e67ea79bdf4da6b991dc7,Major U.S. banks pause data sharing with this federal bureau after a cyberattack exposed sensitive information - Fast Company,https://news.google.com/rss/articles/CBMipAFBVV95cUxOSmxPbHhES0I4Q1FwWG9HT0k4eGpQS1l1SGJON3lDcVFwTDZMYTZEVXU4YndGOFN0RnMyc2tVUjlINTU3YzI1OUtFNHYwbEZQSkRGTXZ2T3dUbm1GOFR5aDRVMlowQ2lUaGZ6amg3LUZNRzJtSUpWQzhsaGdIOUlZYUhnM1dwREpVNEUzdlVPWDFaVEJtemlXUjF4M1hJdWJYTC1YSA?oc=5,"Tue, 15 Apr 2025 07:00:00 GMT",Fast Company,,"(""Bank of New York Mellon"" OR ""BNY"") -gossip -celebrity -""fantasy sports"" -""game recap""",2025-04-15,BNY,2026-01-26T17:14:50.560650-05:00,https://www.fastcompany.com/91317303/major-baks-data-sharing-office-of-the-comptroller-of-the-currency,
6,07989d591ea3362a4454b42bf4c688e451dfc0bcdeb375387fe6ac2c82bc92d7,Major US banks dial down information sharing with OCC after email hack - Finextra Research,https://news.google.com/rss/articles/CBMiswFBVV95cUxQYjFGUXQ2eFMwWU9rZVJ5OW1id3FyXzJmZ0E3OTRzaHJpa2R5VzkwOEdIY3FCZGFCVVZqUmUzRGRTLXZkNEo0NVJSV2xkVUNuLWhzVEk3eHBhTFpJT3ExT3NCbkZJRVFKZEhueUpkMDJZbk0tTnZJTVItSjZVVzRJS21WdGZLVlNTX2h0bHRTWlF6RTljNTFyUXdIby11RU5icTNHSTZLcEVVcGViejlIQkhLUQ?oc=5,"Tue, 15 Apr 2025 07:00:00 GMT",Finextra Research,,"(""Bank of New York Mellon"" OR ""BNY"") -gossip -celebrity -""fantasy sports"" -""game recap""",2025-04-15,BNY,2026-01-26T17:14:50.560650-05:00,https://www.finextra.com/newsarticle/45836/major-us-banks-dial-down-information-sharing-with-occ-after-email-hack,
7,9959767c90487de7c755172d17c846e92388d7c65d9ac108245ff5b3c74c9dc2,Missing NYC banker Grant Barr washes up dead on Spanish beach in heartbreaking twist for family - New York Post,https://news.google.com/rss/articles/CBMiogFBVV95cUxNSjR5NDZteV9VcVo2NjZMLXVlR3JTd0hzX2FscFdLeTNZRDFFeC00NmUzU2VJRkZpS0hPV2ZZRE1oN1BMUHBfSVd6Zzcwb2hiTEp4SWVaT2NBbXVGVmRPM21CVHdRRHp0M21RbE8ya1ZrcUN3ckNVUXpLUTBVWmRGUnJJa1NMcnVpRkxtdFZJallQNVo1dkRobXJFampZbmxJRGc?oc=5,"Wed, 16 Apr 2025 07:00:00 GMT",New York Post,"The body of a New York City banker who disappeared on Jan. 28 in Estepona on the Costa del Sol washed ashore on March 3 but was only identified in early April, with his brother James Barr telling the Spanish Eye that his brother passed on doing what he loved: facing the sea in its magnificent beauty and terrible might.","(""Bank of New York Mellon"" OR ""BNY"") -gossip -celebrity -""fantasy sports"" -""game recap""",2025-04-15,BNY,2026-01-26T17:14:50.560650-05:00,https://nypost.com/2025/04/15/world-news/nyc-banker-washes-up-dead-in-spain-in-sad-twist-for-family/,"Missing NYC banker Grant Barr washes up dead on Spanish beach in heartbreaking twist for family
The body of a New York City banker washed up on a beach in Spain — but his family continued searching for him for weeks because no one told them about the grisly discovery.
Grant Barr, a 37-year-old banker with BNY, disappeared on Jan. 28 while vacationing in Estepona on the Costa del Sol, mysteriously leaving only a pair of pants, passport and boating license on the beach.
His body washed ashore on March 3 but it was only identified in early April — meaning his family spent weeks desperately searching for him, not realizing he’d been found dead.
“After a week and back and forth between the courts and the coroner’s office, his remains were released on Friday and we were able to cremate him and finally bring him home,” Barr’s brother, James Barr, told the Spanish Eye about his brother.
“While the thoughts of a worst-case scenario came to mind from time to time, none of us actually thought this would ultimately be the outcome,” he continued.
James was frustrated that the report from Spanish police means “the last time we were all there searching for [Grant] two weeks he was already found, however, they didn’t even suggest that there was something they were looking into.”
Spanish authorities positively identified Barr using DNA, the family said. James, his other brother Luke and their mom immediately flew back across the Atlantic, where they met their father, who hadn’t left.
Officials have initially ruled his death a drowning.
“Our Brother passed on doing what he loved: facing the sea in its magnificent beauty and terrible might,” Grant’s brother Luke said in a statement through James.
Barr had traveled to Spain for a sailing getaway after going through a difficult breakup, according to EuroWeekly News.
His father, Michael, had previously recalled his son’s delicate emotional state before he vanished, including seeming paranoid about his family being in danger, according to the outlet.
Barr most recently worked at BNY, according to his LinkedIn profile. The New Jersey Institute of Technology graduate previously worked with other major corporations, including Citi.
“We are deeply saddened by the passing of our colleague, Grant Barr. On behalf of Grant’s coworkers and the entire BNY team, we wish to express our deepest sympathies to his family and will be supporting them at this incredibly difficult time,” a BNY spokesperson said.
Spain’s Guardia Civil and Policia Nacional have not commented on the new developments."
