,id,title,link,published,source,summary,query,target_date,ticker,fetched_at,actual_link,full_text
3,afe24f0472e7f7a5978cadf1eef709236906c7ba648f4d5127f1a8ba12f3dc01,Agentic AI: The Rise Of Autonomous Decisions In The Financial Industry - Forbes,https://news.google.com/rss/articles/CBMiwAFBVV95cUxQQS02TXFqQXJKNDJVa21jUktTSFpJZVdZUGtZLUg5eE9UTGdKWmN3TEtXNUlmTkRMdGIzaGRsTFVhNEpkWlBDQ21QalFBZE10VGFjdVJRcDQzUDJubU1FejFEdVcxczBzamZtWlpUMHRQd3JiNmlIMm5xaE9MU2lqSHpSRXZEa0t6UlFCX2RxRTQzMlZGZm42VDJFMTBYcS1ZN3Z6OUlnSUM5YUlWeDFwVW14N3ZxaFU1dTFYaWl1dEU?oc=5,"Wed, 23 Apr 2025 07:00:00 GMT",Forbes,"The Bank of England’s Monetary Authority (MAS) completed a thematic review of AI modelrisk controls in mid2024 and published a 28page information paper outlining expectations for generative and agentic systems, from datalineage tracking to killswitch design, to global authentication rails and datacentre transcripts, and a rewrite of job descriptions, demonstrating that generative agents dominate the AI agenda in 2025, shifting boardroom metrics from topline growth to margin expansion as tasks that once consumed analyst","(""Bank of New York Mellon"" OR ""BNY"") -gossip -celebrity -""fantasy sports"" -""game recap""",2025-04-23,BNY,2026-01-26T17:14:55.273239-05:00,https://www.forbes.com/sites/zennonkapron/2025/04/23/agentic-ai-the-rise-of-autonomous-decisions-in-the-financial-industry/,"A pre‑market shuffle no one noticed
Just after dawn in London, a tier‑one bank’s treasury bot scans the liquidity position, matches it to day‑ahead cash‑flow forecasts and silently sweeps £210 million from a low‑yield reserve account into the overnight repo market. A risk notice and rationale land in the human treasurer’s inbox minutes later, but the decision, trade execution and journal entry were all performed end‑to‑end by software. Similar scenes are playing out in credit‑card pricing teams in Singapore and fraud‑monitoring squads in New York. The common actor behind them is agentic AI: autonomous, goal‑seeking systems that perceive, reason, act and, crucially, learn inside production environments.
Only eighteen months ago the conversation was still about prompt engineering. Today, the frontier has shifted to whether banks can allow software “colleagues” to run unsupervised for minutes, hours or even days. The answer is already a tentative yes, and the implications, commercial, operational and regulatory, are profound.
From generative to agentic: adding the feedback loop
Generative AI dazzled executives by spinning up text, code and images; yet it still required a human hand on the prompt. Agentic AI bolts a continuous feedback loop onto that capacity. The agent ingests streaming data, evaluates it against a set of objectives and constraints, decides on an action, executes the action via APIs or internal systems and then watches the outcome to refine its future policy. The World Economic Forum has described this closed‑loop autonomy as finance’s next step toward “process self‑governance.” It is not artificial general intelligence as each agent is still narrow, but when hundreds operate in concert, the functional perimeter of the firm begins to change.
Why finance?
Financial services deliver the very things agentic systems feed on: dense, structured data; repeatable, rule‑bound workflows; and markets that punish latency. The industry also suffers from margin compression: cost‑to‑income ratios at many global banks still sit uncomfortably above 50 percent, which makes even small efficiency gains valuable. Finally, customers transact around the clock. A human trader may pause for sleep; an agent never does.
Those conditions explain why banks, asset managers and insurers have become early laboratories. The work rarely makes front‑page news, but internal programme names: Quest IndexGPT, Eliza, GPT Store, are already part of everyday Slack chatter in the institutions that run them.
Quest IndexGPT: a data scientist that never clocks out
J.P. Morgan’s asset‑management arm went live with IndexGPT in May 2024. The tool asks an LLM to generate keywords around an investment theme, for example, “circular economy” or “quantum‑safe cybersecurity,” then pipes the list into a separate NLP engine that trawls filings and news, scores corporate exposure and re‑balances a real index. Human portfolio managers still sign‑off, but the cognitive lift has shifted to silicon. The bank touts faster time‑to‑market for bespoke thematic baskets and lower running costs for small, long‑tail indices that would have been uneconomic under a fully human process.
BBVA’s GPT Store: autonomy through crowdsourcing
Spain’s BBVA took a different route. In late 2024 it rolled out an internal GPT Store where any employee could publish an approved agent and any colleague could reuse it. Within four months the store held roughly 3,000 micro‑agents handling tasks from legal‑query triage to sentiment analysis of call‑centre transcripts. Licence utilisation among the initial user base exceeded 80 percent, a figure that astonished even the bank’s AI leadership team. The lesson: once knowledge‑workers taste autonomy at the task level, adoption can snowball without top‑down mandates.
BNY Mellon’s Project Eliza: custodianship meets ChatGPT
February 2025 brought another milestone when custody giant BNY Mellon announced a partnership with OpenAI to co‑develop Eliza, a proprietary agentic platform set to underpin every product line from securities services to payments. BNY’s chief information officer framed the move bluntly: “We no longer think of AI as a bolt‑on. It is the operating system of the bank.” The firm’s roadmap calls for thousands of self‑service agents, each governed by a central risk office but deployed and iterated by business users.
2025: the “year of the agent”
If these early adopters feel niche, consider the macro trend. Executives polled at the Reuters NEXT summit predict that autonomous agents will dominate the AI agenda in 2025, shifting boardroom metrics from top‑line growth to margin expansion as tasks that once consumed hours of analyst labour collapse to seconds of compute. Venture capital is shifting likewise: deal memos now obsess over agent‑centric architectures rather than foundation‑model bragging rights.
Goldman Sachs analysts go further. In a March 2025 note they argue that tomorrow’s infrastructure super‑cycle, billions in cloud capex, “hinges on AI agents” able to keep data‑centre utilisation above 90 percent and dynamically arbitrage compute across regions. In other words, the financial logic of the cloud itself may soon depend on autonomous software rulers.
Regulators step onto the pitch
Supervisors are anything but idle observers. Singapore’s Monetary Authority (MAS) completed a thematic review of AI model‑risk controls in mid‑2024 and published a 28‑page information paper outlining expectations for generative and agentic systems, from data‑lineage tracking to kill‑switch design. A follow‑up circular on cyber‑risks highlighted the prospect of “malicious prompt injection” that could redirect an agent’s objectives without breaching the underlying model, an attack vector far subtler than SQL injection yet potentially as damaging.
Across the Channel, the EU’s AI Act put financial applications into its “high‑risk” tier, demanding technical documentation, human oversight and post‑market monitoring. Critics warn the Act’s product‑safety framing will age badly as agents evolve, but for now compliance officers must treat every credit‑scoring or robo‑advice agent as though it were a medical device. The Bank of England’s latest industry survey puts data protection, model explainability and talent shortages at the top of banks’ AI pain points, a hierarchy that neatly mirrors the MAS findings.
Governance moves from slides to source‑code
For years “human‑in‑the‑loop” was the comfort blanket of AI risk frameworks; agents force a harder conversation. The emerging consensus looks like this: the board sets an agent charter linked to enterprise risk appetite; a central AI risk unit validates models, red‑teams behaviours and signs off on every new objective function; immutable logs feed a real‑time dashboard monitored by operations staff authorised to pull the plug. Crucially, the fail‑safe is coded as a circuit‑breaker on specific metrics, market‑value‑at‑risk spikes, unexplained model drift, rather than a generic panic button. MAS explicitly endorses such role‑based, telemetry‑driven controls in its guidance.
Talent wars: less data scientist, more AI ops engineer
Autonomy also rewrites job descriptions. BBVA doubled its dedicated AI headcount to more than 400 in 2024 and opened “AI Factories” in Mexico and Turkey. The fastest‑growing title in this space is neither quant nor prompt engineer but “AI operations officer” professionals fluent in Basel III liquidity ratios as well as retrieval‑augmented generation pipelines. These hybrid operatives babysit swarms of agents, write policy tests and negotiate with regulators. Banks that fail to cultivate such talent risk strangling innovation in second‑line approvals; those that succeed gain an engine of perpetual experimentation.
Competitive lines are redrawn
Who is best placed to own the agentic future? The card schemes start with global authentication rails and data on billions of transactions; add decision autonomy and they could morph into de‑facto credit‑decision utilities. Hyperscalers control the foundation‑model stack and sell agent orchestration as a service; the danger for banks is dependency on computational landlords with competing retail ambitions. Incumbent banks retain the balance‑sheet licences and decades of labelled data, but they must move fast, often by taking equity stakes in start‑ups that supply agentic middleware.
The Path Ahead
By year‑end 2025, analysts expect agentic AI to run perhaps five percent of intraday liquidity buffers at global systemically important banks. The first supervisory stress‑tests that explicitly model agent failure channels are penciled in for 2026. And by 2027, at least one advanced economy may permit autonomous underwriting for retail loans, matched by a new “algorithmic accountability” statute somewhere in Asia. Whether these dates slip or accelerate, the trajectory points in only one direction: deeper machine agency over the financial stack.
“Trust, but verify”
Agentic AI is not just another incremental efficiency play; it is a delegation of decision rights that strikes at the orthodox structure of a bank. The upside is extraordinary: 24‑hour trading desks that never tire, personalised offers generated, and risk‑priced, in real time, operating ratios that finally look more like fintech than legacy finance. The downside, should governance fail, is systemic: black‑box trades, cascading model drift, concentration risk in a handful of foundation models.
The pragmatic path is already visible in the institutions leading the charge: small, revenue‑bearing pilots like IndexGPT; crowd‑sourced innovation sandboxes like BBVA’s GPT Store; platform‑level commitments like BNY’s Eliza; and regulator‑aligned guard‑rails that make every agent auditable by design. Banks that treat agents as genuine colleagues, complete with job descriptions, performance reviews and the occasional disciplinary memo, will convert the promise of autonomy into sustainable competitive advantage. Those that do not will discover, perhaps abruptly, that trust without verification is simply abdication.
Either way, when the markets open tomorrow morning, an invisible software co‑worker will already have taken the first trade. It is time the rest of us caught up."
4,32bc91538f830252fe87ed15fb86e8bc1183e98dc2b7cc0f403231e19a76e3d5,Spring 2025 Design Expo - University of Pittsburgh,https://news.google.com/rss/articles/CBMiakFVX3lxTE5VQkRUZjBXbll2YmJiQ1BuclhRTnJKZ2dxRmJPMmltNTNHNlNUQ0NyMzA0eU12ZktzOGg1bmdmbWZ1MnlqZGdPWk1EenUxVUVvaWZBdlVVZ0RXT29oLVgweGtXbzlwMHRqTkE?oc=5,"Thu, 24 Apr 2025 07:00:00 GMT",University of Pittsburgh,"The 21st Design Expo at the University of Pittsburgh Swanson School of Engineering showcased 93 creative, innovative, and collaborative problem-solving projects from ENGR-0717, with two to eight students mentored by Pitt faculty and industry volunteers, and voted on their favorite project, which earned the People’s Choice Award, with 93 projects from five departments and finalists, including a CAVEMAN – Cave Autonomous Vehicle for Exploration, Mapping, and Navigation – and AFO Locking Flexion Hinge","(""Bank of New York Mellon"" OR ""BNY"") -gossip -celebrity -""fantasy sports"" -""game recap""",2025-04-23,BNY,2026-01-26T17:14:55.273239-05:00,https://news.engineering.pitt.edu/spring-2025-design-expo/,"Spring 2025 Design Expo
Pitt engineering students showcase innovative, collaborative problem-solving at the Spring 2025 Design Expo
Above: The Smart Motorcycle Helmet Team - A of (L - R) Daniel Stoller, Isabella Terick, Allison Hastings, and Cara Buck
On Thursday, April 17, students from the University of Pittsburgh Swanson School of Engineering showed off their creative, innovative, and collaborative problem-solving at the 21st Design Expo. Held for the first time at the Peterson Event Center, the expo featured 93 amazing design projects from across five departments and highlighted cornerstone projects from ENGR-0717: Foundation of Engineering Design students.
Teams of two to eight students were mentored by Pitt faculty and local industries, and their projects were judged by Pitt alumni and faculty as well as by industry volunteers. Attendees also voted on their favorite project, which earned the People’s Choice Award.
“Each year, the Swanson School’s many industry partners generously pose real-world problems for the Design Expo,” said Mary Besterfield-Sacre, Senior Associate Dean for Academic Affairs and Nickolas A. DeCecco Professor in Industrial Engineering. “Seeing how our students work together to solve these challenges, for me, is an endless source of inspiration. This spring, the new venue has only added to the event’s success. We are grateful to the judges, our partners, and the attendees for their support of our students and engineering at Pitt.”
Visit Flickr for the Expo Photo Album.
Winners below:
Best Overall Project
Vision-Language-Action Model for a Generalist Robotic Manipulator
Benjamin Carnovale, Samarth Chopra, Alexander McMoil, and Evan Sokolson
People’s Choice Award
Standardizing Starline’s Warehouse Pickings
Maggie Altschaffl, Bikai Fang, Sarai Morato, Xindi Shao, and Matt Tarone
DEPARTMENT AWARDS
Bioengineering
1st Place Improving Bag Value Masks in Emergency Medicine
Kelly Isola, Connor LaMarca, Ben McCutcheon, Rebecca Miller, Brock Pemberton, Madison Smith, and Erica Taylor
2nd Place Adjustable Pediatric AFO with Locking Flexion Hinge for Diplegic Cerebral Palsy
Aritra Ghatak, Semira Kizhakkey, Kshitija Koli, Andrea Moore, Francine Sanoy, and Danielle Yakubisin
3rd Place Still Grip: Ergonomic Surgical Grip
Michael Christofidis, Maya Franklin, Ryan Ging, Tarnini Ravikumar, Suyash Sinkar, Peter Wood, and Eileen Zhang
Civil and Environmental Engineering
1st Place Bullock-Pens Park Project
Erica Beigi, Madelynn Bennett, Brandyn D’Amico, Connor Kane, Paige Mancia, and Nick Rocco
2nd Place BNY Mellon Center Retrofit
Trey Blystone, Michael Constantine, Ashley Lucente, Michael Makowski Jr, Daneil Schaub, William Schmidt, and Grace Walker
3rd Place Sylvan Ave Slope Stabilization Project
Liam McLaughlin, Fernanda Morales-Viveros, Chris Moran, Cora Nevel, and Daniel Parks
Electrical and Computer Engineering
1st Place Vision-Language-Action Model for a Generalist Robotic Manipulator
Benjamin Carnovale, Samarth Chopra, Alexander McMoil, and Evan Sokolson
2nd Place Satellite Tracking Directional Antenna Array (STARR-LOC)
Kaye Baron, Thomas Eckrich, Aidan Gresko, and Adam Nichols
3rd Place (tie)
Cheap High-Performance Advanced Storm Equipment (CHASE)
Rohan Ari, Noah French, Ruizhe Gao, Natan Herzog, and Beryl Sin
CAVEMAN – Cave Autonomous Vehicle for Exploration, Mapping, and Navigation
Benjamin Esquieres, Tyler Hansen, Kushal Parekh, Pavel Serhiayenka, and David Zhang
Industrial Engineering
1st Place Lunar Intelligence and Reconnaissance Initiative (LIRI)
Connor Cosgrove, Katherine Gonzalez, Felicity Thatcher, Andrea Toader, and Brian Trieu
2nd Place Standardizing Starline’s Warehouse Pickings
Maggie Altschaffl, Bikai Fang, Sarai Morato, Xindi Shao, and Matt Tarone
3rd Place NurturePA: Streamlining Perinatal Mood and Anxiety Disorder (PMAD) Assessment
Hannah Bradfield, Xiangyy Cheng, Jordan Henry, Xinkai Li, and Roan McCall
Mechanical Engineering and Materials Science
1st Place Vibration Durability of Printed Electronics for UAVs
Ezra Dugosh, David Engler, Adam Gosden, Nathan Hoffeditz, Minh Nguyen, and Brittany Sadej
2nd Place (tie)
Multimodal UAV Detection
Dmitri Asay, Matthew Houston, Jayden Provance, and Alex Schehadi
Acoustic Noise Reduction for Urban Homeless Populations
Rebekah Burns, Ben Fidler, Elizabeth Fillman, Maia Gulley, Brendan Lang, Hannah Muschinski, and Steven Panico
Development of Thermal Management Solutions for AI Datacenters Using High Thermal Conductivity Materials – B
Lauren Beck, Ryan Carroll, Emma Murphy, Ganesh Selvakumar, Taorui Su, and Ruiqi Wang
Product Realization
1st Place Wearable Fall Injury Protection via Expandable Foam
Shane Conlin, Eric Eversbusch, and Kenechukwu Nnake
2nd Place Alternate (Renewable) Energy Sourcing at Commercial Scale
Arjun Bains, Bhargav Gadiparthi, John Nelligan, and Brigit O’Bannon
3rd Place “Smart” Medicine Dispenser
Jeremy Fresh, Cindy Lkhagvasuren, Jessica Wong, and Danielle Yakubisin"
5,9e683e187e07a6a145f6da662c51bc69cb31084ed9bb345623e3950d8fd52cc2,DHF: Risks Are Too Great For A Contrarian Purchase (DHF) - Seeking Alpha,https://news.google.com/rss/articles/CBMijwFBVV95cUxQRVBYNlJFaEo5bmFaNWZoU0I1UTdIcVhxYXZTQWc2ZEk5akNJSlc2eDJ6dWw2eGg4b1hZNVlsZHVrbGRQZjFJOWJ0UXBuY3ppSVpsTzFLcG1CbkxFaVJCZm5jVHRqNzhSc29sbG5FQmNZVGVtMHlkYmtteTk2a1hiM3N0cjlmUUhWbnhCTTlBNA?oc=5,"Wed, 23 Apr 2025 07:00:00 GMT",Seeking Alpha,,"(""Bank of New York Mellon"" OR ""BNY"") -gossip -celebrity -""fantasy sports"" -""game recap""",2025-04-23,BNY,2026-01-26T17:14:55.273239-05:00,https://seekingalpha.com/article/4777365-dhf-risks-too-great-for-a-contrarian-purchase,
6,9d81371f8fc6ff1a3ab4be0e3ba8daa5a0bcaa846c34da78ccb77e75e0344eda,"Orlando leads nation in job growth, outpacing other major US regions - The Business Journals",https://news.google.com/rss/articles/CBMijgFBVV95cUxNSkx0dG9iX2RraUlpYnRoTXU4SUtYdzhpdnNKTHljUGo1UWZKTW1NMEZHbVdSSUZCc0M5MFQxdUdzQzkyeFBuOWVXXzJod2RNak1vRWpLby0yTkpmYnpNTTRsUFpiSE9BaVc5YnhkYlA5NEM5aDBLLXowdmJYaWkwU1d5VG9fMXRhbVhxVlB3?oc=5,"Wed, 23 Apr 2025 07:00:00 GMT",The Business Journals,,"(""Bank of New York Mellon"" OR ""BNY"") -gossip -celebrity -""fantasy sports"" -""game recap""",2025-04-23,BNY,2026-01-26T17:14:55.273239-05:00,https://www.bizjournals.com/orlando/news/2025/04/23/job-growth-gains-lead-nation.html,
7,cb4e57779296c57a6d4dfa17bbd653050268b6288ee57c0fffba6177f6e756a8,"Can Trump Fire Powell? He Says He Won’t, But His Fed Battle May Not Be Over. - The New York Times",https://news.google.com/rss/articles/CBMigAFBVV95cUxNa2xRVU5KTU1jVVZTeUw0aGIwLWdYSzJNQWNiSkNyY2dsWk15Ri1iTUJkSFp2LV9yUGNTNjdpN2lmTnRpVW9qWEthcC1ET2ozaVJDMm00NWI4aDdRdGVObmNyWlZXa21FSk4tLXoxcG1ENEpuSzZhMjZ0RzBIZjBSQw?oc=5,"Wed, 23 Apr 2025 07:00:00 GMT",The New York Times,,"(""Bank of New York Mellon"" OR ""BNY"") -gossip -celebrity -""fantasy sports"" -""game recap""",2025-04-23,BNY,2026-01-26T17:14:55.273239-05:00,https://www.nytimes.com/2025/04/23/us/politics/trump-jerome-powell-fed.html,
8,9188091c77e7c03035996b4b65ce1d6d9520806c93a13db049e25aea74202d11,"Charles A. Johnson, 39, formerly of Northborough | Obituaries - communityadvocate.com",https://news.google.com/rss/articles/CBMi1wFBVV95cUxQcVlkazRiSFlVaW5VajhlY1EzQ1ZyU0hoUkJEUXZ4QUJEcjFrSjhNenh3NHZJNm5FbXBzODFEaDRsSUpsV0VxT25KR1JiX1pGaEtBVmtFN0VxZjFUV3VHRXFQRWxWTUFQWlgzRzk5RlJSdzFXcVRNUEFBY1V0TWY1NUZPMjRUdEZBS0hkZFJrN2kzc0c4T1NMNUJyZ2xLcWFkbVZpQ191U2l2MVhxYWdnY1ZFN2pTekxWRHR1YUhRaWhKU1pQZ1pOeGZHRUVGcUkyV3ktUmZIYw?oc=5,"Wed, 23 Apr 2025 07:00:00 GMT",communityadvocate.com,,"(""Bank of New York Mellon"" OR ""BNY"") -gossip -celebrity -""fantasy sports"" -""game recap""",2025-04-23,BNY,2026-01-26T17:14:55.273239-05:00,https://www.communityadvocate.com/obituaries/charles-a-johnson-39-formerly-of-northborough/article_f5134ee0-c126-43cc-88f2-1ae3a6e21c2e.html,
9,f373c30715808667597281520d496eb4af874c5d6005a79f89127d78b051e87f,JP Morgan picks up servicing mandate for Iceland’s Pension Fund of Commerce - Global Custodian,https://news.google.com/rss/articles/CBMitAFBVV95cUxOSkRPaEZuclJyVzIzQmxobS03SU9jbXZXRkdqNzVBcDB2UHJnU3dLTlJLLWZ5MmZDRXJ6QWVwdnlqX21iNEhtcE9TWGtLVWotSjduRW1HQjRLemdXYzNQeG1oalJORW1PazctMl9oSlhjaXhzSjF6MTloX243SWJwdGVEQTE5Z1hQT01aRVZoOFFoWXlJWHJ0XzlUanB3XzJuREZIZEdaYlJ3ajZzaWE2RW1kTDU?oc=5,"Wed, 23 Apr 2025 07:00:00 GMT",Global Custodian,"Login Custodian will provide global custody, fund accounting, FX, performance, risk and compliance reporting services across LV’s securities portfolio.","(""Bank of New York Mellon"" OR ""BNY"") -gossip -celebrity -""fantasy sports"" -""game recap""",2025-04-23,BNY,2026-01-26T17:14:55.273239-05:00,https://www.globalcustodian.com/jp-morgan-picks-up-10-5bn-servicing-mandate-for-icelands-pension-fund-of-commerce/,"Continue reading
This premium content is available to our digital subscribers, become a subscriber.
Already a subscriber? Login
Custodian will provide global custody, fund accounting, FX, performance, risk and compliance reporting services across LV’s securities portfolio.
This premium content is available to our digital subscribers, become a subscriber.
« Macro environment not impacting new business wins, say BNY and State Street CEOs"
