,id,title,link,published,source,summary,query,target_date,ticker,fetched_at,actual_link,full_text
8,24aa338bb614252baebc41b830d30d79cbf71cc0513e2f2be58e0382e2a4b485,Carnegie Science Center’s new Fab Lab lets you unleash your creativity - nextpittsburgh.com,https://news.google.com/rss/articles/CBMiqgFBVV95cUxOSXFjdXUxSHRhVDVOTlVtZHhZV0dMdkhneUV6ZXNGUzJDMFVaTmNZWjQySll0OE1mbjBfZzdlUnBmNXJsM2VYRHFYbHc0dGFhOGR1RFB4Vm9GcVB5NklNbmRES08tMVFvb3dFUGo5ZGxjcGhXM3prYWlzSDRTeTlmd19nN1lsT2prMEdTMkhOeHpSX3l6UjhZNmFjN2EyT09pX281U21Ubk55dw?oc=5,"Wed, 16 Apr 2025 07:00:00 GMT",nextpittsburgh.com,"Ray Selva and Julie Prosek designed a metal tag in the Carnegie Science Center’s 21+ Night in the third-floor BNY Fab Lab in a computer terminal, etching it into a small metal round, with laser cutters, 3D printers, CNC (Computer Numerical Control) routers, desktop computers, laptops, and laptops for overflowing designers, with a $1 million donation from BNY.","(""Bank of New York Mellon"" OR ""BNY"") -gossip -celebrity -""fantasy sports"" -""game recap""",2025-04-15,BNY,2026-01-26T17:14:50.560650-05:00,https://nextpittsburgh.com/business-tech-news/carnegie-science-center-new-fab-lab-unleash-your-creativity/,"Ray Selva and his girlfriend Julie Prosek are both animal lovers. A foster parent and shelter worker, respectively, the pair attended the Carnegie Science Center’s Paws and Claws 21+ Night on Friday, April 11, to meet local animals in need of homes.
But by a little after 7 p.m., they’d traded barks and meows for mechanical whirs. Standing at a computer terminal, they designed a metal tag fit for a collar. With the push of a few buttons, the laser engraver to their left came to life, etching a design into a small metal round.
“It was faster than I imagined it was going to take,” Selva says.
“I’ve never etched before in my life — the guy had to repeat to us six or seven times how to do it. At 67 years old, I figure a few more dozen times, I would’ve been a pro at it.”
Selva and Prosek designed their tag in the science center’s new BNY Fab Lab in the third-floor space that was previously home to the Kitchen Theater.
The design and fabrication space houses laser cutters, 3D printers, CNC (Computer Numerical Control) routers, desktop computers and even laptops for an overflow of designers. Renovations and the almost entirely new equipment were funded through a $1 million donation from financial services company BNY.
The Paws and Claws event was the first time the Fab Lab was open for a 21+ Night following its March 28, unveiling.
Even though the makerspace has been part of the science center’s programming for almost 10 years, you wouldn’t be alone if you haven’t stumbled upon it. Director Jason Brown calls its previous home in SportsWorks classrooms “off the beaten path.”
“While it was a great place for workshops that you could sign up for in advance and be directed to, it wasn’t the kind of place that was conducive to … popping in,” he says. “Its new location is right on the ramps. It’s behind a giant glass wall that can slide completely open, so everyone who walks on the ramps will pass right by it.”
Access to the Fab Lab is included in regular science center admission with no registration required. Courses and workshops do require additional tickets, which can be purchased through the science center’s website.
Brown wants patrons of all ages to pop in, digitally create their ideas and test out their designs — the same principles as a real manufacturing process called “rapid prototyping.”
“Before there were Fab Labs, and before there were things like 3D printers and laser cutters, if someone had a dream for an idea, they would have to design it and then probably draw it out and manually create it,” Brown says.
“The amazing thing about a Fab Lab is that you’ve already got the design created, so if it doesn’t work, you can make a quick tweak … and then, with the laser cutter, I can cut those things out in 15 seconds.”
In concept, the science center’s Fab Lab is not unique. When it originally opened in 2015, it was with grant support from the Fab Foundation — a nonprofit that supports the creation of Fab Labs nationwide. But Brown says the science center received a bunch of equipment with little guidance on teaching curriculum or methodology to use alongside it.
“That,” he says, “is what that team has really done: They built an entire philosophy around the equipment.”
“There are many makerspaces — many schools and community centers have makerspaces — but what sets ours apart is that it’s not about coming in and … downloading a design and then printing it. It’s about doing it yourself. How do I use this technology to answer questions that I have? Solve problems that I have?”
Like Selva and Prosek, Cianna Kisailus and her mother Holly also attended Paws and Claws night for the animals, but found themselves etching tags.
“A cat that we had passed away … from cancer, so we both made tags for her to put on a chain from us,” Holly says.
Cianna swiftly moved through heart-shaped designs for their late cat Oreo, a green bone with a pawprint for Holly’s dog Bandit and a circular tag for her current cat.
“Her name’s Zoe,” Cianna interjects. “She’s not little — she’s a chunky tabby, but she’s a good girl.”
The mother and daughter had both had brief encounters with 3D printing in the past, but never laser cutters. Still, Holly left the designing to her daughter.
“She’s the tech person,” she says.
“I picked up on it really quickly,” Cianna says. “There weren’t too many choices where you got flustered.”
“But now they’re done and they’re beautiful.”"
9,a9052336e2c2d8f8c23956061212964150db26cd654ab02d802609bed5eb8fec,How eToro’s Stock Lending Feature Will Unlock Passive Income - FinTech Magazine,https://news.google.com/rss/articles/CBMitAFBVV95cUxPLVpDc2FwdWU3Mkcxc0RyeVIzY19MX3dueVA3bURLS2s2ZW9BQXY1eEZwY1NaYktjNlg0cHZ6TGJ5RXZmOUVWUDJJWGRyblVJblVjR21ldlRHeGFqWnllcjhYQTlLV0xqMlZ3TkVCT3BhS3FnSTFWYWsyNmVlY293b1JDNjVySnhuSGc0aUc1MVNad2hiX2Q4TGU1S2hrVks0NE9PbjgtZlBOTFB5dGE5TVhMZTU?oc=5,"Tue, 15 Apr 2025 07:00:00 GMT",FinTech Magazine,,"(""Bank of New York Mellon"" OR ""BNY"") -gossip -celebrity -""fantasy sports"" -""game recap""",2025-04-15,BNY,2026-01-26T17:14:50.560650-05:00,https://fintechmagazine.com/financial-services-finserv/how-etoros-stock-lending-feature-will-unlock-passive-income,
10,a2d7ce2f73aafdaa5660cecefdd95056238f4addcee234e07f408479b3971f6d,"USD: Weak Dollar Is a Buy for Long-Horizon Investors, BNY Says - Bloomberg.com",https://news.google.com/rss/articles/CBMiqwFBVV95cUxNX0d0V2hlS2FfLUlNb25QUWhqd1l2b3JDZXdZMmQwZlFrMVc3NkdRYmEzMnlRXzlCajVVdTBPUzM4MVdrQ09jWkgzMVJDbzIzR3o5cUVIN3J6NS1IS2steFNpbXJnUlk3T1V6ZFU5cEw0WjkxU0xoblUxcDJEdng3X0VJV0kydU5Bc25uUC1Oa2FhVXh6VEVxbUR6bVB5cW5rSjNLMlhBVDZCY28?oc=5,"Wed, 16 Apr 2025 07:00:00 GMT",Bloomberg.com,,"(""Bank of New York Mellon"" OR ""BNY"") -gossip -celebrity -""fantasy sports"" -""game recap""",2025-04-15,BNY,2026-01-26T17:14:50.560650-05:00,https://www.bloomberg.com/news/articles/2025-04-16/weak-dollar-is-a-buy-for-long-horizon-investors-bny-says,
11,b84d6844b58744d6fd998f72e057f72778ad9e25a0ac3a57bbf2f9a82e1cb286,Is Weak Consumer Sentiment a Contrarian Signal? - BNY,https://news.google.com/rss/articles/CBMilwFBVV95cUxPeDZhczhVazRuRUJFX0xmakNRNGVxR3NJMF9vbHpNNE56LXZ5ZzFHMUVTeXZ3MUJWWHQ2clFKMU5sUkxQM245NE1FelVzajlMYUYzOGxZcC1ONTVxWjlEOW9YNzJ5eG1SR2lzMWpKazNWUW95U2I3RlluM3BLUHZ4d3U2VG5HZE55RlpvdUM4cXhhc3Y1ZWh3?oc=5,"Wed, 16 Apr 2025 07:00:00 GMT",BNY,"The Bank of New York Mellon, DIFC Branch (Authorized Firm), is a wholly owned subsidiary of the Bank of NY Mellan Corporation, regulated by the Dubai Financial Services Authority, located at 240 Greenwich Street, New York, NY, 10286, USA.","(""Bank of New York Mellon"" OR ""BNY"") -gossip -celebrity -""fantasy sports"" -""game recap""",2025-04-15,BNY,2026-01-26T17:14:50.560650-05:00,https://www.bny.com/wealth/global/en/insights/chart-of-the-week/weak-consumer-sentiment.html,"This material is provided for illustrative/educational purposes only. This material is not intended to constitute legal, tax, investment or financial advice. Effort has been made to ensure that the material presented herein is accurate at the time of publication. However, this material is not intended to be a full and exhaustive explanation of the law in any area or of all of the tax, investment or financial options available. The information discussed herein may not be applicable to or appropriate for every investor and should be used only after consultation with professionals who have reviewed your specific situation.
The Bank of New York Mellon, DIFC Branch (the “Authorized Firm”) is communicating these materials on behalf of The Bank of New York Mellon. The Bank of New York Mellon is a wholly owned subsidiary of The Bank of New York Mellon Corporation. This material is intended for Professional Clients only and no other person should act upon it. The Authorized Firm is regulated by the Dubai Financial Services Authority and is located at Dubai International Financial Centre, The Exchange Building 5 North, Level 6, Room 601, P.O. Box 506723, Dubai, UAE.
The Bank of New York Mellon is supervised and regulated by the New York State Department of Financial Services and the Federal Reserve and authorized by the Prudential Regulation Authority. The Bank of New York Mellon London Branch is subject to regulation by the Financial Conduct Authority and limited regulation by the Prudential Regulation Authority. Details about the extent of our regulation by the Prudential Regulation Authority are available from us on request. The Bank of New York Mellon is incorporated with limited liability in the State of New York, USA. Head Office: 240 Greenwich Street, New York, NY, 10286, USA.
In the U.K. a number of the services associated with BNY Wealth’s Family Office Services– International are provided through The Bank of New York Mellon, London Branch, One Canada Square, London, E14 5AL. The London Branch is registered in England and Wales with FC No. 005522 and BR000818.
Investment management services are offered through BNY Mellon Investment Management EMEA Limited, BNY Mellon Centre, One Canada Square, London E14 5AL, which is registered in England No. 1118580 and is authorized and regulated by the Financial Conduct Authority. Offshore trust and administration services are through BNY Trust Company (Cayman) Ltd.
This document is issued in the U.K. by The Bank of New York Mellon. In the United States the information provided within this document is for use by professional investors.
This material is a financial promotion in the UK and EMEA. This material, and the statements contained herein, are not an offer or solicitation to buy or sell any products (including financial products) or services or to participate in any particular strategy mentioned and should not be construed as such.
BNY Mellon Fund Services (Ireland) Limited is regulated by the Central Bank of Ireland BNY Mellon Investment Servicing (International) Limited is regulated by the Central Bank of Ireland.
Trademarks and logos belong to their respective owners.
BNY Wealth conducts business through various operating subsidiaries of The Bank of New York Mellon Corporation. BNY is the corporate name of The Bank of New York Mellon Corporation and may be used to reference the corporation as a whole and/or its various subsidiaries generally.
©2025 The Bank of New York Mellon. All rights reserved. WI-722611-2025-04-16"
