,id,title,link,published,source,summary,query,target_date,ticker,fetched_at,actual_link,full_text
6,9d81371f8fc6ff1a3ab4be0e3ba8daa5a0bcaa846c34da78ccb77e75e0344eda,"Orlando leads nation in job growth, outpacing other major US regions - The Business Journals",https://news.google.com/rss/articles/CBMijgFBVV95cUxNSkx0dG9iX2RraUlpYnRoTXU4SUtYdzhpdnNKTHljUGo1UWZKTW1NMEZHbVdSSUZCc0M5MFQxdUdzQzkyeFBuOWVXXzJod2RNak1vRWpLby0yTkpmYnpNTTRsUFpiSE9BaVc5YnhkYlA5NEM5aDBLLXowdmJYaWkwU1d5VG9fMXRhbVhxVlB3?oc=5,"Wed, 23 Apr 2025 07:00:00 GMT",The Business Journals,,"(""Bank of New York Mellon"" OR ""BNY"") -gossip -celebrity -""fantasy sports"" -""game recap""",2025-04-22,BNY,2026-01-26T17:14:54.666120-05:00,https://www.bizjournals.com/orlando/news/2025/04/23/job-growth-gains-lead-nation.html,
7,f373c30715808667597281520d496eb4af874c5d6005a79f89127d78b051e87f,JP Morgan picks up servicing mandate for Iceland’s Pension Fund of Commerce - Global Custodian,https://news.google.com/rss/articles/CBMitAFBVV95cUxOSkRPaEZuclJyVzIzQmxobS03SU9jbXZXRkdqNzVBcDB2UHJnU3dLTlJLLWZ5MmZDRXJ6QWVwdnlqX21iNEhtcE9TWGtLVWotSjduRW1HQjRLemdXYzNQeG1oalJORW1PazctMl9oSlhjaXhzSjF6MTloX243SWJwdGVEQTE5Z1hQT01aRVZoOFFoWXlJWHJ0XzlUanB3XzJuREZIZEdaYlJ3ajZzaWE2RW1kTDU?oc=5,"Wed, 23 Apr 2025 07:00:00 GMT",Global Custodian,"Login Custodian will provide global custody, fund accounting, FX, performance, risk and compliance reporting services across LV’s securities portfolio.","(""Bank of New York Mellon"" OR ""BNY"") -gossip -celebrity -""fantasy sports"" -""game recap""",2025-04-22,BNY,2026-01-26T17:14:54.666120-05:00,https://www.globalcustodian.com/jp-morgan-picks-up-10-5bn-servicing-mandate-for-icelands-pension-fund-of-commerce/,"Continue reading
This premium content is available to our digital subscribers, become a subscriber.
Already a subscriber? Login
Custodian will provide global custody, fund accounting, FX, performance, risk and compliance reporting services across LV’s securities portfolio.
This premium content is available to our digital subscribers, become a subscriber.
« Macro environment not impacting new business wins, say BNY and State Street CEOs"
8,9188091c77e7c03035996b4b65ce1d6d9520806c93a13db049e25aea74202d11,"Charles A. Johnson, 39, formerly of Northborough | Obituaries - communityadvocate.com",https://news.google.com/rss/articles/CBMi1wFBVV95cUxQcVlkazRiSFlVaW5VajhlY1EzQ1ZyU0hoUkJEUXZ4QUJEcjFrSjhNenh3NHZJNm5FbXBzODFEaDRsSUpsV0VxT25KR1JiX1pGaEtBVmtFN0VxZjFUV3VHRXFQRWxWTUFQWlgzRzk5RlJSdzFXcVRNUEFBY1V0TWY1NUZPMjRUdEZBS0hkZFJrN2kzc0c4T1NMNUJyZ2xLcWFkbVZpQ191U2l2MVhxYWdnY1ZFN2pTekxWRHR1YUhRaWhKU1pQZ1pOeGZHRUVGcUkyV3ktUmZIYw?oc=5,"Wed, 23 Apr 2025 07:00:00 GMT",communityadvocate.com,,"(""Bank of New York Mellon"" OR ""BNY"") -gossip -celebrity -""fantasy sports"" -""game recap""",2025-04-22,BNY,2026-01-26T17:14:54.666120-05:00,https://www.communityadvocate.com/obituaries/charles-a-johnson-39-formerly-of-northborough/article_f5134ee0-c126-43cc-88f2-1ae3a6e21c2e.html,
