id,title,link,gt_content_type,gt_event_number,actual_link,full_text,article_published_raw,article_published_utc,found_via,published_utc,url,us_2yr_yield,us_10yr_yield,us_30yr_yield,real_yield_10yr,breakeven_5yr,breakeven_10yr,yield_curve_2s10s,us_de_2yr_spread,cpi_yoy,core_cpi_yoy,pce_yoy,core_pce_yoy,pce_gap,unemployment_rate,nfp_3m_avg,jolts_openings,initial_claims_4wma,sahm_indicator,retail_sales_mom,gdp_qoq,ig_oas,hy_oas,hy_ig_spread,fed_funds_rate,regime_flag,months_since_last_change,vix,vix_regime,vix_20d_change,sp500_20d_return,gold_20d_return,wti_20d_return,copper_3m_return,dxy_zscore_52w_broad,dxy_pct_above_200d_broad,dxy_20d_return_broad,cftc_net_usd_zscore,Open_15m,pct_15m,sd_15m,true_criticality,true_direction
237,CNBC Daily Open renewed inflation worries jolt markets after ISM January 2025,https://www.cnbc.com/2025/01/08/cnbc-daily-open-renewed-inflation-worries-jolt-markets.html,analysis,17,https://www.cnbc.com/2025/01/08/cnbc-daily-open-renewed-inflation-worries-jolt-markets.html,"This report is from today's CNBC Daily Open, our international markets newsletter. CNBC Daily Open brings investors up to speed on everything they need to know, no matter where they are. Like what you see? You can subscribe here.
What you need to know today
Inflation fears drag down U.S. markets
U.S. stocks fell and Treasury yields rose on Tuesday as the ISM services index shows a big jump in prices for December. Asia-Pacific markets traded mixed on Wednesday. South Korea's Kospi rose 1.3%. It was boosted by shares of Samsung Electronics, which climbed around 3.6% even as the company forecast that its fourth-quarter profits would come in lower than LSEG expectations.
Meta ends fact-checking program
Meta on Tuesday announced it will eliminate its third-party fact-checking program to ""restore free expression"" and move to a ""Community Notes"" model, similar to the system on Elon Musk's platform X. Employees took to their internal forum and criticized the company's decision, made two weeks before U.S. President-elect Donald Trump's inauguration.
Anthropic's potential $60 billion valuation
Anthropic, the artificial intelligence startup founded by former OpenAI research executives, is in late-stage talks to raise as much as $2 billion at a $60 billion valuation, CNBC has confirmed. The funding round is being led by Lightspeed Venture Partners, according to a person familiar with the matter. Anthropic, which has been backed heavily by Amazon, is the creator of the AI chatbot Claude.
India might benefit from Trump, portfolio manager says
U.S. President-elect's Donald Trump's plans to impose heavy tariffs on China make India's geopolitical positioning ""favorable in this Trump 2.0 era,"" according to GIB Asset Management's portfolio manager Kunal Desai. India is an attractive investment destination because of its monetary sovereignty and improving return on equity, Desai said.
[PRO] Cautionary signs in stock market
Howard Marks, the co-founder and co-chairman of Oaktree Capital Management who famously foresaw the dot-com bubble, is seeing five cautionary signs in the stock market. While Marks isn't calling it a bubble, he's concerned over signs of froth in equities. Here's what investors should pay attention to, according to Marks.
The bottom line
In a sign of how much investors are currently worried about inflation returning, the Institute for Supply Management's services index, an inflation reading typically secondary to more significant data points like the consumer price index, is sending shock waves through the market.
The price index for December's ISM report jumped to 64.4% from 58.2% in November, representing a rise of more than 10%. It's the first time since January 2024 the reading has come in above 60%, noted Steve Miller, chair of ISM's Business Survey Committee.
That might only be the start of an unwelcome upward trend. Miller attributes some of the expansion in service activity to ""risk management for impacts from ports strikes and potential tariffs"" — both of which generate inflationary pressures.
In response, investors pushed up the 10-year Treasury yield to 4.699% during the U.S. trading day, the highest level since April 26. They also dialed down their expectations for a 25 basis points rate cut at the U.S. Federal Reserve's January meeting, pricing in a 4.8% chance of that happening, down from an 8.6% probability just a day ago, according to CME Group's FedWatch tool.
Stocks suffered. The S&P 500 dropped 1.11%, the Dow Jones Industrial Average declined 0.42% and the Nasdaq Composite slid 1.89%, dragged down by a fall in tech stocks. Nvidia slumped 6.2%, breaking its three-day winning streak.
""You're getting a recalibration of inflation expectations and Fed rate expectations. That's triggered this small sell-off in the equity markets after the earlier enthusiasm,"" said Tom Hainlin, senior investment strategist at U.S. Bank Asset Management Group.
But the strong ISM report also suggests the U.S. economy's still doing well, which provides fertile ground for profit growth, said Hainlin. And as David Lefkowitz, CIO head of US equities for UBS, wrote in a Monday note, ""profit growth matters more"" than valuation for returns over the next 12 months.
One data point from one measure of inflation doesn't chart out the path of inflation or corporate health for the year ahead. But it pays to tread carefully for now.
— CNBC's Jeff Cox, Sean Conlon, Pia Singh and Lisa Kailai Han contributed to this report.",2025-01-08T07:30:02+0000,2025-01-08 07:30:02+00:00,meta_article,2025-01-08 07:30:02+00:00,https://www.cnbc.com/2025/01/08/cnbc-daily-open-renewed-inflation-worries-jolt-markets.html,4.28,4.67,4.91,2.27,2.47,2.4,0.3899999999999997,1.7963636363636404,2.9909783078999608,3.282970485398584,2.607379530393517,2.7801380994415092,0.7801380994415092,4.0,107.66666666666669,7431.0,214750.0,0.1,-1.0564360082546131,-0.6,0.83,2.84,2.01,4.33,,0,17.7,medium,-6.390000000000001,0.872154461844743,,5.549215406562058,-1.0913363360916528,2.253777781045605,3.766623065769137,0.3435258705531741,0.0,98.71,-0.0202572672946523,0.0204219614473624,not high,down
238,Dollar rebounds as Feds Williams talks down rate cuts December 2023,https://www.cnbc.com/2023/12/15/dollar-feels-the-heat-as-feds-dovish-pivot-weighs.html,hard_news,31,https://www.cnbc.com/2023/12/15/dollar-feels-the-heat-as-feds-dovish-pivot-weighs.html,"The dollar bounced on Friday after Federal Reserve Bank of New York President John Williams pushed back against the market's rate cut expectations, though the index remained on track for its worst weekly performance in a month.
The dollar tumbled broadly after updated interest rate projections of Fed officials released on Wednesday showed an expectation for 75 basis points in cuts in 2024.
Fed Chairman Jerome Powell was also interpreted as striking a more dovish tone at the conclusion of the U.S. central bank's two day meeting, when he said that the tightening of monetary policy is likely over, with a discussion of cuts coming ""into view.""
But Williams said on Friday that ""we aren't really talking about rate cuts right now"" at the Fed and it's ""premature"" to speculate about them.
""It strikes some of the similar tones that we heard from Powell earlier this week but it kind of reinforces the fact that the Fed is still very much a data dependent bank and not really endorsing what the market's pricing in to a degree,"" said Bipan Rai, North American head of FX strategy at CIBC Capital Markets in Toronto.
Rai also noted that a large part of the move in the dollar this week has been due to rebalancing positions that were heavily tilted towards the greenback and focused in specific currency pairs, such as against the Japanese yen.
""This is a story about the inordinate amount of leverage and skewed positioning in the market that needed to be rebalanced more than any sort of dovish interpretation of what Powell said earlier this week,"" he said.
Traders are pricing in aggressive expectations for rate cuts, with the first reduction seen likely in March and 145 basis points in cuts seen by December.
The dollar index was last up 0.64% on the day at 102.61. It fell to 101.76 on Thursday, the lowest since Aug. 10.
The euro fell 0.90% to $1.0892. It reached $1.1009 on Thursday, the highest since Nov. 29. Sterling dropped 0.73% to $1.2673, after reaching $1.2793 on Thursday, the highest since Aug. 22.
The euro and sterling were also supported by the European Central Bank (ECB) and Bank of England on Thursday pushing back against rate cuts.
Investors are nonetheless still betting heavily on rate cuts from both central banks next year.
The ECB has more scope than most to ease, according to Pepperstone strategist Chris Weston, given low euro zone growth and a rapid decline in inflation.
""However, the pushback from (ECB President) Lagarde and co suggests conjecture on the timing of initial easing – perhaps this is a function that it's desirable to keep one's currency strong to limit imported inflation.""
The euro was also dented by closely watched surveys on Friday showing that the downturn in euro zone business activity surprisingly deepened in December.
The Bank of Japan is the last of the major central banks to meet this month and the question among traders and investors is whether or not it will signal its intention to ditch its policy of keeping interest rates at rock bottom next week.
The dollar was last up 0.27% at 141.25 yen, after dropping to 140.95 on Thursday, the lowest since July 31.",2023-12-15T02:20:20+0000,2023-12-15 02:20:20+00:00,meta_article,2023-12-15 02:20:20+00:00,https://www.cnbc.com/2023/12/15/dollar-feels-the-heat-as-feds-dovish-pivot-weighs.html,4.44,3.91,4.0,1.69,2.17,2.22,-0.5300000000000002,2.3378947368421104,3.3159099427102934,3.915472769862705,2.767265846736034,3.1123879882344996,1.1123879882344996,3.8,146.66666666666666,8520.0,211000.0,0.3999999999999999,0.0,3.4,1.04,3.51,2.47,5.33,1.0,0,12.28,low,-0.1800000000000015,3.505989902047224,,-5.051449953227316,5.874872911381379,-0.3545961718745429,-0.6953771008548104,-0.3928941315442413,0.0,101.94,-0.0196155355041153,0.0439304659862657,not high,down
239,"July jobs: Only 114,000 payrolls, unemployment 4.3%",https://www.cnbc.com/2024/08/02/job-growth-totals-114000-in-july-much-less-than-expected-as-unemployment-rate-rises-to-4point3percent.html,hard_news,12,https://www.cnbc.com/2024/08/02/job-growth-totals-114000-in-july-much-less-than-expected-as-unemployment-rate-rises-to-4point3percent.html,"Job growth in the U.S. slowed much more than expected during July and the unemployment rate ticked higher, fueling fears of a broader economic slowdown, the Labor Department reported Friday.
Nonfarm payrolls grew by just 114,000 for the month, down from the downwardly revised 179,000 in June and below the Dow Jones estimate for 185,000. The unemployment rate edged higher to 4.3%, its highest since October 2021.
Average hourly earnings, a closely watched inflation barometer, increased 0.2% for the month and 3.6% from a year ago. Both figures were below respective forecasts for 0.3% and 3.7%.
Stock market futures added to losses following the report while Treasury yields plunged.
The labor market had been a pillar of economic strength but has recently shown some trouble signs, and the July payrolls increase was well below the average of 215,000 over the past 12 months.
""Temperatures might be hot around the country, but there's no summer heatwave for the job market,"" said Becky Frankiewicz, president of the ManpowerGroup employment agency. ""With across-the-board cooling, we have lost most of the gains we saw from the first quarter of the year.""
From a sector standpoint, health care again led in job creation, adding 55,000 to payrolls. Other notable gainers included construction (25,000), government (17,000), and transportation and warehousing (14,000). Leisure and hospitality, another leading gainer over the past few years, added 23,000.
The information services sector posted a loss of 20,000.
While the survey of establishments used for the headline payrolls number was discouraging, the household survey was even more so, with growth of just 67,000, while the ranks of the unemployed swelled by 352,000. The participation rate as a share of the working-age population edged higher to 62.7%.
The report adds to mixed signals recently about the economy and with financial markets on edge about how the Federal Reserve will respond.
Though markets on Wednesday cheered indications from the Fed that an interest rate cut could come as soon as September, that quickly turned to trepidation when economic data Thursday showed an unexpected jump in filings for unemployment benefits and a further weakening of the manufacturing sector.
That triggered the worst sell-off of the year on Wall Street and renewed fears that the Fed may be waiting too long to start cutting interest rates. Easing wage gains could help policymakers feel more confident that inflation is progressing back to their 2% goal.
The rise in the unemployment rate brings into play the so-called Sahm Rule, which states that the economy is in recession when the three-month average of the jobless level is half a percentage point higher than the 12-month low. In this case, the unemployment rate was 3.5% in July 2023 before it began its gradual ascent. The three-month unemployment rate average moved up to 4.13%.
""The latest snapshot of the labor market is consistent with a slowdown, not necessarily a recession,"" said Jeffrey Roach, chief economist at LPL Financial. ""However, early warning signs suggest further weakness.""
Roach pointed out that the ranks of those working part-time for economic reasons jumped to 4.57 million, an increase of 346,000 to the highest level since June 2021.
An alternate measure of unemployment that includes discouraged workers and those holding part-time jobs for economic reasons surged 0.4 percentage point to 7.8%, the highest since October 2021.
Long-term unemployment also ticked higher. Those reporting being out of work for 27 weeks or more totaled 1.54 million, the most since February 2022.
Wall Street had been bracing for modest gains from the July payrolls report, in part over concerns about growth but also from residual impacts from Hurricane Beryl. The storm badly damaged parts of Texas including the Houston metropolitan area.
Despite some anxiety over the state of economic growth, Fed Chair Jerome Powell on Wednesday expressed confidence about the ""solid"" economy and said easing inflation data is raising confidence that the central bank can cut soon.
Markets have fully priced in a rate cut of at least a quarter percentage point at each of the three remaining Fed meetings this year. Odds are rising that the Fed even may go beyond traditional quarter point reductions.
""While the labor market has remained remarkably resilient over these past two years of elevated interest rates, it's important for the Federal Reserve to stay ahead of any further labor market slowing by proceeding with its expected September rate cut,"" said Clark Bellin, chief investment officer at Bellwether Wealth.
Correction: The forecast for average hourly earnings was for an increase of 0.3% for the month. An earlier version misstated the percentage.",2024-08-02T12:31:26+0000,2024-08-02 12:31:26+00:00,meta_article,2024-08-02 12:31:26+00:00,https://www.cnbc.com/2024/08/02/job-growth-totals-114000-in-july-much-less-than-expected-as-unemployment-rate-rises-to-4point3percent.html,3.88,3.8,4.11,1.76,1.89,2.04,-0.08,1.67227272727273,2.607144490692037,3.2850959364300047,2.412994957427461,2.873279917118543,0.873279917118543,4.2,49.666666666666664,7520.0,237250.0,0.5,0.0,3.3,1.06,3.72,2.66,5.33,1.0,0,23.39,medium,10.93,-4.786700739936068,,-10.180859983231528,-11.228895860279486,1.2731562327907529,1.174523428662444,0.8393471435898636,0.0,103.61,-0.0192994306667914,0.0269920018392434,not high,down
241,Unemployment rate rose to 4.1 percent in June 2024,https://www.cnbc.com/2024/07/05/jobs-report-june-2024.html,hard_news,12,https://www.cnbc.com/2024/07/05/jobs-report-june-2024.html,"The U.S. economy again added slightly more jobs than expected in June though the unemployment rate increased, the Labor Department reported Friday.
Nonfarm payrolls increased by 206,000 for the month, better than the 200,000 Dow Jones forecast though less than the downwardly revised gain of 218,000 in May, which was cut sharply from the initial estimate of 272,000.
The unemployment rate unexpectedly climbed to 4.1%, tied for the highest level since October 2021 and providing a conflicting sign for Federal Reserve officials weighing their next move on monetary policy. The forecast had been for the jobless rate to hold steady at 4%.
""It's a soft landing kind of report,"" Jan Hatzius, chief economist at Goldman Sachs, said on CNBC's ""Squawk on the Street."" ""This does support the idea that [the Fed] will cut relatively soon, and we continue to think September is the most likely.""
The increase in the unemployment rate came as the labor force participation rate, which indicates the level of working-age people who are employed or actively searching for a job, rose to 62.6%, up 0.1 percentage point. The so-called prime age rate, which focuses on those between ages 25 and 54, rose to 83.7%, its highest in more than 22 years.
A broader unemployment rate which counts discouraged workers and those holding part-time jobs for economic reasons held steady at 7.4%. Household employment, which is used to calculate the unemployment rate, rose by 116,000. The household survey also showed a decrease of 28,000, in full-time workers and an increase of 50,000 in part-time workers.
Though June job creation topped expectations, it was due in large part to a 70,000 surge in government jobs. Also, health care, a consistent leader by sector, added 49,000 while social assistance contributed 34,000 and construction was up 27,000.
Several sectors saw declines, including professional and business services (-17.000) and retail (-9,000).
On wages, average hourly earnings increased 0.3% for the month and 3.9% from a year ago, both in line with estimates. The average work week was steady at 34.3 hours.
Stock market futures nudged higher following the report while Treasury yields were negative. Traders also increased their bets that the Fed would implement its initial interest rate cut in September.
""The job market is bending without yet breaking, which boosts the argument for rate cuts,"" said David Russell, global head of market strategy at TradeStation. ""Things are not too hot and not too cold. Goldilocks is here and September is in play"" for a Fed rate cut.
In addition to the substantial revision in the May payrolls count, the Bureau of Labor Statistics lowered April to just 108,000, a slide of 57,000 from the previous estimate. Combined, the revisions cut 111,000 from the April and May totals.
Long-term unemployment rose sharply on the month, up 166,000 to 1.5 million, compared with 1.1 million a year ago. The BLS said the share of long-term unemployed as a percentage of the total jobless level was 22.2%, compared with 18.8% a year ago.
The unemployment rate for Black workers moved up to 6.3%, its highest since March. The rate for Asians jumped a full percentage point to 4.1%, its highest since August 2021.
The report comes with Federal Reserve officials contemplating their next moves on monetary policy.
At their most recent meeting, policymakers indicated they need to see more progress on inflation before lowering interest rates, while noting that a strong economy and in particular a solid labor market lessen the urgency to act anytime soon, according to minutes released earlier this week.
Despite indications to the contrary, markets are pricing in two rate cuts, assuming quarter percentage point reductions, before the end of 2024. Fed officials at the June meeting penciled in just one cut, saying they need to see ""additional favorable data"" before moving forward with reductions.
""There are no cracks here that would cause the Fed to rush to the rescue with rate cuts, and the labor market is in line with a continuation of slowing inflation,"" said Robert Frick, corporate economist at Navy Federal Credit Union. ""That should lead to one or two cuts this year.""
The Fed targets its key lending rate in a range between 5.25%-5.50%, the highest in 23 years and a level at which it has sat for about a year.
There have been recent signs of cracks in the labor market, with purchasing manager surveys showing contraction in hiring for both the manufacturing and services sector.
Moreover, broader economic growth is slowing. Gross domestic product increased just 1.4% annualized in the first quarter and is on track to grow at just a 1.5% pace in the second quarter, according to the Atlanta Fed.",2024-07-05T12:31:35+0000,2024-07-05 12:31:35+00:00,meta_article,2024-07-05 12:31:35+00:00,https://www.cnbc.com/2024/07/05/jobs-report-june-2024.html,4.6,4.28,4.47,2.0,2.22,2.28,-0.3199999999999994,2.1417391304347797,2.941475793558302,3.2301916105644812,2.594376777467322,2.8062163337682744,0.8062163337682744,4.2,72.66666666666667,7426.0,236750.0,0.5,0.0,3.3,0.92,3.27,2.35,5.33,1.0,0,12.48,low,-0.1799999999999997,2.496317843729279,,6.334214834403729,-7.233751202648486,1.4617305536762055,1.6548369838412569,-0.5582695897700996,0.0,104.97,0.104901773793629,0.0209442617998278,high,up
