id,title,link,gt_content_type,gt_event_number,actual_link,full_text,article_published_raw,article_published_utc,found_via,published_utc,url,us_2yr_yield,us_10yr_yield,us_30yr_yield,real_yield_10yr,breakeven_5yr,breakeven_10yr,yield_curve_2s10s,us_de_2yr_spread,cpi_yoy,core_cpi_yoy,pce_yoy,core_pce_yoy,pce_gap,unemployment_rate,nfp_3m_avg,jolts_openings,initial_claims_4wma,sahm_indicator,retail_sales_mom,gdp_qoq,ig_oas,hy_oas,hy_ig_spread,fed_funds_rate,regime_flag,months_since_last_change,vix,vix_regime,vix_20d_change,sp500_20d_return,gold_20d_return,wti_20d_return,copper_3m_return,dxy_zscore_52w_broad,dxy_pct_above_200d_broad,dxy_20d_return_broad,cftc_net_usd_zscore,Open_15m,pct_15m,sd_15m,true_criticality,true_direction
g5h6i7j8,U.S. dollar jumps as Donald Trump recaptures the White House,https://www.cnbc.com/2024/11/05/us-dollar-is-little-changed-on-tuesday-night-as-presidential-election-winds-down.html,hard_news,26,https://www.cnbc.com/2024/11/05/us-dollar-is-little-changed-on-tuesday-night-as-presidential-election-winds-down.html,"The U.S. dollar strengthened against other major global currencies Wednesday as former president Donald Trump recaptured the White House, becoming just the second president in history to return to win two nonconsecutive White House terms.
The greenback strengthened by more than 1% against each of the Swiss franc and Chinese yuan, and nearly 2% against the Japanese yen. The ICE U.S. Dollar Index rose 1.66% and reached its highest level since July.
NBC News projects Trump's victory, making the 78-year-old the oldest person ever to win a U.S. presidential election. Traders generally expected that a strong election for Trump and Republicans in Congress could push the greenback higher. Trump's proposals to hike tariffs against major U.S. trading partners would, in theory, result in a stronger dollar.
""To the extent that he's able to get a lot of his stuff done — like deregulation, tax cuts, tariffs — you could see [the dollar index] easily above 110, maybe even up to 115,"" said Brad Bechtel, global head of foreign exchange at Jefferies.
The euro fell to 1.0731 against the dollar, hitting its lowest level since late June during the session. The dollar also hit its highest level against the Mexican peso since 2022 in overnight trading, but retreated from that mark as Wednesday progressed. Bechtel said the reversal in the peso trade could be due to short-term profit taking after the initial move.
NBC News projects that Trump has won key battleground states of North Carolina, Pennsylvania and Georgia, helping him reach the necessary 270 Electoral College votes to secure victory. NBC News also projects that the Republicans will retake the Senate.
The dollar had already strengthened in the runup to Election Day. The Dollar Index rose more than 3% in October, though it had dipped in early November.
The rally for the dollar could have ripple effects throughout global markets, said Adam Turnquist, chief technical strategist at LPL Financial.
""Continued strength in the dollar could weigh on international stocks, especially emerging markets, and most commodities,"" Turnquist said Wednesday.",2024-11-05T22:39:22+0000,2024-11-05 22:39:22+00:00,meta_article,2024-11-05 22:39:22+00:00,https://www.cnbc.com/2024/11/05/us-dollar-is-little-changed-on-tuesday-night-as-presidential-election-winds-down.html,4.19,4.26,4.44,1.99,2.32,2.27,0.0699999999999994,1.8842857142857103,2.719472461284833,3.2859356193500444,2.5878034125423,2.980710120125618,0.980710120125618,4.2,107.33333333333331,7566.0,227000.0,0.5,0.0,1.9,0.84,2.86,2.02,4.64,0.0,0,20.49,medium,0.91,-1.0219992571634973,,1.8176694377906255,-1.9807633856317897,1.675319883250088,1.3776461180108557,0.508136067816034,0.0,103.43,0.0,0.0282180247721804,not high,down
k9l0m1n2,Dow soars 1500 points to record high in best day since 2022 after Trump election win: Live updates,https://www.cnbc.com/amp/2024/11/05/stock-market-today-live-updates.html,hard_news,26,https://www.cnbc.com/amp/2024/11/05/stock-market-today-live-updates.html,"Stocks rallied sharply on Wednesday, with major benchmarks hitting record highs, as Donald Trump won the 2024 presidential election.
The Dow Jones Industrial Average surged 1,508.05 points, or 3.57%, to a record close of 43,729.93. The last time the blue-chip Dow jumped more than 1,000 points in a single day was in November 2022.
The S&P 500 also hit an all-time high, popping 2.53% to 5,929.04. The Nasdaq Composite climbed 2.95% to a record of its own of 18,983.47.
NBC News projects that Trump will defeat his Democratic rival, Kamala Harris, after winning at least 291 Electoral College votes, including key swing states of Pennsylvania, North Carolina and Georgia.
Investments seen as beneficiaries under a Trump presidency erupted as the former president appeared set for victory. Tesla, whose CEO Elon Musk is a prominent backer of Trump, saw shares surge more than 14%. Bank shares got a boost with JPMorgan Chase climbing 11.5% and Wells Fargo jumping 13%.
The small-cap benchmark Russell 2000 surged 5.84%, hitting a 52-week high. Small companies, which are more domestic-oriented and cyclical, are believed to enjoy outsized benefits from Trump's tax cuts and protectionist policies.
""Trump is viewed as supporting lower corporate tax rates, deregulation, and industrial policies that favor domestic growth, all of which could provide more stimulus to the U.S. economy and benefit risk assets. … During the 2016 election, the S&P 500 Index gained nearly 5% from the day before the presidential election through the end of the year in what became known as the Trump rally. We expect a similar trend could play out this time around, too,"" Marc Pinto, head of Americas equities at Janus Henderson Investors, said in a note.
Bitcoin, which could benefit from relaxed regulation, soared to an all-time high and topped $76,000. The dollar index climbed to its highest level since July on the belief that Trump's proposed tariffs against major U.S. trading partners would boost the greenback. The 10-year Treasury yield jumped to around 4.43% on speculation Trump's proposed tax cuts and other spending plans would spark economic growth, but also widen the fiscal deficit and reignite inflation.
Shares of Trump Media & Technology Group, a social media company closely tied to Trump, finished up 5.9% after a volatile trading session.
In the race for Congress, NBC News projects that Republicans will win back the Senate. Leading up to election, Democrats were expected to take control of the House, but so far it was still up for grabs, leaving open the possibility of a so-called red sweep. A Republican wave could lead to more drastic spending changes or a big revamp of tax policy.
""It looks like a Trump presidential win but also a win for Republicans in House and Senate. If that happens, you're going to see the U.S. economy really taking off,"" Mark Mobius, Mobius Emerging Opportunities Fund chairman, told CNBC early Wednesday.
The Dow, S&P 500 and Nasdaq Composite all set new closing highs on Wednesday in the aftermath of Trump's election victory.
— Jesse Pound
So-called ""legacy"" carmakers Ford Motor and General Motors are ""well positioned"" to benefit from likely policies enacted by the incoming Trump administration, Bank of America analysts led by John Murphy wrote Wednesday.
The reason is that Ford and GM's ""very profitable"" core business of making pickup trucks would have been pressured by steps to ""decarbonize"" and shift to an electric vehicle lineup by the end of the decade under current rules, but is more likely to thrive under ""softer regulation,"" BofA said.
To be sure, higher tariffs on imported components or vehicles from Mexico pose some risk to Ford and GM, given their direct and indirect exposure there, the analysts wrote. Electric vehicle manufacterers face slower demand thanks to ""less pressure to go electric"" and smaller government incentives.
Rivian and Lucid shares already reflect that outlook, while Tesla is likely to face fewer challenges ""since it has already reached profitability and will introduce more entry level products that could be attractive for the larger public."" Ford, GM, Tesla and Rivian are rated buy and Lucid is a neutral at BofA.
— Scott Schnipper
President-elect Donald Trump's aggressive tariff policy may not be set in stone yet, according to JPMorgan's Michael Feroli.
""We think odds of a 10% across-the-board tariff in 2025 are low, in part for procedural reasons,"" the analyst wrote in a Wednesday note. ""China, on the other hand, is likely to face significantly higher effective tariffs.""
Throughout his campaign, the former president has vowed to implement across-the-board tariffs of 10% to 20% on imports entering the U.S. Meanwhile, for Chinese goods, he's proposed a levy of between 60% to 100%.
— Sean Conlon
Here is how stocks can perform into year-end, now that markets have gotten past the election, according to Goldman Sachs' Scott Rubner.
Historically speaking, stocks rally into year-end from Election Day. However, the S&P 500 and Russell 2000 perform even better during presidential election years, while the Nasdaq Composite does worse.
Take a look at their historical performance between Nov. 5th through Dec. 31st.
— Sarah Min
Semiconductor stocks advanced Wednesday amid the broader market's rally following the election of Donald Trump.
Nvidia jumped more than 4%, helping push the VanEck Semiconductor ETF (SMH) higher by 2.4%. Advanced Micro Devices rose 1.7%.
— Hakyung Kim
Shares of Coinbase surged more than 26%, putting the crypto exchange on pace for its best day on record back to its direct listing in April 2021, when it gained 31% from its reference price on its first day of trading as a public company.
The rally came amid a broad rally in risk assets as Donald Trump was declared the winner of the U.S. presidential election for a second term. Bitcoin jumped about 7% and hit a new all-time high above $75,000.
""We expect the entire crypto sector to benefit from the Trump win, but the largest positive impact on COIN & HOOD,"" Needham analyst John Todaro said in a note Wednesday. ""On the back of this, we expect HOOD in the medium term to launch more crypto products as well as COIN and would expect more favorable outcomes on the SEC cases.""
Robinhood shares rose 18%.
— Tanaya Macheel, Nick Wells
These are the stocks moving the most in midday trading:
Super Micro Computer — Shares plunged 24% after the embattled computer server maker guided for revenue in its December quarter between $5.5 billion and $6.1 billion, missing analysts' expectations.
Donald Trump trades — Individual stocks viewed as trades tied to Donald Trump's election odds surged as the Republican clinched a return to the White House. Trump Media & Technology, majority owned by Trump himself, popped nearly 5%. Tesla, whose CEO publicly backed the President-elect, surged more than 14%.
Crypto stocks — Cryptocurrency-related names soared after investors bet that a Trump presidency would lead to a more supportive regulatory environment. Shares of Coinbase surged 28% and MicroStrategy rose about 12%, as bitcoin rallied to a new record high.
Read the full list of stocks moving here.
— Lisa Kailai Han
The excitement around potential lessened regulations for U.S. banks may be getting a little ahead of itself, said Jason Browne, president at Alexis Investment Partners.
""I certainly wouldn't chase regional banks up 10% here, and I think banks in general, financials in general, were already starting to [get] a little bit of a Trump rally [ahead of the election],"" Browne said.
The SPDR S&P Regional Bank ETF (KRE) continued to climb in midday trading and is now up about 12%.
Browne added that investors would likely benefit from sticking to a well-diversified portfolio going forward, though he did say that energy stocks are ""little bit of a layup"" under a Republican regime.
— Jesse Pound
The macroeconomic environment remains favorable for risk-taking, BMO Wealth Management chief investment officer Yung-Yu Ma said Wednesday. But overall market enthusiasm could get tempered by more details about new tariff policies or a rise in Treasury yields, he added.
""Stocks are surging, reminiscent of the post-election boost in 2016, but there are distinct differences that are likely to limit the extent of the rally, since control of the House is still up in the air and is likely to be controlled by Republicans by a very slim margin,"" Ma wrote in a note to clients. ""There is also uncertainty over tariffs, which is driving up long-term interest rates, and while current bond yields are not concerning, a run to 5% on the 10-year Treasury has been a level that gave markets pause in the recent past.""
Treasury yields jumped on Wednesday, with the 10-year recently up 15 basis points to trade at 4.439%, hitting its highest level since July.
— Pia Singh
Financial stocks as a group are attractive in the wake of former President Donald Trump's election victory Tuesday, but the most attractive subset of stocks in the group are those geared to the capital markets, according to a Wolfe Research note Wednesday written premarket by Rob Ginsburg and Read Harvey.
""Financials remain one of the strongest sectors in the market, up 24% YTD, outpacing the S&P and all other sectors but Communication Services,"" the analysts wrote. Most recently, financials ""had been lackluster"" after rallying earlier in the year, but ""the longer-term trend remains in great shape.""
Capital markets stocks inside the group remain the leaders, however, climbing 30% year to date before Wednesday, Wolfe said. Goldman Sachs is 54% higher in 2024 while Morgan Stanley has jumped 40% this year. Wolfe highlighted two other lagging stocks as potential portfolio additions: S&P Global Inc. and Artisan Partners Asset Management, up 9% and 8% respectively in 2024.
The capital markets group ""has carved out a compelling base on a relative basis over the past decade. If this can remain intact and breakout like we think, the group should only extend its outperformance in years ahead,"" Wolfe said.
— Scott Schnipper
Stocks roared on Wednesday on the heels of Donald Trump winning a second term in the White House – and further upside is ahead, according to Goldman Sachs chief U.S. equity strategist David Kostin.
""Robust earnings growth should drive continued equity market appreciation into next year,"" he wrote in a Wednesday note. ""We forecast EPS growth of 11% in 2025 and 7% in 2026, although those estimates may change as the new administration's policy agenda comes into clarity.""
Kostin's team is keeping its 12-month S&P 500 target of 6,300, suggesting upside of about 9% from Tuesday's close.
The magnitude of the rally in stocks could be curtailed by a sharp rise in the 10-year Treasury yield, the strategist said. The benchmark yield rose more than 17 basis points to about 4.46% Wednesday. Kostin noted that the yield hit a low of 3.62% in mid-September before climbing 80 basis points to current levels. ""All-else equal, a backup in rates of that size would typically be accompanied by a decline in equity prices,"" he wrote.
–Darla Mercado
The dollar index jumped 1.7% to 105.13 Wednesday following Donald Trump's victory in the U.S. presidential election.
On a technical level, the dollar has cleared the 104 resistance level, leaving the 106-107 level as the next major hurdle to overcome.
""Momentum is confirming the breakout but is overbought short-term. Support for pullbacks sets up at 104 and the 200-day moving average at 103.85,"" said LPL Financial chief technical strategist Adam Turnquist.
Turnquist added that continued dollar strength could pressure international stocks, particularly emerging markets.
— Hakyung Kim
S&P 500 Midcaps hit a new intraday all-time high led by financials, with some tech and steel stocks also boosting the index.
Midcap stocks advanced 3.3%, on track for a four-day win streak and on pace for its best day going back to Nov. 2023.
Shares of Texas-based International Bancshares and investment banking firm Evercore rallied 14% and 12%, respectively. Synovus Financial shares gained roughly 14%.
Steelmaker Cleveland-Cliffs surged 13%, while IT security company Qualys gained 14%.
— Sarah Min, Gina Francolla
Wednesday's surge in stocks is not just a reaction to a Trump victory, but also a relief that the election outcome is clear, said Edward Jones senior investment strategist Angelo Kourkafas.
""A decisive win removes the overhang of an unclear or a contested outcome. And that by itself clears some of the uncertainty and is helping that strong reaction we are seeing in the markets,"" Kourkafas said.
However, the rally could lose some steam in the coming days as the excitement wears off, he cautioned.
""We tend historically to see markets overreact the day after the election, so it wouldn't be surprising if some of the initial optimism fades in the coming days,"" Kourkafas added.
— Jesse Pound
The Financial Select Sector SPDR Fund (XLF) rose more than 4%, putting it on track for its best day since Nov. 10, 2022, when it advanced 5.1%. The fund also hit a new all-time high during the session, beating its prior high of $47.81 that was reached on Oct. 17.
The move was led by gains in credit card firms. Discover Financial Services and Capital One Financial are slated for their best days since March 24, 2020, and April 6, 2020, respectively, with both likewise reaching a fresh all-time high. Synchrony Financial is also on track for its best day since April 6, 2020 – the best day in its history when it jumped 16.9%.
— Sean Conlon, Nick Wells
Solar stocks sold off Wednesday after Donald Trump secured a second trip to the White House and Republicans won control of the Senate, amid fears the Inflation Reduction Act, which helps fund clean energy manufacturing in the U.S., will be repealed.
The benchmark Invesco Solar ETF was down more than 12% in morning trading, while the iShares Global Clean Energy ETF was down nearly 8%.
Solar panel manufacturer First Solar tumbled about 12%. Residential solar stocks Sunrun and Sunnova fell nearly 25% and 40%, respectively.
Inverter manufacturers Enphase and SolarEdge tumbled about 14% and about 17%, respectively. Sun tracker manufacturers Nextracker and Array were down about 10% and 18%, respectively.
The future of the IRA, however, will depend on whether Republicans also win unified control of Congress. It remains unclear whether the GOP will secure a majority in the House of Representatives.
— Spencer Kimball
Two leading credit card companies were among the top performing stocks in the S&P 500 in early trading, according to FactSet.
Shares of Discover Financial jumped 22%, while Capital One popped about 17%.
The moves came as part of a broad rally for financial stocks after Trump's victory.
— Jesse Pound
U.S. stocks surged when trading began at 9:30 a.m. ET. Both the Dow and the S&P 500 set new intraday record highs in the opening moments of trading.
The small cap benchmark Russell 2000 popped 4%.
— Jesse Pound
Check out the companies making headlines before the stock market opens:
For the full list, read here.
— Pia Singh
The iShares China Large-Cap ETF (FXI) dropped more than 2% in the premarket after Donald Trump defeated Vice President Kamala Harris in the U.S. presidential election. Trump's victory stoked fears of higher tariffs on Chinese imports into the U.S.
— Fred Imbert",2024-11-05T23:01:25+0000,2024-11-05 23:01:25+00:00,meta_article,2024-11-05 23:01:25+00:00,https://www.cnbc.com/amp/2024/11/05/stock-market-today-live-updates.html,4.19,4.26,4.44,1.99,2.32,2.27,0.0699999999999994,1.8842857142857103,2.719472461284833,3.2859356193500444,2.5878034125423,2.980710120125618,0.980710120125618,4.2,107.33333333333331,7566.0,227000.0,0.5,0.0,1.9,0.84,2.86,2.02,4.64,0.0,0,20.49,medium,0.91,-1.0219992571634973,,1.8176694377906255,-1.9807633856317897,1.675319883250088,1.3776461180108557,0.508136067816034,0.0,,,0.0282044086589918,,
o3p4q5r6,BOJ raises benchmark interest rate outlines roadmap for trimming bond buying program,https://www.cnbc.com/2024/07/31/boj-raises-benchmark-interest-rate-outlines-roadmap-for-trimming-bond-buying-program.html,hard_news,37,https://www.cnbc.com/2024/07/31/boj-raises-benchmark-interest-rate-outlines-roadmap-for-trimming-bond-buying-program.html,"Japan's central bank has raised its benchmark interest rate to ""around 0.25%"" from its previous range of 0% to 0.1% and outlined its plan to taper its bond buying program.
This would mark the Bank of Japan's highest interest rates since 2008.
But the Bank of Japan said it expects real interest rates to remain ""significantly negative,"" adding that ""accommodative financial conditions will continue to firmly support economic activity.""
The central bank forecasts that the core inflation rate — which strips out prices of fresh food — will reach 2.5% by the end of the 2024 fiscal year, and ""around 2%"" for the 2025 and 2026 fiscal years.
The BOJ said it will continue to raise the policy interest rate and adjust the degree of monetary accommodation, assuming its economic outlook is realized.
Japan's fiscal year runs from April 1 to March 31, which means the 2024 fiscal year will end on March 2025.
The Bank of Japan said that it will reduce the monthly outright purchases of Japanese government bonds to about 3 trillion yen ($19.64 billion) per month in the January to March 2026 quarter. As of its March release, the bank said that purchases of JGB's amounted to about 6 trillion yen per month.
The amount is now planned to be cut by around 400 billion yen per quarter, the BOJ added, which will bring the total JGB holdings down by about 7% to 8% by the 2026 fiscal year. The BOJ's JGB holdings currently stand at a whopping 579 trillion yen as of July 19, according to CNBC's calculations.
However, the central bank emphasized that it will be flexible in this plan and will conduct an interim assessment of the reduction plan at the June 2025 meeting.
""The Bank will make nimble responses by, for example, increasing the amount of JGB purchases,"" and added that it is ""prepared to amend the plan at the MPMs, if deemed necessary.""
Following the decision, both the Nikkei 225 and the Topix gained 0.28% and 0.51% respectively, while the Japanese yen strengthened marginally to 152.72.
'Virtuous cycle' intensifying
In its statement, the BOJ pointed out that Japan's economic activity and prices have been developing ""generally in line with the outlook presented"" in April.
The central bank noted that moves to raise wages have not only been seen in large firms, but have also spread to smaller firms.
The Japanese Trade Union Confederation, commonly known as Rengo, said on July 3 that big firms with 300 or more union-backed employees had raised wages by 5.19%, while small firms had increased pay by 4.45%. This marked the largest wage hike in 33 years, the union said.
The BOJ has repeatedly stated that it aims to form a ""virtuous cycle"" of increasing prices and wages.
The central bank said business fixed investment has been on a ""moderate increasing trend"" and corporate profits have been improving, while private consumption has been resilient despite the impact of price rises and other factors.
In light of these factors, the central bank slightly lowered its GDP growth forecast for the 2024 fiscal year to a range of 0.5%-0.7%, down from April's forecast of 0.7%-1%. This was due to previously announced downward revisions of the 2023 GDP numbers.
Both GDP and inflation expectations for the 2025 and 2026 fiscal year remained largely similar.",2024-07-31T04:00:11+0000,2024-07-31 04:00:11+00:00,meta_article,2024-07-31 04:00:11+00:00,https://www.cnbc.com/2024/07/31/boj-raises-benchmark-interest-rate-outlines-roadmap-for-trimming-bond-buying-program.html,4.29,4.09,4.35,1.85,2.13,2.24,-0.2000000000000001,1.83173913043478,2.941475793558302,3.2301916105644812,2.594376777467322,2.8062163337682744,0.8062163337682744,4.2,72.66666666666667,7426.0,237250.0,0.5,0.0,3.3,0.97,3.25,2.28,5.33,1.0,0,16.36,medium,3.4399999999999995,-1.114505402414523,,-5.43374642516683,-7.233751202648486,1.4107418747649123,1.3475103158427482,0.7072632342040697,0.0,104.46,-0.0287108814240608,0.019878765235472,high,down
