id,title,link,gt_content_type,gt_event_number,actual_link,full_text,article_published_raw,article_published_utc,found_via,published_utc,url,us_2yr_yield,us_10yr_yield,us_30yr_yield,real_yield_10yr,breakeven_5yr,breakeven_10yr,yield_curve_2s10s,us_de_2yr_spread,cpi_yoy,core_cpi_yoy,pce_yoy,core_pce_yoy,pce_gap,unemployment_rate,nfp_3m_avg,jolts_openings,initial_claims_4wma,sahm_indicator,retail_sales_mom,gdp_qoq,ig_oas,hy_oas,hy_ig_spread,fed_funds_rate,regime_flag,months_since_last_change,vix,vix_regime,vix_20d_change,sp500_20d_return,gold_20d_return,wti_20d_return,copper_3m_return,dxy_zscore_52w_broad,dxy_pct_above_200d_broad,dxy_20d_return_broad,cftc_net_usd_zscore,Open_15m,pct_15m,sd_15m,true_criticality,true_direction
168,What Trumps return to the White House may mean for global bond yields,https://www.cnbc.com/2024/11/20/what-trumps-return-to-the-white-house-may-mean-for-global-bond-yields.html,analysis,32,https://www.cnbc.com/2024/11/20/what-trumps-return-to-the-white-house-may-mean-for-global-bond-yields.html,"Donald Trump's U.S. election victory has ratcheted up concerns about higher prices, prompting strategists to rethink the outlook for global bond yields and currencies.
It is widely thought that the president-elect's pledge to introduce tax cuts and steep tariffs could boost economic growth — but widen the fiscal deficit and refuel inflation.
Trump's return to the White House is seen as likely to throw a wrench in the Federal Reserve's rate-cutting cycle, potentially keeping an upward bias on Treasury yields. Bond yields tend to rise when market participants expect higher prices or a growing budget deficit.
Alim Remtulla, chief foreign exchange strategist at EFG International, said it would be ""untenable"" for the Fed to continue with its easing plans while yields rise.
""Eventually, either the Fed has to pause rate cuts as the economy is no longer at risk of recession or the economy turns and yields implode as recession looms,"" Remtulla told CNBC via email.
""Trump's election advances both possibilities as a trade war and increased fiscal spending work at cross purposes,"" he added.
The benchmark U.S. 10-year Treasury yield has risen sharply since Trump's election victory over Democratic nominee Kamala Harris in early November, before paring gains in recent days.
The 10-year Treasury yield traded more than 3 basis points higher at 4.4158% on Wednesday morning. Yields and prices move in opposite directions. One basis point equals 0.01%.
European bond market offers 'more compelling value'
""In Europe, there's been a slight reprieve on not-as-bad-as-expected data but also on the realization that Trump policies will take a quarter or two to enact,"" EFG International's Remtulla said.
""There's also a possibility that rhetoric out of the Trump campaign was for election purposes and that he'll govern closer to the status quo. This would also help the euro zone avoid recession and lift [the euro],"" he added.
Germany's 10-year bond yield, the benchmark for the euro zone, stood at 2.337% on Wednesday, marginally lower for the session. The yield on 2-year bunds, meanwhile, was up by around 1 basis point at 2.151%.
Shannon Kirwin, associate director of fixed income ratings at Morningstar, said a significant chunk of investors were hoping for European bonds to hold up ""fairly well"" in the coming years, while the euro is expected to weaken.
""Even before the U.S. election, the consensus among the bond fund managers I have spoken with was that the European bond market offered more compelling value than the U.S. market,"" Kirwin told CNBC via email.
""As a result, many managers had already positioned their portfolios to be slightly tilted towards European credit and away from US corporate bonds,"" she added.
Read more
In an effort to raise U.S. revenues, Trump has suggested he could impose a blanket 20% tariff on all goods imported into the country, with a tariff of up to 60% for Chinese products and one as high as 2,000% on vehicles built in Mexico.
For the European Union, meanwhile, Trump has said the 27-nation bloc will pay a ""big price"" for not buying enough American exports.
""We're hearing managers in both markets say they prefer to keep a bit of powder dry — for example by going up in quality or choosing to own a bit more cash than usual — in order to be able to take advantage of potential volatility down the road,"" Kirwin added.
What about Asia?
Sameer Goel, global head of emerging markets research at Deutsche Bank, told CNBC's ""Street Signs Asia"" on Tuesday that the escalating risk of higher U.S. inflation under a second Trump presidency doesn't appear to have been priced in just yet.
Asked how Trump 2.0 could impact Asian economies and regional currencies, Goel said it was likely to lead to widening inflation gaps between the U.S. and Asia, which could then trigger further currency weakness.
""I guess, as always, different strokes as far as individual central banks and countries are concerned but I think there are more crosscurrents than offsetting here because tariffs could well end up being a lot more disruptive and damaging on growth,"" Goel said.
""On the other hand, it could be inflationary depending upon where energy prices go or alternative issues like currency weakness, which could feed back in for some countries more than it would be for elsewhere,"" he added.
For Asian currencies, analysts at MUFG said investors were yet to fully price in the potential scale of U.S. tariffs on China and elsewhere.
A 60% tariff on Chinese products, for instance, would require a 10% to 12% depreciation of the Chinese yuan against the U.S. dollar, analysts at MUFG said in a research note published on Nov. 7. They warned the potential for tariff retaliation could make matters worse and there's also a risk of other countries raising tariffs on China products.
Asian currencies with higher exposure to China were thought to be more vulnerable to Trump tariffs, analysts at MUFG said, citing the Singapore dollar, Malaysian ringgit and South Korean won.
Currency outlook
Strategists at Dutch bank ING said in a research note published earlier this month that there is a tendency in financial markets to do ""a lot of second-guessing"" over possible outcomes.
""Our advice is not to overthink it and instead take the firm view that the new administration's plans for looser fiscal and tighter immigration policy, when combined with relatively higher US rates and protectionism, all make a strong case for a dollar rally,"" strategists at ING said in a note published Nov. 13.
""Yes, the US economy may end up overheating — but 2025 should be the year when more air gets pumped into any potential dollar bubble,"" they added.
European currencies, meanwhile, are expected to underperform.
Strategists at ING said they estimate a peak of risk premium from late next year, which will mean that even if the euro can hold above parity with the U.S. dollar before then, ""we see all the conditions for a structural shift from a 1.05-1.10 range to a 1.00-1.05 range"" next year.
Scandinavian currencies such as Sweden's krona and Norway's kroner were likely to be vulnerable to downside risk, ING said, while Britain's pound sterling and the Swiss franc were poised to ""marginally outperform"" the euro.",2024-11-20T07:12:14+0000,2024-11-20 07:12:14+00:00,meta_article,2024-11-20 07:12:14+00:00,https://www.cnbc.com/2024/11/20/what-trumps-return-to-the-white-house-may-mean-for-global-bond-yields.html,4.31,4.41,4.59,2.06,2.43,2.35,0.1000000000000005,2.0042857142857096,2.719472461284833,3.2859356193500444,2.5878034125423,2.980710120125618,0.980710120125618,4.2,107.33333333333331,7566.0,218500.0,0.5,0.0,1.9,0.81,2.67,1.86,4.64,0.0,0,17.16,medium,-6.0,3.709786256999892,,-0.4742742167289426,-1.9807633856317897,2.8404971885617214,3.0523805674544935,1.667644240168964,0.0,106.3,0.009408222786707,0.0344473041763983,not high,up
169,Trump vs the bond market the real battle to watch in 2025,https://www.cnbc.com/2024/11/13/trump-vs-the-bond-market-the-real-battle-to-watch-in-2025.html,analysis,35,https://www.cnbc.com/2024/11/13/trump-vs-the-bond-market-the-real-battle-to-watch-in-2025.html,"President-elect Donald Trump has lately made his feelings clear about Federal Reserve Chair Jerome Powell — whom Trump nominated for the job in 2017 — repeatedly criticizing Powell's approach to monetary policy. But the big battle to watch in the new year may instead be between the president-elect and the bond market. During his reelection campaign, Trump promised to implement broad tariffs on all imported goods, including especially high tariffs on goods from China. That position raised concern over a possible uptick in inflation — just when the Fed is cutting rates. Ultimately, it will be the bond market that will decide how much of the Trump economic agenda is implemented, according to BCA Research chief strategist Marko Papic. ""President Trump was not elected to generate more growth and inflation. ... He was elected to curb both,"" Papic wrote. ""As such, we expect both voters and bond yields to restrain Trump on fiscal policy, forcing a pivot towards laissez-faire. Bonds should cheer this outcome, but not before first forcing the pivot."" Treasurys sold off in the lead-up to last week's election. The 10-year Treasury note yield was last at 4.431%, up more than 80 basis points since mid-September, when the benchmark yield traded at 3.62%. US10Y YTD mountain 10-year Treasury yield in 2024 It's not clear how receptive Trump will be to cues from the bond market. After all, he's heading back to the White House following a resounding electoral win. Elsewhere on Wall Street this morning, UBS upgraded 3M to buy from neutral. The bank also laid out a 12-month price target implying more than 40% upside for the industrial giant. ""We see the potential for its new CEO to drive meaningful change at this 120-year-old company,"" UBS told clients in a note. ""These changes can drive improvement in organic sales growth and [operating] margin, which will drive EPS upside and justify a better multiple on the underlying company than is currently implied in the stock price.""",2024-11-13T13:58:51+0000,2024-11-13 13:58:51+00:00,meta_article,2024-11-13 13:58:51+00:00,https://www.cnbc.com/2024/11/13/trump-vs-the-bond-market-the-real-battle-to-watch-in-2025.html,4.27,4.44,4.63,2.09,2.42,2.35,0.1700000000000008,1.9642857142857095,2.719472461284833,3.2859356193500444,2.5878034125423,2.980710120125618,0.980710120125618,4.2,107.33333333333331,7566.0,221250.0,0.5,0.0,1.9,0.78,2.64,1.86,4.64,0.0,0,14.02,low,-5.059999999999999,3.021071075723003,,-2.57863417398696,-1.9807633856317897,3.2360266976246757,3.238058804885302,1.963253547630095,0.0,105.84,0.0,0.0306940661801417,not high,down
172,European Central Bank hikes rates to record level September 2023,https://www.cnbc.com/2023/09/14/european-central-bank-hikes-rates-to-record-level.html,hard_news,36,https://www.cnbc.com/2023/09/14/european-central-bank-hikes-rates-to-record-level.html,"The European Central Bank on Thursday announced a 10th consecutive hike in its main interest rate, as the fight against inflation took precedence over a weakening economy.
Rate rises have now hauled the central bank's main deposit facility from -0.5% in June 2022 to a record 4%. A key reason for the hike Thursday appeared to be upward revisions in newly published staff macroeconomic projections for the euro area, which see inflation averaging at 5.6% this year from a prior forecast of 5.4%, and 3.2% next year from a previous forecast of 3%.
However, it nudged its closely watched medium-term forecast lower, from 2.2% to 2.1%.
In a market-moving statement, it also indicated that further hikes may be off the table for now.
""Based on its current assessment, the Governing Council considers that the key ECB interest rates have reached levels that, maintained for a sufficiently long duration, will make a substantial contribution to the timely return of inflation to the target,"" it said.
""The Governing Council's future decisions will ensure that the key ECB interest rates will be set at sufficiently restrictive levels for as long as necessary.""
The euro fell sharply on the announcement and was down 0.5% against the U.S. dollar at $1.0686 at 3 p.m. Frankfurt, Germany, time, trading at a three-month low.
European stocks rallied following cautious trading through the morning, meanwhile, with the benchmark Stoxx 600 index up by 1.1%.
The ECB move on Thursday also takes the interest rates on its main refinancing operations and marginal lending facility 25 basis points higher, to 4.5% and 4.75%, respectively.
Staff also lowered economic growth projections for the euro area from 0.9% to 0.7% expansion in 2023, from 1.5% to 1% in 2024, and from 1.6% to 1.5% in 2025.
While the ECB has firmly signaled its next moves in previous meetings, economists and analysts were divided over whether the doves or hawks in Frankfurt would win out at this September's meeting. Money markets indicated a roughly 63% chance of a hike through Thursday morning, up from a more even split in recent days.
Oil market reports suggesting tighter supply and higher prices through the rest of the year and beyond have fueled inflation fears, along with signs of wage growth. A Reuters article on Wednesday reporting the ECB now expects euro zone inflation to remain above 3% in 2024 appeared to increase market bets on a rate hike. The report came from a source ahead of the release of its projection Thursday.
""Some [Governing Council] members did not draw the same conclusion, and some governors would have preferred to pause and reserve future decisions once more certainty, more intelligence, would have resulted from the passing of time and the impact of our many previous decisions,"" ECB President Christine Lagarde told CNBC's Annette Weisbach in the news conference following the announcement.
""But I can tell you there was a solid majority of the governors to agree with the decision we have made.""
Lagarde said there was no concrete answer to whether rate hikes were finished since the Governing Council remains data dependent — but she stressed the ECB's current thinking was encapsulated in the statement around rates at current levels making a ""substantial contribution"" to the fight against inflation if held for long enough.
Peter Schaffrik, chief European macro strategist at RBC Capital Markets, told CNBC that market focus would not so much be on the hike itself, but rather the language used by the central bank in its statement.
Schaffrik said one focus will be on the 2025 inflation forecast, which unlike forecasts for 2023 and 2024 was revised lower, since this is typically what the ECB means when it talks about the medium term —a key metric.
Another will be on its descriptor of rates being maintained for a ""sufficiently long duration"" — indicating the ""path forward is flat for quite some time,"" he said.
Economic slump
Headline consumer price inflation in the euro zone was 5.3% in August, the same level as core inflation, which strips out food and energy costs.
Europe's biggest economy has shown continued deterioration, with business sentiment plummeting and services now declining along with manufacturing.
Germany is forecast to be the only major European economy to contract this year — though the wider picture is also downbeat, with euro zone business activity declining in August to its lowest level since November 2020.",2023-09-14T12:17:05+0000,2023-09-14 12:17:05+00:00,meta_article,2023-09-14 12:17:05+00:00,https://www.cnbc.com/2023/09/14/european-central-bank-hikes-rates-to-record-level.html,5.0,4.29,4.39,1.95,2.27,2.34,-0.71,2.33857142857143,3.687206638119256,4.128747996485882,3.4488928270185903,3.687774208035388,1.687774208035388,3.7,179.0,9259.0,231000.0,0.3000000000000002,0.0,4.7,1.23,3.78,2.55,5.33,2.0,0,12.82,low,-2.859999999999999,2.2559360466304135,,12.004473716913132,-2.359004475360005,1.4445337232364917,1.3325959971921764,0.6022551792866704,0.0,105.27,0.3622842978358236,0.0248378634416828,high,up
176,Bank of Japan hikes policy rates by 25 basis points to highest since 2008 January 2025,https://www.cnbc.com/2025/01/24/bank-of-japan-hikes-policy-rates-by-25-basis-points-to-highest-since-2008.html,hard_news,37,https://www.cnbc.com/2025/01/24/bank-of-japan-hikes-policy-rates-by-25-basis-points-to-highest-since-2008.html,"The Bank of Japan hiked rates by 25 basis points Friday to 0.5%, bringing its policy rate to the highest level since 2008, as it seeks to normalize its monetary policy amid signs of sustained inflation and rising wages.
The move comes in line with expectations from CNBC's survey, where an overwhelming majority of economists predicted a hike.
The BOJ in its statement revealed that the decision was a 8-1 split, with board member Toyoaki Nakamura dissenting on raising rates.
Nakamura said the central bank should only tweak policy after confirming a rise in firms' earning power from reports that would be out by the next monetary policy meeting.
Following the decision, the Japanese yen strengthened 0.6% to trade at 155.12 against the dollar, while country's benchmark Nikkei 225 stock index rose marginally.
The yield on the 10-year Japanese government bonds climbed 2.5 basis points to 1.23%.
The Bank of Japan has long stated that a ""virtuous cycle"" where higher salaries fuel growth in prices was needed for it to raise rates.
Before the meeting, senior BOJ officials, including governor Kazuo Ueda and Deputy Governor Ryozo Himino, had indicated the central bank's willingness to raise rates.
Wages in focus
The BOJ will be watching closely the ""shunto"" wage negotiations, and hopes to see ""strong wage hikes"" in the 2025 fiscal year, Himino said in a speech to business leaders on Jan. 14.
In its Friday statement, the central bank noted that there were ""many views expressed by firms stating that they will continue to raise wages steadily in this year's annual spring labor-management wage negotiations, following the solid wage increases last year,"" due to improving corporate profits and a tight labor market.
The head of Japanese Trade Union Confederation — Rengo — said that annual pay increases this year must exceed the 5.1% secured last year because real wages continue to fall, Reuters reported.
President Tomoko Yoshino said Rengo was formally seeking wage increases of at least 5% in this year's ""shunto"" wage negotiations, and is targeting hikes of at least 6% for smaller firms to narrow the income gap with workers at bigger companies.
BOJ pointed out that with wages continuing to rise, underlying inflation had been increasing gradually toward 2%.
CPI numbers released earlier Friday showed headline inflation hit its highest since January 2023 at 3.6%, year on year, in December. Core inflation rose to a 16-month high of 3%.
BOJ forecast that the headline inflation rate was likely to be at around 2.5% for its fiscal year ending March 2026, due factors such as higher import prices stemming from the yen's depreciation.
More rate hikes?
In a note on Jan. 21, Vincent Chung, co-portfolio manager for diversified income bond strategy at T. Rowe Price, said that moving forward, a rate increase will be followed by ""a series of gradual hikes, potentially bringing the policy rate to 1% by the end of the year.""
He added that the policy rate could even exceed 1%, as this is closer to the lower end of the BOJ's neutral rate range.
In September, BOJ board member Naoki Tamura said the neutral rate ""would be at least around 1 percent,"" although BOJ does not have an official neutral rate forecast.
Chung noted that while Japanese officials have indicated that yen volatility has been significant, any substantial currency intervention akin to last year seems unlikely.
Last July, the yen hit its weakest level against the dollar since 1986, reaching 161.96. Japanese authorities later confirmed that they spent 5.53 trillion yen, or $36.8 billion, to shore up the yen in July.
Japan spent over 15.32 trillion yen ($97.06 billion) to shore up the currency over the course of 2024.
Chung said inflation in the U.S. might increase later this quarter, and coupled with sustained economic growth, this could exert upward pressure on yields, which could strengthen the dollar — weakening the yen.
""Investors should also consider that with potential major policy shifts in trade and the Fed nearing a pause, the two-sided risk to growth is likely greater this year than in 2024. Consequently, we expect realized volatility in USD/JPY to remain high in 2025,"" he said.",2025-01-24T03:28:19+0000,2025-01-24 03:28:19+00:00,meta_article,2025-01-24 03:28:19+00:00,https://www.cnbc.com/2025/01/24/bank-of-japan-hikes-policy-rates-by-25-basis-points-to-highest-since-2008.html,4.27,4.63,4.85,2.2,2.52,2.43,0.3600000000000003,1.7863636363636397,2.9909783078999608,3.282970485398584,2.607379530393517,2.7801380994415092,0.7801380994415092,4.0,107.66666666666669,7431.0,215000.0,0.1,-1.0564360082546131,-0.6,0.8,2.6,1.8,4.33,,0,14.85,low,-1.2799999999999994,2.6717846282774627,,0.4421221864951752,-1.0913363360916528,1.1898948632395057,2.12062184897035,-1.539085463119949,0.0,,,0.0259659623334868,,
